\set VERBOSITY terse
SET citus.next_shard_id TO 1508000;
SET citus.shard_replication_factor TO 1;
SET citus.enable_local_execution TO ON;
SET citus.log_local_commands TO ON;
CREATE SCHEMA citus_local_tables_mx;
SET search_path TO citus_local_tables_mx;
-- ensure that coordinator is added to pg_dist_node
SET client_min_messages to ERROR;
SELECT 1 FROM master_add_node('localhost', :master_port, groupId => 0);
 ?column?
---------------------------------------------------------------------
        1
(1 row)

RESET client_min_messages;
---------------------------------------------------------------------
-- triggers --
---------------------------------------------------------------------
CREATE TABLE citus_local_table (value int);
SELECT citus_add_local_table_to_metadata('citus_local_table');
 citus_add_local_table_to_metadata
---------------------------------------------------------------------

(1 row)

-- first stop metadata sync to worker_1
SELECT stop_metadata_sync_to_node('localhost', :worker_1_port);
NOTICE:  dropping metadata on the node (localhost,57637)
 stop_metadata_sync_to_node
---------------------------------------------------------------------

(1 row)

CREATE FUNCTION dummy_function() RETURNS trigger AS $dummy_function$
BEGIN
    RAISE EXCEPTION 'a trigger that throws this exception';
END;
$dummy_function$ LANGUAGE plpgsql;
CREATE TRIGGER dummy_function_trigger
BEFORE UPDATE OF value ON citus_local_table
FOR EACH ROW EXECUTE FUNCTION dummy_function();
NOTICE:  executing the command locally: SELECT worker_apply_shard_ddl_command (1508000, 'citus_local_tables_mx', 'CREATE TRIGGER dummy_function_trigger
BEFORE UPDATE OF value ON citus_local_table
FOR EACH ROW EXECUTE FUNCTION dummy_function();')
-- Show that we can sync metadata successfully. That means, we create
-- the function that trigger needs in mx workers too.
SELECT start_metadata_sync_to_node('localhost', :worker_1_port);
 start_metadata_sync_to_node
---------------------------------------------------------------------

(1 row)

CREATE EXTENSION seg;
ALTER TRIGGER dummy_function_trigger ON citus_local_table DEPENDS ON EXTENSION seg;
NOTICE:  executing the command locally: SELECT worker_apply_shard_ddl_command (1508000, 'citus_local_tables_mx', 'ALTER TRIGGER dummy_function_trigger ON citus_local_table DEPENDS ON EXTENSION seg;')
ALTER TRIGGER dummy_function_trigger ON citus_local_table RENAME TO renamed_trigger;
NOTICE:  executing the command locally: SELECT worker_apply_shard_ddl_command (1508000, 'citus_local_tables_mx', 'ALTER TRIGGER dummy_function_trigger ON citus_local_table RENAME TO renamed_trigger;')
ALTER TABLE citus_local_table DISABLE TRIGGER ALL;
NOTICE:  executing the command locally: SELECT worker_apply_shard_ddl_command (1508000, 'citus_local_tables_mx', 'ALTER TABLE citus_local_table DISABLE TRIGGER ALL;')
-- show that update trigger mx relation are depending on seg, renamed and disabled.
-- both workers should should print 1.
SELECT run_command_on_workers(
$$
SELECT COUNT(*) FROM pg_depend, pg_trigger, pg_extension
WHERE pg_trigger.tgrelid='citus_local_tables_mx.citus_local_table'::regclass AND
      pg_trigger.tgname='renamed_trigger' AND
      pg_trigger.tgenabled='D' AND
      pg_depend.classid='pg_trigger'::regclass AND
      pg_depend.deptype='x' AND
      pg_trigger.oid=pg_depend.objid AND
      pg_extension.extname='seg'
$$);
 run_command_on_workers
---------------------------------------------------------------------
 (localhost,57637,t,1)
 (localhost,57638,t,1)
(2 rows)

CREATE FUNCTION another_dummy_function() RETURNS trigger AS $another_dummy_function$
BEGIN
    RAISE EXCEPTION 'another trigger that throws another exception';
END;
$another_dummy_function$ LANGUAGE plpgsql;
-- Show that we can create the trigger successfully. That means, we create
-- the function that trigger needs in mx worker too when processing CREATE
-- TRIGGER commands.
CREATE TRIGGER another_dummy_function_trigger
AFTER TRUNCATE ON citus_local_table
FOR EACH STATEMENT EXECUTE FUNCTION another_dummy_function();
-- create some test tables before next three sections
-- and define some foreign keys between them
CREATE TABLE citus_local_table_1(l1 int);
SELECT citus_add_local_table_to_metadata('citus_local_table_1');
 citus_add_local_table_to_metadata
---------------------------------------------------------------------

(1 row)

CREATE TABLE reference_table_1(r1 int primary key);
SELECT create_reference_table('reference_table_1');
 create_reference_table
---------------------------------------------------------------------

(1 row)

ALTER TABLE citus_local_table_1 ADD CONSTRAINT fkey_local_to_ref FOREIGN KEY(l1) REFERENCES reference_table_1(r1) ON DELETE CASCADE;
NOTICE:  executing the command locally: SELECT worker_apply_inter_shard_ddl_command (1508001, 'citus_local_tables_mx', 1508002, 'citus_local_tables_mx', 'ALTER TABLE citus_local_table_1 ADD CONSTRAINT fkey_local_to_ref FOREIGN KEY(l1) REFERENCES reference_table_1(r1) ON DELETE CASCADE;')
CREATE TABLE citus_local_table_2(l1 int primary key);
SELECT citus_add_local_table_to_metadata('citus_local_table_2');
 citus_add_local_table_to_metadata
---------------------------------------------------------------------

(1 row)

CREATE TABLE reference_table_2(r1 int);
SELECT create_reference_table('reference_table_2');
 create_reference_table
---------------------------------------------------------------------

(1 row)

ALTER TABLE reference_table_2 ADD CONSTRAINT fkey_ref_to_local FOREIGN KEY(r1) REFERENCES citus_local_table_2(l1) ON DELETE RESTRICT;
NOTICE:  executing the command locally: SELECT worker_apply_inter_shard_ddl_command (1508004, 'citus_local_tables_mx', 1508003, 'citus_local_tables_mx', 'ALTER TABLE reference_table_2 ADD CONSTRAINT fkey_ref_to_local FOREIGN KEY(r1) REFERENCES citus_local_table_2(l1) ON DELETE RESTRICT;')
CREATE TABLE citus_local_table_3(l1 int);
SELECT citus_add_local_table_to_metadata('citus_local_table_3');
 citus_add_local_table_to_metadata
---------------------------------------------------------------------

(1 row)

CREATE TABLE citus_local_table_4(l1 int primary key);
SELECT citus_add_local_table_to_metadata('citus_local_table_4');
 citus_add_local_table_to_metadata
---------------------------------------------------------------------

(1 row)

ALTER TABLE citus_local_table_3 ADD CONSTRAINT fkey_local_to_local FOREIGN KEY(l1) REFERENCES citus_local_table_4(l1) ON UPDATE SET NULL;
NOTICE:  executing the command locally: SELECT worker_apply_inter_shard_ddl_command (1508005, 'citus_local_tables_mx', 1508006, 'citus_local_tables_mx', 'ALTER TABLE citus_local_table_3 ADD CONSTRAINT fkey_local_to_local FOREIGN KEY(l1) REFERENCES citus_local_table_4(l1) ON UPDATE SET NULL;')
-- check stats creation
CREATE TABLE citus_local_table_stats(a int, b int);
CREATE STATISTICS stx1 ON a, b FROM citus_local_table_stats;
SELECT citus_add_local_table_to_metadata('citus_local_table_stats');
 citus_add_local_table_to_metadata
---------------------------------------------------------------------

(1 row)

CREATE STATISTICS stx2 ON a, b FROM citus_local_table_stats;
NOTICE:  executing the command locally: SELECT worker_apply_shard_ddl_command (1508007, 'citus_local_tables_mx', 'CREATE STATISTICS citus_local_tables_mx.stx2 ON a, b FROM citus_local_tables_mx.citus_local_table_stats')
CREATE STATISTICS stx3 ON a, b FROM citus_local_table_stats;
NOTICE:  executing the command locally: SELECT worker_apply_shard_ddl_command (1508007, 'citus_local_tables_mx', 'CREATE STATISTICS citus_local_tables_mx.stx3 ON a, b FROM citus_local_tables_mx.citus_local_table_stats')
CREATE STATISTICS stx4 ON a, b FROM citus_local_table_stats;
NOTICE:  executing the command locally: SELECT worker_apply_shard_ddl_command (1508007, 'citus_local_tables_mx', 'CREATE STATISTICS citus_local_tables_mx.stx4 ON a, b FROM citus_local_tables_mx.citus_local_table_stats')
ALTER STATISTICS stx3 RENAME TO stx5;
NOTICE:  executing the command locally: SELECT worker_apply_shard_ddl_command (1508007, 'citus_local_tables_mx', 'ALTER STATISTICS citus_local_tables_mx.stx3 RENAME TO stx5')
DROP STATISTICS stx4;
NOTICE:  executing the command locally: SELECT worker_apply_shard_ddl_command (1508007, 'citus_local_tables_mx', 'DROP STATISTICS citus_local_tables_mx.stx4')
SELECT stxname FROM pg_statistic_ext ORDER BY stxname;
   stxname
---------------------------------------------------------------------
 stx1
 stx1_1508007
 stx2
 stx2_1508007
 stx5
 stx5_1508007
(6 rows)

-- and switch to worker1
\c - - - :worker_1_port
SET search_path TO citus_local_tables_mx;
---------------------------------------------------------------------
-- foreign key from citus local table to reference table --
---------------------------------------------------------------------
-- show that on delete cascade works
INSERT INTO reference_table_1 VALUES (11);
INSERT INTO citus_local_table_1 VALUES (11);
DELETE FROM reference_table_1 WHERE r1=11;
-- should print 0 rows
SELECT * FROM citus_local_table_1 ORDER BY l1;
 l1
---------------------------------------------------------------------
(0 rows)

-- show that we are checking for foreign key constraint, below should fail
INSERT INTO citus_local_table_1 VALUES (2);
ERROR:  insert or update on table "citus_local_table_1_xxxxxxx" violates foreign key constraint "fkey_local_to_ref_1508001"
-- below should work
INSERT INTO reference_table_1 VALUES (2);
INSERT INTO citus_local_table_1 VALUES (2);
---------------------------------------------------------------------
-- foreign key from reference table to citus local table --
---------------------------------------------------------------------
-- show that we are checking for foreign key constraint, below should fail
INSERT INTO reference_table_2 VALUES (4);
ERROR:  insert or update on table "reference_table_2_1508004" violates foreign key constraint "fkey_ref_to_local_1508004"
-- below should work
INSERT INTO citus_local_table_2 VALUES (4);
INSERT INTO reference_table_2 VALUES (4);
---------------------------------------------------------------------
-- foreign key from citus local table to citus local table --
---------------------------------------------------------------------
-- show that we are checking for foreign key constraint, below should fail
INSERT INTO citus_local_table_3 VALUES (3);
ERROR:  insert or update on table "citus_local_table_3_xxxxxxx" violates foreign key constraint "fkey_local_to_local_1508005"
-- below shoud work
INSERT INTO citus_local_table_4 VALUES (3);
INSERT INTO citus_local_table_3 VALUES (3);
UPDATE citus_local_table_4 SET l1=6 WHERE l1=3;
-- show that it prints only one row with l1=null due to ON UPDATE SET NULL
SELECT * FROM citus_local_table_3;
 l1
---------------------------------------------------------------------

(1 row)

-- finally show that we do not allow defining foreign key in mx nodes
ALTER TABLE citus_local_table_3 ADD CONSTRAINT fkey_local_to_local_2 FOREIGN KEY(l1) REFERENCES citus_local_table_4(l1);
ERROR:  operation is not allowed on this node
-- check stats creation
CREATE TABLE citus_local_table_stats2(a int, b int);
CREATE STATISTICS stx8 ON a, b FROM citus_local_table_stats2;
SELECT citus_add_local_table_to_metadata('citus_local_table_stats2');
ERROR:  operation is not allowed on this node
CREATE STATISTICS stx9 ON a, b FROM citus_local_table_stats2;
DROP STATISTICS stx8;
DROP STATISTICS stx4;
ERROR:  statistics object "citus_local_tables_mx.stx4" does not exist
SELECT stxname FROM pg_statistic_ext ORDER BY stxname;
 stxname
---------------------------------------------------------------------
 stx1
 stx2
 stx5
 stx9
(4 rows)

\c - - - :master_port
SET search_path TO citus_local_tables_mx;
-- undistribute old tables to prevent unnecessary undistribute logs later
SELECT undistribute_table('citus_local_table', cascade_via_foreign_keys=>true);
NOTICE:  creating a new table for citus_local_tables_mx.citus_local_table
NOTICE:  moving the data of citus_local_tables_mx.citus_local_table
NOTICE:  dropping the old citus_local_tables_mx.citus_local_table
NOTICE:  renaming the new table to citus_local_tables_mx.citus_local_table
 undistribute_table
---------------------------------------------------------------------

(1 row)

SELECT undistribute_table('citus_local_table_3', cascade_via_foreign_keys=>true);
NOTICE:  creating a new table for citus_local_tables_mx.citus_local_table_3
NOTICE:  moving the data of citus_local_tables_mx.citus_local_table_3
NOTICE:  dropping the old citus_local_tables_mx.citus_local_table_3
NOTICE:  renaming the new table to citus_local_tables_mx.citus_local_table_3
NOTICE:  creating a new table for citus_local_tables_mx.citus_local_table_4
NOTICE:  moving the data of citus_local_tables_mx.citus_local_table_4
NOTICE:  dropping the old citus_local_tables_mx.citus_local_table_4
NOTICE:  renaming the new table to citus_local_tables_mx.citus_local_table_4
 undistribute_table
---------------------------------------------------------------------

(1 row)

SELECT undistribute_table('citus_local_table_stats', cascade_via_foreign_keys=>true);
NOTICE:  creating a new table for citus_local_tables_mx.citus_local_table_stats
NOTICE:  moving the data of citus_local_tables_mx.citus_local_table_stats
NOTICE:  dropping the old citus_local_tables_mx.citus_local_table_stats
NOTICE:  renaming the new table to citus_local_tables_mx.citus_local_table_stats
 undistribute_table
---------------------------------------------------------------------

(1 row)

-- verify that mx nodes have the shell table for partitioned citus local tables
CREATE TABLE local_table_fkey(a INT UNIQUE);
CREATE TABLE local_table_fkey2(a INT UNIQUE);
CREATE TABLE partitioned_mx (a INT UNIQUE) PARTITION BY RANGE(a);
ALTER TABLE partitioned_mx ADD CONSTRAINT fkey_to_local FOREIGN KEY (a) REFERENCES local_table_fkey(a);
CREATE TABLE IF NOT EXISTS partitioned_mx_1 PARTITION OF partitioned_mx FOR VALUES FROM (1) TO (4);
CREATE TABLE partitioned_mx_2 (a INT UNIQUE);
ALTER TABLE partitioned_mx ATTACH PARTITION partitioned_mx_2 FOR VALUES FROM (5) TO (8);
SELECT create_reference_table('local_table_fkey');
 create_reference_table
---------------------------------------------------------------------

(1 row)

CREATE TABLE partitioned_mx_3 (a INT UNIQUE);
ALTER TABLE partitioned_mx ATTACH PARTITION partitioned_mx_3 FOR VALUES FROM (9) TO (12);
-- these should error out since multi-level partitioned citus local tables are not supported
CREATE TABLE IF NOT EXISTS partitioned_mx_4 PARTITION OF partitioned_mx FOR VALUES FROM (13) TO (16) PARTITION BY RANGE (a);
ERROR:  distributing multi-level partitioned tables is not supported
BEGIN;
    CREATE TABLE partitioned_mx_4(a INT UNIQUE) PARTITION BY RANGE (a);
    alter table partitioned_mx attach partition partitioned_mx_4 FOR VALUES FROM (13) TO (16);
ERROR:  Citus doesn't support multi-level partitioned tables
END;
CREATE TABLE multi_level_p (a INT UNIQUE) PARTITION BY RANGE (a);
CREATE TABLE IF NOT EXISTS multi_level_c PARTITION OF multi_level_p FOR VALUES FROM (13) TO (16) PARTITION BY RANGE (a);
select citus_add_local_table_to_metadata('multi_level_p'); --errors
ERROR:  Citus does not support multi-level partitioned tables
select citus_add_local_table_to_metadata('multi_level_p', true); --errors
ERROR:  Citus does not support multi-level partitioned tables
-- try attaching a partition with an external foreign key
CREATE TABLE partitioned_mx_4 (a INT UNIQUE);
ALTER TABLE partitioned_mx_4 ADD CONSTRAINT fkey_not_inherited FOREIGN KEY (a) REFERENCES local_table_fkey2(a);
-- these two should error out
ALTER TABLE partitioned_mx ATTACH PARTITION partitioned_mx_4 FOR VALUES FROM (13) TO (16);
ERROR:  relation citus_local_tables_mx.partitioned_mx_4 is involved in a foreign key relationship with another table
ALTER TABLE partitioned_mx ATTACH PARTITION partitioned_mx_4 default;
ERROR:  relation citus_local_tables_mx.partitioned_mx_4 is involved in a foreign key relationship with another table
SELECT
    nmsp_parent.nspname AS parent_schema,
    parent.relname      AS parent,
    nmsp_child.nspname  AS child_schema,
    child.relname       AS child
FROM pg_inherits
    JOIN pg_class parent            ON pg_inherits.inhparent = parent.oid
    JOIN pg_class child             ON pg_inherits.inhrelid   = child.oid
    JOIN pg_namespace nmsp_parent   ON nmsp_parent.oid  = parent.relnamespace
    JOIN pg_namespace nmsp_child    ON nmsp_child.oid   = child.relnamespace
WHERE parent.relname='partitioned_mx'
ORDER BY child;
     parent_schema     |     parent     |     child_schema      |      child
---------------------------------------------------------------------
 citus_local_tables_mx | partitioned_mx | citus_local_tables_mx | partitioned_mx_1
 citus_local_tables_mx | partitioned_mx | citus_local_tables_mx | partitioned_mx_2
 citus_local_tables_mx | partitioned_mx | citus_local_tables_mx | partitioned_mx_3
(3 rows)

\c - - - :worker_1_port
SELECT relname FROM pg_class WHERE relname LIKE 'partitioned_mx%' ORDER BY relname;
        relname
---------------------------------------------------------------------
 partitioned_mx
 partitioned_mx_1
 partitioned_mx_1_a_key
 partitioned_mx_2
 partitioned_mx_2_a_key
 partitioned_mx_3
 partitioned_mx_3_a_key
 partitioned_mx_a_key
(8 rows)

SELECT
    nmsp_parent.nspname AS parent_schema,
    parent.relname      AS parent,
    nmsp_child.nspname  AS child_schema,
    child.relname       AS child
FROM pg_inherits
    JOIN pg_class parent            ON pg_inherits.inhparent = parent.oid
    JOIN pg_class child             ON pg_inherits.inhrelid   = child.oid
    JOIN pg_namespace nmsp_parent   ON nmsp_parent.oid  = parent.relnamespace
    JOIN pg_namespace nmsp_child    ON nmsp_child.oid   = child.relnamespace
WHERE parent.relname='partitioned_mx'
ORDER BY child;
     parent_schema     |     parent     |     child_schema      |      child
---------------------------------------------------------------------
 citus_local_tables_mx | partitioned_mx | citus_local_tables_mx | partitioned_mx_1
 citus_local_tables_mx | partitioned_mx | citus_local_tables_mx | partitioned_mx_2
 citus_local_tables_mx | partitioned_mx | citus_local_tables_mx | partitioned_mx_3
(3 rows)

\c - - - :master_port
SET search_path TO citus_local_tables_mx;
SET client_min_messages TO ERROR;
DROP TABLE partitioned_mx;
RESET client_min_messages;
-- test cascading via foreign keys
CREATE TABLE cas_1 (a INT UNIQUE);
CREATE TABLE cas_par (a INT UNIQUE) PARTITION BY RANGE(a);
CREATE TABLE cas_par_1 PARTITION OF cas_par FOR VALUES FROM (1) TO (4);
CREATE TABLE cas_par_2 PARTITION OF cas_par FOR VALUES FROM (5) TO (8);
ALTER TABLE cas_par_1 ADD CONSTRAINT fkey_cas_test_1 FOREIGN KEY (a) REFERENCES cas_1(a);
CREATE TABLE cas_par2 (a INT UNIQUE) PARTITION BY RANGE(a);
CREATE TABLE cas_par2_1 PARTITION OF cas_par2 FOR VALUES FROM (1) TO (4);
CREATE TABLE cas_par2_2 PARTITION OF cas_par2 FOR VALUES FROM (5) TO (8);
ALTER TABLE cas_par2_1 ADD CONSTRAINT fkey_cas_test_2 FOREIGN KEY (a) REFERENCES cas_1(a);
CREATE TABLE cas_par3 (a INT UNIQUE) PARTITION BY RANGE(a);
CREATE TABLE cas_par3_1 PARTITION OF cas_par3 FOR VALUES FROM (1) TO (4);
CREATE TABLE cas_par3_2 PARTITION OF cas_par3 FOR VALUES FROM (5) TO (8);
-- these two should error out as we should call the conversion from the parent
SELECT citus_add_local_table_to_metadata('cas_par2_2');
ERROR:  cannot add local table cas_par2_2 to metadata since it is a partition of cas_par2. Instead, add the parent table cas_par2 to metadata.
SELECT citus_add_local_table_to_metadata('cas_par2_2', cascade_via_foreign_keys=>true);
ERROR:  cannot add local table cas_par2_2 to metadata since it is a partition of cas_par2. Instead, add the parent table cas_par2 to metadata.
-- these two should error out as the foreign keys are not inherited from the parent
SELECT citus_add_local_table_to_metadata('cas_par2');
ERROR:  cannot cascade operation via foreign keys as partition table citus_local_tables_mx.cas_par2_1 involved in a foreign key relationship that is not inherited from it's parent table
SELECT citus_add_local_table_to_metadata('cas_par2', cascade_via_foreign_keys=>true);
ERROR:  cannot cascade operation via foreign keys as partition table citus_local_tables_mx.cas_par2_1 involved in a foreign key relationship that is not inherited from it's parent table
-- drop the foreign keys and establish them again using the parent table
ALTER TABLE cas_par_1 DROP CONSTRAINT fkey_cas_test_1;
ALTER TABLE cas_par2_1 DROP CONSTRAINT fkey_cas_test_2;
ALTER TABLE cas_par ADD CONSTRAINT fkey_cas_test_1 FOREIGN KEY (a) REFERENCES cas_1(a);
ALTER TABLE cas_par2 ADD CONSTRAINT fkey_cas_test_2 FOREIGN KEY (a) REFERENCES cas_1(a);
ALTER TABLE cas_par3 ADD CONSTRAINT fkey_cas_test_3 FOREIGN KEY (a) REFERENCES cas_par(a);
-- this should error out as cascade_via_foreign_keys is not set to true
SELECT citus_add_local_table_to_metadata('cas_par2');
ERROR:  relation citus_local_tables_mx.cas_par2 is involved in a foreign key relationship with another table
-- this should work
SELECT citus_add_local_table_to_metadata('cas_par2', cascade_via_foreign_keys=>true);
 citus_add_local_table_to_metadata
---------------------------------------------------------------------

(1 row)

-- verify the partitioning hierarchy is preserved
select inhrelid::regclass from pg_inherits where inhparent='cas_par'::regclass order by 1;
 inhrelid
---------------------------------------------------------------------
 cas_par_1
 cas_par_2
(2 rows)

-- verify the fkeys + fkeys with shard ids are created
select conname from pg_constraint where conname like 'fkey_cas_test%' order by conname;
         conname
---------------------------------------------------------------------
 fkey_cas_test_1
 fkey_cas_test_1
 fkey_cas_test_1
 fkey_cas_test_1_1330008
 fkey_cas_test_1_1330008
 fkey_cas_test_1_1330008
 fkey_cas_test_2
 fkey_cas_test_2
 fkey_cas_test_2
 fkey_cas_test_2_1330006
 fkey_cas_test_2_1330006
 fkey_cas_test_2_1330006
 fkey_cas_test_3
 fkey_cas_test_3
 fkey_cas_test_3
 fkey_cas_test_3_1330013
 fkey_cas_test_3_1330013
 fkey_cas_test_3_1330013
(18 rows)

-- when all partitions are converted, there should be 40 tables and indexes
-- the individual names are not much relevant, so we only print the count
SELECT count(*) FROM pg_class WHERE relname LIKE 'cas\_%' AND relnamespace IN
    (SELECT oid FROM pg_namespace WHERE nspname = 'citus_local_tables_mx');
 count
---------------------------------------------------------------------
    40
(1 row)

-- verify on the mx worker
\c - - - :worker_1_port
-- on worker, there should be 20, since the shards are created only on the coordinator
SELECT count(*) FROM pg_class WHERE relname LIKE 'cas\_%' AND relnamespace IN
    (SELECT oid FROM pg_namespace WHERE nspname = 'citus_local_tables_mx');
 count
---------------------------------------------------------------------
    20
(1 row)

-- verify that the shell foreign keys are created on the worker as well
select conname from pg_constraint where conname like 'fkey_cas_test%' order by conname;
     conname
---------------------------------------------------------------------
 fkey_cas_test_1
 fkey_cas_test_1
 fkey_cas_test_1
 fkey_cas_test_2
 fkey_cas_test_2
 fkey_cas_test_2
 fkey_cas_test_3
 fkey_cas_test_3
 fkey_cas_test_3
(9 rows)

\c - - - :master_port
SET search_path TO citus_local_tables_mx;
-- undistribute table
-- this one should error out since we don't set the cascade option as true
SELECT undistribute_table('cas_par2');
ERROR:  cannot complete operation because table cas_par2 has a foreign key
-- this one should work
SET client_min_messages TO WARNING;
SELECT undistribute_table('cas_par2', cascade_via_foreign_keys=>true);
 undistribute_table
---------------------------------------------------------------------

(1 row)

-- verify the partitioning hierarchy is preserved
select inhrelid::regclass from pg_inherits where inhparent='cas_par'::regclass order by 1;
 inhrelid
---------------------------------------------------------------------
 cas_par_1
 cas_par_2
(2 rows)

-- verify that the foreign keys with shard ids are gone, due to undistribution
select conname from pg_constraint where conname like 'fkey_cas_test%' order by conname;
     conname
---------------------------------------------------------------------
 fkey_cas_test_1
 fkey_cas_test_1
 fkey_cas_test_1
 fkey_cas_test_2
 fkey_cas_test_2
 fkey_cas_test_2
 fkey_cas_test_3
 fkey_cas_test_3
 fkey_cas_test_3
(9 rows)

-- add a non-inherited fkey and verify it fails when trying to convert
ALTER TABLE cas_par2_1 ADD CONSTRAINT fkey_cas_test_3 FOREIGN KEY (a) REFERENCES cas_1(a);
SELECT citus_add_local_table_to_metadata('cas_par2', cascade_via_foreign_keys=>true);
ERROR:  cannot cascade operation via foreign keys as partition table citus_local_tables_mx.cas_par2_1 involved in a foreign key relationship that is not inherited from it's parent table
-- verify undistribute_table works proper for the mx worker
\c - - - :worker_1_port
SELECT relname FROM pg_class WHERE relname LIKE 'cas\_%' ORDER BY relname;
 relname
---------------------------------------------------------------------
(0 rows)

\c - - - :master_port
SET search_path TO citus_local_tables_mx;
CREATE TABLE date_partitioned_citus_local_table_seq( measureid bigserial, eventdate date, measure_data jsonb, PRIMARY KEY (measureid, eventdate)) PARTITION BY RANGE(eventdate);
SELECT create_time_partitions('date_partitioned_citus_local_table_seq', INTERVAL '1 month', '2022-01-01', '2021-01-01');
 create_time_partitions
---------------------------------------------------------------------
 t
(1 row)

SELECT citus_add_local_table_to_metadata('date_partitioned_citus_local_table_seq');
 citus_add_local_table_to_metadata
---------------------------------------------------------------------

(1 row)

DROP TABLE date_partitioned_citus_local_table_seq;
-- test sequences
CREATE TABLE par_citus_local_seq(measureid bigserial, val int) PARTITION BY RANGE(val);
CREATE TABLE par_citus_local_seq_1 PARTITION OF par_citus_local_seq FOR VALUES FROM (1) TO (4);
SELECT citus_add_local_table_to_metadata('par_citus_local_seq');
 citus_add_local_table_to_metadata
---------------------------------------------------------------------

(1 row)

INSERT INTO par_citus_local_seq (val) VALUES (1) RETURNING *;
 measureid | val
---------------------------------------------------------------------
         1 |   1
(1 row)

INSERT INTO par_citus_local_seq (val) VALUES (2) RETURNING *;
 measureid | val
---------------------------------------------------------------------
         2 |   2
(1 row)

\c - - - :worker_1_port
-- insert on the worker
INSERT INTO citus_local_tables_mx.par_citus_local_seq (val) VALUES (1) RETURNING *;
    measureid     | val
---------------------------------------------------------------------
 3940649673949185 |   1
(1 row)

\c - - - :master_port
SET search_path TO citus_local_tables_mx;
INSERT INTO par_citus_local_seq (val) VALUES (2) RETURNING *;
 measureid | val
---------------------------------------------------------------------
         3 |   2
(1 row)

SELECT undistribute_table('par_citus_local_seq');
NOTICE:  converting the partitions of citus_local_tables_mx.par_citus_local_seq
NOTICE:  creating a new table for citus_local_tables_mx.par_citus_local_seq_1
NOTICE:  moving the data of citus_local_tables_mx.par_citus_local_seq_1
NOTICE:  dropping the old citus_local_tables_mx.par_citus_local_seq_1
NOTICE:  renaming the new table to citus_local_tables_mx.par_citus_local_seq_1
NOTICE:  creating a new table for citus_local_tables_mx.par_citus_local_seq
NOTICE:  dropping the old citus_local_tables_mx.par_citus_local_seq
NOTICE:  renaming the new table to citus_local_tables_mx.par_citus_local_seq
 undistribute_table
---------------------------------------------------------------------

(1 row)

INSERT INTO par_citus_local_seq (val) VALUES (3) RETURNING *;
 measureid | val
---------------------------------------------------------------------
         4 |   3
(1 row)

SELECT measureid FROM par_citus_local_seq ORDER BY measureid;
    measureid
---------------------------------------------------------------------
                1
                2
                3
                4
 3940649673949185
(5 rows)

-- test adding invalid foreign key to partition table
CREATE TABLE citus_local_parent_1 (a INT UNIQUE) PARTITION BY RANGE(a);
CREATE TABLE citus_local_parent_2 (a INT UNIQUE) PARTITION BY RANGE(a);
CREATE TABLE citus_local_plain (a INT UNIQUE);
CREATE TABLE ref (a INT UNIQUE);
SELECT create_reference_table('ref');
 create_reference_table
---------------------------------------------------------------------

(1 row)

alter table citus_local_parent_1 add foreign key (a) references citus_local_parent_2(a);
alter table citus_local_plain add foreign key (a) references citus_local_parent_2(a);
CREATE TABLE citus_local_parent_1_child_1 PARTITION OF citus_local_parent_1 FOR VALUES FROM (3) TO (5);
CREATE TABLE citus_local_parent_1_child_2 PARTITION OF citus_local_parent_1 FOR VALUES FROM (30) TO (50);
CREATE TABLE citus_local_parent_2_child_1 PARTITION OF citus_local_parent_2 FOR VALUES FROM (40) TO (60);
-- this one should error out, since we cannot convert it to citus local table,
-- as citus local table partitions cannot have non-inherited foreign keys
alter table citus_local_parent_1_child_1 add foreign key(a) references ref(a);
ERROR:  cannot build foreign key between reference table and a partition
-- this should work
alter table citus_local_parent_1 add constraint fkey_to_drop_test foreign key(a) references ref(a);
-- this should undistribute the table, and the entries should be gone from pg_dist_partition
select logicalrelid from pg_dist_partition where logicalrelid::text like 'citus_local_parent%' order by logicalrelid;
         logicalrelid
---------------------------------------------------------------------
 citus_local_parent_1
 citus_local_parent_2
 citus_local_parent_2_child_1
 citus_local_parent_1_child_1
 citus_local_parent_1_child_2
(5 rows)

set client_min_messages to error;
alter table citus_local_parent_1 drop constraint fkey_to_drop_test;
select logicalrelid from pg_dist_partition where logicalrelid::text like 'citus_local_parent%';
 logicalrelid
---------------------------------------------------------------------
(0 rows)

-- verify attaching partition with a foreign key errors out
CREATE TABLE citus_local_parent (b TEXT, a INT UNIQUE REFERENCES ref(a), d INT) PARTITION BY RANGE(a);
CREATE TABLE citus_local_with_fkey (d INT);
ALTER TABLE citus_local_with_fkey ADD CONSTRAINT cl_to_cl FOREIGN KEY(d) REFERENCES citus_local_parent(a);
-- error out
ALTER TABLE citus_local_parent ATTACH PARTITION citus_local_with_fkey DEFAULT;
ERROR:  partition local tables added to citus metadata cannot have non-inherited foreign keys
DROP TABLE citus_local_parent CASCADE;
-- test attaching citus local table to distributed table
-- citus local table should be distributed
CREATE TABLE dist_table_parent (a INT UNIQUE) PARTITION BY RANGE(a);
SELECT create_distributed_table('dist_table_parent','a');
 create_distributed_table
---------------------------------------------------------------------

(1 row)

CREATE TABLE citus_local_child (a int unique);
select citus_add_local_table_to_metadata('citus_local_child', false);
 citus_add_local_table_to_metadata
---------------------------------------------------------------------

(1 row)

alter table dist_table_parent attach partition  citus_local_child default ;
select logicalrelid, partmethod from pg_dist_partition where logicalrelid::text in ('dist_table_parent', 'citus_local_child');
   logicalrelid    | partmethod
---------------------------------------------------------------------
 dist_table_parent | h
 citus_local_child | h
(2 rows)

-- test attaching distributed table to citus local table
CREATE TABLE dist_table_child (a INT UNIQUE);
SELECT create_distributed_table('dist_table_child','a');
 create_distributed_table
---------------------------------------------------------------------

(1 row)

CREATE TABLE citus_local_parent (a INT UNIQUE) PARTITION BY RANGE(a);
select citus_add_local_table_to_metadata('citus_local_parent', false);
 citus_add_local_table_to_metadata
---------------------------------------------------------------------

(1 row)

-- this should error out
alter table citus_local_parent attach partition dist_table_child default ;
ERROR:  non-distributed partitioned tables cannot have distributed partitions
-- error out attaching
CREATE TABLE pg_local (a INT UNIQUE) PARTITION BY RANGE(a);
CREATE TABLE citus_local_attach_to_pglocal (a INT UNIQUE) PARTITION BY RANGE(a);
select citus_add_local_table_to_metadata('citus_local_attach_to_pglocal', false);
 citus_add_local_table_to_metadata
---------------------------------------------------------------------

(1 row)

alter table citus_local_attach_to_pglocal attach partition pg_local default ;
ERROR:  Citus doesn't support multi-level partitioned tables
SELECT master_remove_distributed_table_metadata_from_workers('citus_local_table_4'::regclass::oid, 'citus_local_tables_mx', 'citus_local_table_4');
 master_remove_distributed_table_metadata_from_workers
---------------------------------------------------------------------

(1 row)

-- both workers should print 0 as master_remove_distributed_table_metadata_from_workers
-- drops the table as well
SELECT run_command_on_workers(
$$
SELECT count(*) FROM pg_catalog.pg_tables WHERE tablename='citus_local_table_4'
$$);
 run_command_on_workers
---------------------------------------------------------------------
 (localhost,57637,t,0)
 (localhost,57638,t,0)
(2 rows)

-- test adding foreign table to metadata with the guc
SET citus.use_citus_managed_tables TO ON;
CREATE TABLE foreign_table_test (id integer NOT NULL, data text, a bigserial);
INSERT INTO foreign_table_test VALUES (1, 'text_test');
CREATE EXTENSION postgres_fdw;
CREATE SERVER foreign_server
        FOREIGN DATA WRAPPER postgres_fdw
        OPTIONS (host 'localhost', port :'master_port', dbname 'regression');
CREATE USER MAPPING FOR CURRENT_USER
        SERVER foreign_server
        OPTIONS (user 'postgres');
CREATE FOREIGN TABLE foreign_table (
        id integer NOT NULL,
        data text,
        a bigserial
)
        SERVER foreign_server
        OPTIONS (schema_name 'citus_local_tables_mx', table_name 'foreign_table_test');
--verify
SELECT partmethod, repmodel FROM pg_dist_partition WHERE logicalrelid = 'foreign_table'::regclass;
 partmethod | repmodel
---------------------------------------------------------------------
 n          | s
(1 row)

CREATE TABLE parent_for_foreign_tables (
    project_id integer
) PARTITION BY HASH (project_id);
CREATE SERVER IF NOT EXISTS srv1 FOREIGN DATA WRAPPER postgres_fdw OPTIONS (dbname 'otherdb1',host 'localhost', port '5432');
CREATE SERVER IF NOT EXISTS srv2 FOREIGN DATA WRAPPER postgres_fdw OPTIONS (dbname 'otherdb2', host 'localhost', port '5432');
CREATE SERVER IF NOT EXISTS srv3 FOREIGN DATA WRAPPER postgres_fdw OPTIONS (dbname 'otherdb3', host 'localhost', port '5432');
CREATE FOREIGN TABLE foreign_partition_1 PARTITION OF parent_for_foreign_tables FOR VALUES WITH (modulus 3, remainder 0) SERVER srv1;
CREATE FOREIGN TABLE foreign_partition_2 PARTITION OF parent_for_foreign_tables FOR VALUES WITH (modulus 3, remainder 1) SERVER srv2;
CREATE FOREIGN TABLE foreign_partition_3 PARTITION OF parent_for_foreign_tables FOR VALUES WITH (modulus 3, remainder 2) SERVER srv3;
SELECT partmethod, repmodel FROM pg_dist_partition
    WHERE logicalrelid IN ('parent_for_foreign_tables'::regclass, 'foreign_partition_1'::regclass, 'foreign_partition_2'::regclass, 'foreign_partition_3'::regclass);
 partmethod | repmodel
---------------------------------------------------------------------
 n          | s
 n          | s
 n          | s
 n          | s
(4 rows)

ALTER FOREIGN TABLE foreign_table SET SCHEMA public;
ALTER FOREIGN TABLE public.foreign_table RENAME TO foreign_table_newname;
ALTER FOREIGN TABLE public.foreign_table_newname RENAME COLUMN id TO id_test;
ALTER FOREIGN TABLE public.foreign_table_newname ADD dummy_col bigint NOT NULL DEFAULT 1;
ALTER FOREIGN TABLE public.foreign_table_newname ALTER dummy_col DROP DEFAULT;
ALTER FOREIGN TABLE public.foreign_table_newname ALTER dummy_col SET DEFAULT 2;
ALTER FOREIGN TABLE public.foreign_table_newname ALTER dummy_col TYPE int;
ALTER TABLE foreign_table_test RENAME COLUMN id TO id_test;
ALTER TABLE foreign_table_test ADD dummy_col int NOT NULL DEFAULT 1;
INSERT INTO public.foreign_table_newname VALUES (2, 'test_2');
INSERT INTO foreign_table_test VALUES (3, 'test_3');
ALTER FOREIGN TABLE public.foreign_table_newname OWNER TO pg_monitor;
SELECT run_command_on_workers($$select r.rolname from pg_roles r join pg_class c on r.oid=c.relowner where relname = 'foreign_table_newname';$$);
     run_command_on_workers
---------------------------------------------------------------------
 (localhost,57637,t,pg_monitor)
 (localhost,57638,t,pg_monitor)
(2 rows)

ALTER FOREIGN TABLE public.foreign_table_newname OWNER TO postgres;
SELECT run_command_on_workers($$select r.rolname from pg_roles r join pg_class c on r.oid=c.relowner where relname = 'foreign_table_newname';$$);
    run_command_on_workers
---------------------------------------------------------------------
 (localhost,57637,t,postgres)
 (localhost,57638,t,postgres)
(2 rows)

\c - - - :worker_1_port
SET search_path TO citus_local_tables_mx;
SELECT * FROM public.foreign_table_newname;
 id_test |   data    | a | dummy_col
---------------------------------------------------------------------
       1 | text_test | 1 |         1
       2 | test_2    | 1 |         2
       3 | test_3    | 2 |         1
(3 rows)

SELECT * FROM foreign_table_test;
 id_test |   data    | a | dummy_col
---------------------------------------------------------------------
       1 | text_test | 1 |         1
       2 | test_2    | 1 |         2
       3 | test_3    | 2 |         1
(3 rows)

-- should error out
ALTER FOREIGN TABLE public.foreign_table_newname DROP COLUMN id;
ERROR:  operation is not allowed on this node
SELECT partmethod, repmodel FROM pg_dist_partition
    WHERE logicalrelid IN ('parent_for_foreign_tables'::regclass, 'foreign_partition_1'::regclass, 'foreign_partition_2'::regclass, 'foreign_partition_3'::regclass);
 partmethod | repmodel
---------------------------------------------------------------------
 n          | s
 n          | s
 n          | s
 n          | s
(4 rows)

\c - - - :master_port
ALTER FOREIGN TABLE foreign_table_newname RENAME TO foreign_table;
SET search_path TO citus_local_tables_mx;
ALTER FOREIGN TABLE public.foreign_table SET SCHEMA citus_local_tables_mx;
ALTER FOREIGN TABLE IF EXISTS foreign_table RENAME COLUMN id_test TO id;
ALTER TABLE foreign_table_test RENAME COLUMN id_test TO id;
ALTER TABLE foreign_table DROP COLUMN id;
ALTER FOREIGN TABLE foreign_table DROP COLUMN dummy_col;
ALTER TABLE foreign_table_test DROP COLUMN dummy_col;
ALTER FOREIGN TABLE foreign_table OPTIONS (DROP schema_name, SET table_name 'notable');
SELECT run_command_on_workers($$SELECT f.ftoptions FROM pg_foreign_table f JOIN pg_class c ON f.ftrelid=c.oid WHERE c.relname = 'foreign_table';$$);
          run_command_on_workers
---------------------------------------------------------------------
 (localhost,57637,t,{table_name=notable})
 (localhost,57638,t,{table_name=notable})
(2 rows)

ALTER FOREIGN TABLE foreign_table OPTIONS (ADD schema_name 'citus_local_tables_mx', SET table_name 'foreign_table_test');
SELECT * FROM foreign_table;
   data    | a
---------------------------------------------------------------------
 text_test | 1
 test_2    | 1
 test_3    | 2
(3 rows)

-- test alter user mapping
ALTER USER MAPPING FOR postgres SERVER foreign_server OPTIONS (SET user 'nonexistiniguser');
-- should fail
SELECT * FROM foreign_table;
ERROR:  could not connect to server "foreign_server"
ALTER USER MAPPING FOR postgres SERVER foreign_server OPTIONS (SET user 'postgres');
-- test undistributing
DELETE FROM foreign_table;
SELECT undistribute_table('foreign_table');
NOTICE:  creating a new table for citus_local_tables_mx.foreign_table
NOTICE:  dropping the old citus_local_tables_mx.foreign_table
NOTICE:  renaming the new table to citus_local_tables_mx.foreign_table
 undistribute_table
---------------------------------------------------------------------

(1 row)

SELECT create_distributed_table('foreign_table','data');
 create_distributed_table
---------------------------------------------------------------------

(1 row)

SELECT undistribute_table('foreign_table');
NOTICE:  creating a new table for citus_local_tables_mx.foreign_table
NOTICE:  dropping the old citus_local_tables_mx.foreign_table
NOTICE:  renaming the new table to citus_local_tables_mx.foreign_table
 undistribute_table
---------------------------------------------------------------------

(1 row)

SELECT create_reference_table('foreign_table');
 create_reference_table
---------------------------------------------------------------------

(1 row)

SELECT undistribute_table('foreign_table');
NOTICE:  creating a new table for citus_local_tables_mx.foreign_table
NOTICE:  dropping the old citus_local_tables_mx.foreign_table
NOTICE:  renaming the new table to citus_local_tables_mx.foreign_table
 undistribute_table
---------------------------------------------------------------------

(1 row)

INSERT INTO foreign_table_test VALUES (1, 'testt');
SELECT * FROM foreign_table;
 data  | a
---------------------------------------------------------------------
 testt | 3
(1 row)

SELECT * FROM foreign_table_test;
 id | data  | a
---------------------------------------------------------------------
  1 | testt | 3
(1 row)

DROP TABLE parent_for_foreign_tables;
CREATE TABLE parent_for_foreign_tables (
    project_id integer
) PARTITION BY HASH (project_id);
CREATE FOREIGN TABLE foreign_partition_1 PARTITION OF parent_for_foreign_tables FOR VALUES WITH (modulus 3, remainder 0) SERVER srv1;
CREATE FOREIGN TABLE foreign_partition_2 PARTITION OF parent_for_foreign_tables FOR VALUES WITH (modulus 3, remainder 1) SERVER srv2;
SELECT citus_add_local_table_to_metadata('parent_for_foreign_tables');
 citus_add_local_table_to_metadata
---------------------------------------------------------------------

(1 row)

CREATE FOREIGN TABLE foreign_partition_3 PARTITION OF parent_for_foreign_tables FOR VALUES WITH (modulus 3, remainder 2) SERVER srv3;
SELECT partmethod, repmodel FROM pg_dist_partition
    WHERE logicalrelid IN ('parent_for_foreign_tables'::regclass, 'foreign_partition_1'::regclass, 'foreign_partition_2'::regclass, 'foreign_partition_3'::regclass);
 partmethod | repmodel
---------------------------------------------------------------------
 n          | s
 n          | s
 n          | s
 n          | s
(4 rows)

\c - - - :worker_1_port
SET search_path TO citus_local_tables_mx;
SELECT partmethod, repmodel FROM pg_dist_partition
    WHERE logicalrelid IN ('parent_for_foreign_tables'::regclass, 'foreign_partition_1'::regclass, 'foreign_partition_2'::regclass, 'foreign_partition_3'::regclass);
 partmethod | repmodel
---------------------------------------------------------------------
 n          | s
 n          | s
 n          | s
 n          | s
(4 rows)

\c - - - :master_port
SET search_path TO citus_local_tables_mx;
--verify
SELECT partmethod, repmodel FROM pg_dist_partition WHERE logicalrelid = 'foreign_table'::regclass;
 partmethod | repmodel
---------------------------------------------------------------------
(0 rows)

CREATE SERVER foreign_server_local
        FOREIGN DATA WRAPPER postgres_fdw
        OPTIONS (host 'localhost', port :'master_port', dbname 'regression');
CREATE USER MAPPING FOR CURRENT_USER
        SERVER foreign_server_local
        OPTIONS (user 'postgres');
CREATE FOREIGN TABLE foreign_table_local (
        id integer NOT NULL,
        data text
)
        SERVER foreign_server_local
        OPTIONS (schema_name 'citus_local_tables_mx', table_name 'foreign_table_test');
CREATE TABLE dist_tbl(a int);
INSERT INTO dist_tbl VALUES (1);
SELECT create_distributed_table('dist_tbl','a');
NOTICE:  Copying data from local table...
NOTICE:  copying the data has completed
 create_distributed_table
---------------------------------------------------------------------

(1 row)

SELECT * FROM dist_tbl d JOIN foreign_table_local f ON d.a=f.id;
 a | id | data
---------------------------------------------------------------------
 1 |  1 | testt
(1 row)

CREATE TABLE ref_tbl(a int);
INSERT INTO ref_tbl VALUES (1);
SELECT create_reference_table('ref_tbl');
NOTICE:  Copying data from local table...
NOTICE:  copying the data has completed
 create_reference_table
---------------------------------------------------------------------

(1 row)

SELECT * FROM ref_tbl d JOIN foreign_table_local f ON d.a=f.id;
 a | id | data
---------------------------------------------------------------------
 1 |  1 | testt
(1 row)

SELECT citus_add_local_table_to_metadata('foreign_table_local');
 citus_add_local_table_to_metadata
---------------------------------------------------------------------

(1 row)

\c - - - :worker_1_port
SET search_path TO citus_local_tables_mx;
SELECT * FROM dist_tbl d JOIN foreign_table_local f ON d.a=f.id;
 a | id | data
---------------------------------------------------------------------
 1 |  1 | testt
(1 row)

SELECT * FROM ref_tbl d JOIN foreign_table_local f ON d.a=f.id;
 a | id | data
---------------------------------------------------------------------
 1 |  1 | testt
(1 row)

\c - - - :master_port
SET search_path TO citus_local_tables_mx;
DROP FOREIGN TABLE foreign_table_local;
-- cleanup at exit
set client_min_messages to error;
DROP SCHEMA citus_local_tables_mx CASCADE;
