SET citus.next_shard_id TO 20010000;
CREATE USER typeuser;
CREATE SCHEMA type_tests AUTHORIZATION typeuser;
CREATE SCHEMA type_tests2 AUTHORIZATION typeuser; -- to test creation in a specific schema and moving to schema
SET search_path TO type_tests;
SET citus.shard_count TO 4;
-- single statement transactions with a simple type used in a table
CREATE TYPE tc1 AS (a int, b varchar(20));
CREATE TABLE t1 (a int PRIMARY KEY, b tc1);
SELECT create_distributed_table('t1','a');
 create_distributed_table
---------------------------------------------------------------------

(1 row)

INSERT INTO t1 VALUES (1, (2,'3')::tc1);
SELECT * FROM t1;
 a |   b
---------------------------------------------------------------------
 1 | (2,3)
(1 row)

ALTER TYPE tc1 RENAME TO tc1_newname;
INSERT INTO t1 VALUES (3, (4,'5')::tc1_newname); -- insert with a cast would fail if the rename didn't propagate
ALTER TYPE tc1_newname SET SCHEMA type_tests2;
INSERT INTO t1 VALUES (6, (7,'8')::type_tests2.tc1_newname); -- insert with a cast would fail if the rename didn't propagate
-- verify typmod was propagated
SELECT run_command_on_workers($$SELECT atttypmod FROM pg_attribute WHERE attnum = 2 AND attrelid = (SELECT typrelid FROM pg_type WHERE typname = 'tc1_newname');$$);
 run_command_on_workers
---------------------------------------------------------------------
 (localhost,57637,t,24)
 (localhost,57638,t,24)
(2 rows)

-- single statement transactions with an enum used in a table
CREATE TYPE te1 AS ENUM ('one', 'two', 'three');
CREATE TABLE t2 (a int PRIMARY KEY, b te1);
SELECT create_distributed_table('t2','a');
 create_distributed_table
---------------------------------------------------------------------

(1 row)

INSERT INTO t2 VALUES (1, 'two');
SELECT * FROM t2;
 a |  b
---------------------------------------------------------------------
 1 | two
(1 row)

-- rename enum, subsequent operations on the type would fail if the rename was not propagated
ALTER TYPE te1 RENAME TO te1_newname;
-- add an extra value to the enum and use in table
ALTER TYPE te1_newname ADD VALUE 'four';
UPDATE t2 SET b = 'four';
SELECT * FROM t2;
 a |  b
---------------------------------------------------------------------
 1 | four
(1 row)

-- change the schema of the type and use the new fully qualified name in an insert
ALTER TYPE te1_newname SET SCHEMA type_tests2;
INSERT INTO t2 VALUES (3, 'three'::type_tests2.te1_newname);
-- transaction block with simple type
BEGIN;
CREATE TYPE tc2 AS (a varchar(10), b int);
CREATE TABLE t3 (a int PRIMARY KEY, b tc2);
SELECT create_distributed_table('t3','a');
 create_distributed_table
---------------------------------------------------------------------

(1 row)

INSERT INTO t3 VALUES (4, ('5',6)::tc2);
SELECT * FROM t3;
 a |   b
---------------------------------------------------------------------
 4 | (5,6)
(1 row)

COMMIT;
-- verify typmod was propagated
SELECT run_command_on_workers($$SELECT atttypmod FROM pg_attribute WHERE attnum = 1 AND attrelid = (SELECT typrelid FROM pg_type WHERE typname = 'tc2');$$);
 run_command_on_workers
---------------------------------------------------------------------
 (localhost,57637,t,14)
 (localhost,57638,t,14)
(2 rows)

-- transaction block with simple type
BEGIN;
CREATE TYPE te2 AS ENUM ('yes', 'no');
CREATE TABLE t4 (a int PRIMARY KEY, b te2);
SELECT create_distributed_table('t4','a');
 create_distributed_table
---------------------------------------------------------------------

(1 row)

INSERT INTO t4 VALUES (1, 'yes');
SELECT * FROM t4;
 a |  b
---------------------------------------------------------------------
 1 | yes
(1 row)

-- ALTER TYPE ... ADD VALUE does not work in transactions
COMMIT;
-- verify order of enum labels
SELECT string_agg(enumlabel, ',' ORDER BY enumsortorder ASC) FROM pg_enum WHERE enumtypid = 'type_tests.te2'::regtype;
 string_agg
---------------------------------------------------------------------
 yes,no
(1 row)

SELECT run_command_on_workers($$SELECT string_agg(enumlabel, ',' ORDER BY enumsortorder ASC) FROM pg_enum WHERE enumtypid = 'type_tests.te2'::regtype;$$);
    run_command_on_workers
---------------------------------------------------------------------
 (localhost,57637,t,"yes,no")
 (localhost,57638,t,"yes,no")
(2 rows)

-- test some combination of types without ddl propagation, this will prevent the workers
-- from having those types created. They are created just-in-time on table distribution
SET citus.enable_ddl_propagation TO off;
CREATE TYPE tc3 AS (a int, b int);
CREATE TYPE tc4 AS (a int, b tc3[]);
CREATE TYPE tc5 AS (a int, b tc4);
CREATE TYPE te3 AS ENUM ('a','b');
RESET citus.enable_ddl_propagation;
CREATE TABLE t5 (a int PRIMARY KEY, b tc5[], c te3);
SELECT create_distributed_table('t5','a');
 create_distributed_table
---------------------------------------------------------------------

(1 row)

-- test adding an attribute to a type and a column to a table both for a non-distributed type
SET citus.enable_ddl_propagation TO off;
CREATE TYPE te4 AS ENUM ('c','d');
CREATE TYPE tc6 AS (a int, b int);
CREATE TYPE tc6c AS (a int, b int);
RESET citus.enable_ddl_propagation;
-- types need to be fully qualified because of the search_path which is not supported by ALTER TYPE ... ADD COLUMN
ALTER TABLE t5 ADD COLUMN d type_tests.te4;
ALTER TABLE t5 ADD COLUMN e type_tests.tc6;
ALTER TYPE tc6 ADD ATTRIBUTE c tc6c;
-- last two values are only there if above commands succeeded
INSERT INTO t5 VALUES (1, NULL, 'a', 'd', (1,2,(4,5)::tc6c)::tc6);
-- test renaming an attribute of a distrbuted type and read it by its new name to verify propagation
ALTER TYPE tc6 RENAME ATTRIBUTE b TO d;
SELECT (e::tc6).d FROM t5 ORDER BY 1;
 d
---------------------------------------------------------------------
 2
(1 row)

-- change owner of supported types and check ownership on remote server
ALTER TYPE te4 OWNER TO typeuser;
SELECT typname, usename FROM pg_type, pg_user where typname = 'te4' and typowner = usesysid;
 typname | usename
---------------------------------------------------------------------
 te4     | typeuser
(1 row)

SELECT run_command_on_workers($$SELECT row(typname, usename) FROM pg_type, pg_user where typname = 'te4' and typowner = usesysid;$$);
        run_command_on_workers
---------------------------------------------------------------------
 (localhost,57637,t,"(te4,typeuser)")
 (localhost,57638,t,"(te4,typeuser)")
(2 rows)

ALTER TYPE tc6 OWNER TO typeuser;
SELECT typname, usename FROM pg_type, pg_user where typname = 'tc6' and typowner = usesysid;
 typname | usename
---------------------------------------------------------------------
 tc6     | typeuser
(1 row)

SELECT run_command_on_workers($$SELECT row(typname, usename) FROM pg_type, pg_user where typname = 'tc6' and typowner = usesysid;$$);
        run_command_on_workers
---------------------------------------------------------------------
 (localhost,57637,t,"(tc6,typeuser)")
 (localhost,57638,t,"(tc6,typeuser)")
(2 rows)

-- create a type as a different user
SET ROLE typeuser;
-- create directly on the worker
CREATE TYPE tc7 AS (a int, b int);
CREATE TYPE te5 AS ENUM ('a','b','c');
-- cascade to the worker when table gets created
SET citus.enable_ddl_propagation TO off;
CREATE TYPE tc8 AS (a int, b int);
CREATE TYPE te6 AS ENUM ('a','b','c');
RESET citus.enable_ddl_propagation;
CREATE TABLE t6 (a int, b tc8, c te6);
SELECT create_distributed_table('t6', 'a');
 create_distributed_table
---------------------------------------------------------------------

(1 row)

RESET ROLE;
--  test ownership of all types
SELECT typname, usename FROM pg_type, pg_user where typname = 'tc7' and typowner = usesysid;
 typname | usename
---------------------------------------------------------------------
 tc7     | typeuser
(1 row)

SELECT run_command_on_workers($$SELECT row(typname, usename) FROM pg_type, pg_user where typname = 'tc7' and typowner = usesysid;$$);
        run_command_on_workers
---------------------------------------------------------------------
 (localhost,57637,t,"(tc7,typeuser)")
 (localhost,57638,t,"(tc7,typeuser)")
(2 rows)

SELECT typname, usename FROM pg_type, pg_user where typname = 'te5' and typowner = usesysid;
 typname | usename
---------------------------------------------------------------------
 te5     | typeuser
(1 row)

SELECT run_command_on_workers($$SELECT row(typname, usename) FROM pg_type, pg_user where typname = 'te5' and typowner = usesysid;$$);
        run_command_on_workers
---------------------------------------------------------------------
 (localhost,57637,t,"(te5,typeuser)")
 (localhost,57638,t,"(te5,typeuser)")
(2 rows)

SELECT typname, usename FROM pg_type, pg_user where typname = 'tc8' and typowner = usesysid;
 typname | usename
---------------------------------------------------------------------
 tc8     | typeuser
(1 row)

SELECT run_command_on_workers($$SELECT row(typname, usename) FROM pg_type, pg_user where typname = 'tc8' and typowner = usesysid;$$);
        run_command_on_workers
---------------------------------------------------------------------
 (localhost,57637,t,"(tc8,typeuser)")
 (localhost,57638,t,"(tc8,typeuser)")
(2 rows)

SELECT typname, usename FROM pg_type, pg_user where typname = 'te6' and typowner = usesysid;
 typname | usename
---------------------------------------------------------------------
 te6     | typeuser
(1 row)

SELECT run_command_on_workers($$SELECT row(typname, usename) FROM pg_type, pg_user where typname = 'te6' and typowner = usesysid;$$);
        run_command_on_workers
---------------------------------------------------------------------
 (localhost,57637,t,"(te6,typeuser)")
 (localhost,57638,t,"(te6,typeuser)")
(2 rows)

-- deleting the enum cascade will remove the type from the table and the workers
DROP TYPE te3 CASCADE;
NOTICE:  drop cascades to column c of table t5
-- DELETE multiple types at once
DROP TYPE tc3, tc4, tc5 CASCADE;
NOTICE:  drop cascades to column b of table t5
-- test if the types are deleted
SELECT typname FROM pg_type, pg_user where typname IN ('te3','tc3','tc4','tc5') and typowner = usesysid ORDER BY typname;
 typname
---------------------------------------------------------------------
(0 rows)

SELECT run_command_on_workers($$SELECT typname FROM pg_type, pg_user where typname IN ('te3','tc3','tc4','tc5') and typowner = usesysid ORDER BY typname;$$);
 run_command_on_workers
---------------------------------------------------------------------
 (localhost,57637,t,"")
 (localhost,57638,t,"")
(2 rows)

-- make sure attribute names are quoted correctly, no errors indicates types are propagated correctly
CREATE TYPE tc9 AS ("field-with-dashes" text COLLATE "POSIX");
ALTER TYPE tc9 ADD ATTRIBUTE "some-more" int, ADD ATTRIBUTE normal int;
ALTER TYPE tc9 RENAME ATTRIBUTE normal TO "not-so-normal";
-- test alter statements for non-distributed types, if they would be propagated they would
-- error, preventing from changing them
SET citus.enable_ddl_propagation TO off;
CREATE TYPE non_distributed_composite_type AS (a int, b int);
CREATE TYPE non_distributed_enum_type AS ENUM ('a', 'c');
SET citus.enable_ddl_propagation TO on;
ALTER TYPE non_distributed_composite_type ADD ATTRIBUTE c int;
ALTER TYPE non_distributed_composite_type RENAME ATTRIBUTE c TO d;
ALTER TYPE non_distributed_composite_type ALTER ATTRIBUTE d SET DATA TYPE text COLLATE "POSIX" CASCADE;
ALTER TYPE non_distributed_composite_type DROP ATTRIBUTE d;
ALTER TYPE non_distributed_composite_type OWNER TO typeuser;
ALTER TYPE non_distributed_composite_type RENAME TO non_distributed_composite_type_renamed;
ALTER TYPE non_distributed_composite_type_renamed RENAME TO non_distributed_composite_type;
ALTER TYPE non_distributed_composite_type SET SCHEMA type_tests2;
ALTER TYPE type_tests2.non_distributed_composite_type SET SCHEMA type_tests;
ALTER TYPE non_distributed_enum_type OWNER TO typeuser;
ALTER TYPE non_distributed_enum_type RENAME TO non_distributed_enum_type_renamed;
ALTER TYPE non_distributed_enum_type_renamed RENAME TO non_distributed_enum_type;
ALTER TYPE non_distributed_enum_type SET SCHEMA type_tests2;
ALTER TYPE type_tests2.non_distributed_enum_type SET SCHEMA type_tests;
ALTER TYPE non_distributed_enum_type ADD VALUE 'b' BEFORE 'c';
ALTER TYPE non_distributed_enum_type ADD VALUE 'd' AFTER 'c';
ALTER TYPE non_distributed_enum_type RENAME VALUE 'd' TO 'something-with-quotes''andstuff';
-- test all forms of alter statements on distributed types
CREATE TYPE distributed_composite_type AS (a int, b int);
CREATE TYPE distributed_enum_type AS ENUM ('a', 'c');
-- enforce distribution of types in every case
CREATE TABLE type_proc (a int, b distributed_composite_type, c distributed_enum_type);
SELECT create_distributed_table('type_proc','a');
 create_distributed_table
---------------------------------------------------------------------

(1 row)

DROP TABLE type_proc;
ALTER TYPE distributed_composite_type ADD ATTRIBUTE c int;
ALTER TYPE distributed_composite_type RENAME ATTRIBUTE c TO d;
ALTER TYPE distributed_composite_type ALTER ATTRIBUTE d SET DATA TYPE text COLLATE "POSIX" CASCADE;
ALTER TYPE distributed_composite_type DROP ATTRIBUTE d;
ALTER TYPE distributed_composite_type OWNER TO typeuser;
ALTER TYPE distributed_composite_type RENAME TO distributed_composite_type_renamed;
ALTER TYPE distributed_composite_type_renamed RENAME TO distributed_composite_type;
ALTER TYPE distributed_composite_type SET SCHEMA type_tests2;
ALTER TYPE type_tests2.distributed_composite_type SET SCHEMA type_tests;
ALTER TYPE distributed_enum_type OWNER TO typeuser;
ALTER TYPE distributed_enum_type RENAME TO distributed_enum_type_renamed;
ALTER TYPE distributed_enum_type_renamed RENAME TO distributed_enum_type;
ALTER TYPE distributed_enum_type SET SCHEMA type_tests2;
ALTER TYPE type_tests2.distributed_enum_type SET SCHEMA type_tests;
ALTER TYPE distributed_enum_type ADD VALUE 'b' BEFORE 'c';
ALTER TYPE distributed_enum_type ADD VALUE 'd' AFTER 'c';
ALTER TYPE distributed_enum_type RENAME VALUE 'd' TO 'something-with-quotes''andstuff';
-- make sure types are not distributed by default when feature flag is turned off
SET citus.enable_create_type_propagation TO off;
CREATE TYPE feature_flag_composite_type AS (a int, b int);
CREATE TYPE feature_flag_enum_type AS ENUM ('a', 'b');
-- verify types do not exist on workers
SELECT count(*) FROM pg_type where typname IN ('feature_flag_composite_type', 'feature_flag_enum_type');
 count
---------------------------------------------------------------------
     2
(1 row)

SELECT run_command_on_workers($$SELECT count(*) FROM pg_type where typname IN ('feature_flag_composite_type', 'feature_flag_enum_type');$$);
 run_command_on_workers
---------------------------------------------------------------------
 (localhost,57637,t,0)
 (localhost,57638,t,0)
(2 rows)

-- verify they are still distributed when required
CREATE TABLE feature_flag_table (a int PRIMARY KEY, b feature_flag_composite_type, c feature_flag_enum_type);
SELECT create_distributed_table('feature_flag_table','a');
 create_distributed_table
---------------------------------------------------------------------

(1 row)

SELECT count(*) FROM pg_type where typname IN ('feature_flag_composite_type', 'feature_flag_enum_type');
 count
---------------------------------------------------------------------
     2
(1 row)

SELECT run_command_on_workers($$SELECT count(*) FROM pg_type where typname IN ('feature_flag_composite_type', 'feature_flag_enum_type');$$);
 run_command_on_workers
---------------------------------------------------------------------
 (localhost,57637,t,2)
 (localhost,57638,t,2)
(2 rows)

RESET citus.enable_create_type_propagation;
CREATE TYPE ct1 as (int_1 int, int_2 int);
CREATE TABLE field_indirection_test_1 (int_col int, ct1_col ct1);
SELECT create_distributed_table('field_indirection_test_1', 'int_col');
 create_distributed_table
---------------------------------------------------------------------

(1 row)

-- not supported (field indirection in single row insert)
INSERT INTO field_indirection_test_1 (int_col, ct1_col.int_1, ct1_col.int_2) VALUES (0, 1, 2);
ERROR:  inserting or modifying composite type fields is not supported
HINT:  Use the column name to insert or update the composite type as a single value
INSERT INTO field_indirection_test_1 (int_col, ct1_col.int_1) VALUES (0, 1);
ERROR:  inserting or modifying composite type fields is not supported
HINT:  Use the column name to insert or update the composite type as a single value
CREATE TYPE ct2 as (int_2 int, text_1 text, int_1 int);
CREATE TABLE field_indirection_test_2 (int_col int, ct2_col ct2, ct1_col ct1);
SELECT create_distributed_table('field_indirection_test_2', 'int_col');
 create_distributed_table
---------------------------------------------------------------------

(1 row)

-- not supported (field indirection in multi row insert)
INSERT INTO field_indirection_test_2 (ct2_col.int_1, int_col, ct2_col.text_1, ct1_col.int_2)
VALUES (0, 1, 'text1', 2), (3, 4, 'text1', 5);
ERROR:  inserting or modifying composite type fields is not supported
HINT:  Use the column name to insert or update the composite type as a single value
-- not supported (field indirection in update)
UPDATE field_indirection_test_2 SET (ct2_col.text_1, ct1_col.int_2) = ('text2', 10) WHERE int_col=4;
ERROR:  inserting or modifying composite type fields is not supported
HINT:  Use the column name to insert or update the composite type as a single value
CREATE TYPE two_ints as (if1 int, if2 int);
CREATE DOMAIN domain AS two_ints CHECK ((VALUE).if1 > 0);
CREATE TABLE domain_indirection_test (f1 int, f3 domain, domain_array domain[]);
SELECT create_distributed_table('domain_indirection_test', 'f1');
 create_distributed_table
---------------------------------------------------------------------

(1 row)

-- not supported (field indirection to underlying composite type)
INSERT INTO domain_indirection_test (f1,f3.if1, f3.if2) VALUES (0, 1, 2);
ERROR:  inserting or modifying composite type fields is not supported
HINT:  Use the column name to insert or update the composite type as a single value
INSERT INTO domain_indirection_test (f1,f3.if1) VALUES (0, 1);
ERROR:  inserting or modifying composite type fields is not supported
HINT:  Use the column name to insert or update the composite type as a single value
UPDATE domain_indirection_test SET domain_array[0].if2 = 5;
ERROR:  inserting or modifying composite type fields is not supported
HINT:  Use the column name to insert or update the composite type as a single value
-- below are supported as we don't do any field indirection
INSERT INTO field_indirection_test_2 (ct2_col, int_col, ct1_col)
VALUES ('(1, "text1", 2)', 3, '(4, 5)'), ('(6, "text2", 7)', 8, '(9, 10)');
UPDATE field_indirection_test_2 SET (ct2_col, ct1_col) = ('(10, "text10", 20)', '(40, 50)') WHERE int_col=8;
SELECT * FROM field_indirection_test_2 ORDER BY 1,2,3;
 int_col |      ct2_col      | ct1_col
---------------------------------------------------------------------
       3 | (1," text1",2)    | (4,5)
       8 | (10," text10",20) | (40,50)
(2 rows)

-- Show that PG does not allow adding a circular dependency btw types
-- We added here to make sure we can catch it if PG changes its behaviour
CREATE TYPE circ_type1 AS (a int);
CREATE TYPE circ_type2 AS (a int, b circ_type1);
ALTER TYPE circ_type1 ADD ATTRIBUTE b circ_type2;
ERROR:  composite type circ_type1 cannot be made a member of itself
-- Show that types can be created locally if has unsupported dependency
CREATE TYPE text_local_def;
CREATE FUNCTION text_local_def_in(cstring)
   RETURNS text_local_def
   AS 'textin'
   LANGUAGE internal STRICT IMMUTABLE;
NOTICE:  return type text_local_def is only a shell
WARNING:  "function text_local_def_in(cstring)" has dependency on unsupported object "type text_local_def"
DETAIL:  "function text_local_def_in(cstring)" will be created only locally
CREATE FUNCTION text_local_def_out(text_local_def)
   RETURNS cstring
   AS 'textout'
   LANGUAGE internal STRICT IMMUTABLE;
NOTICE:  argument type text_local_def is only a shell
WARNING:  "function text_local_def_out(text_local_def)" has dependency on unsupported object "type text_local_def"
DETAIL:  "function text_local_def_out(text_local_def)" will be created only locally
CREATE TYPE text_local_def (
   internallength = variable,
   input = text_local_def_in,
   output = text_local_def_out,
   alignment = int4,
   default = 'zippo'
);
-- It should be created locally as it has unsupported dependency
CREATE TYPE default_test_row AS (f1 text_local_def, f2 int4);
WARNING:  "type default_test_row" has dependency on unsupported object "type text_local_def"
DETAIL:  "type default_test_row" will be created only locally
-- Distributing table depending on that type should error out
CREATE TABLE table_text_local_def(id int, col_1 default_test_row);
SELECT create_distributed_table('table_text_local_def','id');
ERROR:  "table table_text_local_def" has dependency on unsupported object "type text_local_def"
-- will skip trying to propagate the type/enum due to temp schema
CREATE TYPE pg_temp.temp_type AS (int_field int);
WARNING:  "type temp_type" has dependency on unsupported object "schema pg_temp_xxx"
DETAIL:  "type temp_type" will be created only locally
CREATE TYPE pg_temp.temp_enum AS ENUM ('one', 'two', 'three');
WARNING:  "type temp_enum" has dependency on unsupported object "schema pg_temp_xxx"
DETAIL:  "type temp_enum" will be created only locally
-- clear objects
SET client_min_messages TO error; -- suppress cascading objects dropping
DROP SCHEMA type_tests CASCADE;
DROP SCHEMA type_tests2 CASCADE;
DROP USER typeuser;
