Parsed test spec with 3 sessions

starting permutation: s1-load-cache s1-insert s3-acquire-advisory-lock s1-begin s1-select s2-begin s2-isolate-tenant s1-update s1-commit s3-release-advisory-lock s2-commit s2-print-cluster
create_distributed_table
---------------------------------------------------------------------

(1 row)

step s1-load-cache:
 TRUNCATE isolation_table;
 TRUNCATE isolation_table2;

step s1-insert:
 INSERT INTO isolation_table VALUES (5, 10);
 INSERT INTO isolation_table2 VALUES (5, 10);

step s3-acquire-advisory-lock:
    SELECT pg_advisory_lock(44000, 55152);

pg_advisory_lock
---------------------------------------------------------------------

(1 row)

step s1-begin:
    BEGIN;
    -- the tests are written with the logic where single shard SELECTs
    -- do not to open transaction blocks
    SET citus.select_opens_transaction_block TO false;

step s1-select:
 SELECT count(*) FROM isolation_table WHERE id = 5;

count
---------------------------------------------------------------------
    1
(1 row)

step s2-begin:
 BEGIN;

step s2-isolate-tenant:
 SELECT isolate_tenant_to_new_shard('isolation_table', 5, shard_transfer_mode => 'force_logical');
 <waiting ...>
step s1-update: 
 UPDATE isolation_table SET value = 5 WHERE id = 5;

step s1-commit:
 COMMIT;

step s3-release-advisory-lock:
    SELECT pg_advisory_unlock(44000, 55152);

pg_advisory_unlock
---------------------------------------------------------------------
t
(1 row)

step s2-isolate-tenant: <... completed>
isolate_tenant_to_new_shard
---------------------------------------------------------------------
                    1500078
(1 row)

step s2-commit:
 COMMIT;

step s2-print-cluster:
 -- row count per shard
 SELECT
  nodeport, shardid, success, result
 FROM
  run_command_on_placements('isolation_table', 'select count(*) from %s')
 ORDER BY
  nodeport, shardid;
 -- rows
 SELECT id, value FROM isolation_table ORDER BY id, value;

nodeport|shardid|success|result
---------------------------------------------------------------------
   57637|1500077|t      |     0
   57637|1500078|t      |     1
   57637|1500079|t      |     0
   57638|1500074|t      |     0
(4 rows)

id|value
---------------------------------------------------------------------
 5|    5
(1 row)


starting permutation: s1-load-cache s1-insert s3-acquire-advisory-lock s1-begin s1-select s2-begin s2-isolate-tenant s1-delete s1-commit s3-release-advisory-lock s2-commit s2-print-cluster
create_distributed_table
---------------------------------------------------------------------

(1 row)

step s1-load-cache:
 TRUNCATE isolation_table;
 TRUNCATE isolation_table2;

step s1-insert:
 INSERT INTO isolation_table VALUES (5, 10);
 INSERT INTO isolation_table2 VALUES (5, 10);

step s3-acquire-advisory-lock:
    SELECT pg_advisory_lock(44000, 55152);

pg_advisory_lock
---------------------------------------------------------------------

(1 row)

step s1-begin:
    BEGIN;
    -- the tests are written with the logic where single shard SELECTs
    -- do not to open transaction blocks
    SET citus.select_opens_transaction_block TO false;

step s1-select:
 SELECT count(*) FROM isolation_table WHERE id = 5;

count
---------------------------------------------------------------------
    1
(1 row)

step s2-begin:
 BEGIN;

step s2-isolate-tenant:
 SELECT isolate_tenant_to_new_shard('isolation_table', 5, shard_transfer_mode => 'force_logical');
 <waiting ...>
step s1-delete: 
 DELETE FROM isolation_table WHERE id = 5;

step s1-commit:
 COMMIT;

step s3-release-advisory-lock:
    SELECT pg_advisory_unlock(44000, 55152);

pg_advisory_unlock
---------------------------------------------------------------------
t
(1 row)

step s2-isolate-tenant: <... completed>
isolate_tenant_to_new_shard
---------------------------------------------------------------------
                    1500086
(1 row)

step s2-commit:
 COMMIT;

step s2-print-cluster:
 -- row count per shard
 SELECT
  nodeport, shardid, success, result
 FROM
  run_command_on_placements('isolation_table', 'select count(*) from %s')
 ORDER BY
  nodeport, shardid;
 -- rows
 SELECT id, value FROM isolation_table ORDER BY id, value;

nodeport|shardid|success|result
---------------------------------------------------------------------
   57637|1500085|t      |     0
   57637|1500086|t      |     0
   57637|1500087|t      |     0
   57638|1500082|t      |     0
(4 rows)

id|value
---------------------------------------------------------------------
(0 rows)


starting permutation: s1-load-cache s3-acquire-advisory-lock s1-begin s1-select s2-begin s2-isolate-tenant s1-insert s1-commit s3-release-advisory-lock s2-commit s2-print-cluster
create_distributed_table
---------------------------------------------------------------------

(1 row)

step s1-load-cache:
 TRUNCATE isolation_table;
 TRUNCATE isolation_table2;

step s3-acquire-advisory-lock:
    SELECT pg_advisory_lock(44000, 55152);

pg_advisory_lock
---------------------------------------------------------------------

(1 row)

step s1-begin:
    BEGIN;
    -- the tests are written with the logic where single shard SELECTs
    -- do not to open transaction blocks
    SET citus.select_opens_transaction_block TO false;

step s1-select:
 SELECT count(*) FROM isolation_table WHERE id = 5;

count
---------------------------------------------------------------------
    0
(1 row)

step s2-begin:
 BEGIN;

step s2-isolate-tenant:
 SELECT isolate_tenant_to_new_shard('isolation_table', 5, shard_transfer_mode => 'force_logical');
 <waiting ...>
step s1-insert: 
 INSERT INTO isolation_table VALUES (5, 10);
 INSERT INTO isolation_table2 VALUES (5, 10);

step s1-commit:
 COMMIT;

step s3-release-advisory-lock:
    SELECT pg_advisory_unlock(44000, 55152);

pg_advisory_unlock
---------------------------------------------------------------------
t
(1 row)

step s2-isolate-tenant: <... completed>
isolate_tenant_to_new_shard
---------------------------------------------------------------------
                    1500094
(1 row)

step s2-commit:
 COMMIT;

step s2-print-cluster:
 -- row count per shard
 SELECT
  nodeport, shardid, success, result
 FROM
  run_command_on_placements('isolation_table', 'select count(*) from %s')
 ORDER BY
  nodeport, shardid;
 -- rows
 SELECT id, value FROM isolation_table ORDER BY id, value;

nodeport|shardid|success|result
---------------------------------------------------------------------
   57637|1500093|t      |     0
   57637|1500094|t      |     1
   57637|1500095|t      |     0
   57638|1500090|t      |     0
(4 rows)

id|value
---------------------------------------------------------------------
 5|   10
(1 row)


starting permutation: s1-load-cache s3-acquire-advisory-lock s1-begin s1-select s2-begin s2-isolate-tenant s1-copy s1-commit s3-release-advisory-lock s2-commit s2-print-cluster
create_distributed_table
---------------------------------------------------------------------

(1 row)

step s1-load-cache:
 TRUNCATE isolation_table;
 TRUNCATE isolation_table2;

step s3-acquire-advisory-lock:
    SELECT pg_advisory_lock(44000, 55152);

pg_advisory_lock
---------------------------------------------------------------------

(1 row)

step s1-begin:
    BEGIN;
    -- the tests are written with the logic where single shard SELECTs
    -- do not to open transaction blocks
    SET citus.select_opens_transaction_block TO false;

step s1-select:
 SELECT count(*) FROM isolation_table WHERE id = 5;

count
---------------------------------------------------------------------
    0
(1 row)

step s2-begin:
 BEGIN;

step s2-isolate-tenant:
 SELECT isolate_tenant_to_new_shard('isolation_table', 5, shard_transfer_mode => 'force_logical');
 <waiting ...>
step s1-copy: 
 COPY isolation_table FROM PROGRAM 'echo "1,1\n2,2\n3,3\n4,4\n5,5"' WITH CSV;

step s1-commit:
 COMMIT;

step s3-release-advisory-lock:
    SELECT pg_advisory_unlock(44000, 55152);

pg_advisory_unlock
---------------------------------------------------------------------
t
(1 row)

step s2-isolate-tenant: <... completed>
isolate_tenant_to_new_shard
---------------------------------------------------------------------
                    1500102
(1 row)

step s2-commit:
 COMMIT;

step s2-print-cluster:
 -- row count per shard
 SELECT
  nodeport, shardid, success, result
 FROM
  run_command_on_placements('isolation_table', 'select count(*) from %s')
 ORDER BY
  nodeport, shardid;
 -- rows
 SELECT id, value FROM isolation_table ORDER BY id, value;

nodeport|shardid|success|result
---------------------------------------------------------------------
   57637|1500101|t      |     1
   57637|1500102|t      |     1
   57637|1500103|t      |     2
   57638|1500098|t      |     1
(4 rows)

id|value
---------------------------------------------------------------------
 1|    1
 2|    2
 3|    3
 4|    4
 5|    5
(5 rows)


starting permutation: s1-insert s3-acquire-advisory-lock s1-begin s1-select s2-begin s2-isolate-tenant s1-update s1-commit s3-release-advisory-lock s2-commit s2-print-cluster
create_distributed_table
---------------------------------------------------------------------

(1 row)

step s1-insert:
 INSERT INTO isolation_table VALUES (5, 10);
 INSERT INTO isolation_table2 VALUES (5, 10);

step s3-acquire-advisory-lock:
    SELECT pg_advisory_lock(44000, 55152);

pg_advisory_lock
---------------------------------------------------------------------

(1 row)

step s1-begin:
    BEGIN;
    -- the tests are written with the logic where single shard SELECTs
    -- do not to open transaction blocks
    SET citus.select_opens_transaction_block TO false;

step s1-select:
 SELECT count(*) FROM isolation_table WHERE id = 5;

count
---------------------------------------------------------------------
    1
(1 row)

step s2-begin:
 BEGIN;

step s2-isolate-tenant:
 SELECT isolate_tenant_to_new_shard('isolation_table', 5, shard_transfer_mode => 'force_logical');
 <waiting ...>
step s1-update: 
 UPDATE isolation_table SET value = 5 WHERE id = 5;

step s1-commit:
 COMMIT;

step s3-release-advisory-lock:
    SELECT pg_advisory_unlock(44000, 55152);

pg_advisory_unlock
---------------------------------------------------------------------
t
(1 row)

step s2-isolate-tenant: <... completed>
isolate_tenant_to_new_shard
---------------------------------------------------------------------
                    1500110
(1 row)

step s2-commit:
 COMMIT;

step s2-print-cluster:
 -- row count per shard
 SELECT
  nodeport, shardid, success, result
 FROM
  run_command_on_placements('isolation_table', 'select count(*) from %s')
 ORDER BY
  nodeport, shardid;
 -- rows
 SELECT id, value FROM isolation_table ORDER BY id, value;

nodeport|shardid|success|result
---------------------------------------------------------------------
   57637|1500109|t      |     0
   57637|1500110|t      |     1
   57637|1500111|t      |     0
   57638|1500106|t      |     0
(4 rows)

id|value
---------------------------------------------------------------------
 5|    5
(1 row)


starting permutation: s1-insert s3-acquire-advisory-lock s1-begin s1-select s2-begin s2-isolate-tenant s1-delete s1-commit s3-release-advisory-lock s2-commit s2-print-cluster
create_distributed_table
---------------------------------------------------------------------

(1 row)

step s1-insert:
 INSERT INTO isolation_table VALUES (5, 10);
 INSERT INTO isolation_table2 VALUES (5, 10);

step s3-acquire-advisory-lock:
    SELECT pg_advisory_lock(44000, 55152);

pg_advisory_lock
---------------------------------------------------------------------

(1 row)

step s1-begin:
    BEGIN;
    -- the tests are written with the logic where single shard SELECTs
    -- do not to open transaction blocks
    SET citus.select_opens_transaction_block TO false;

step s1-select:
 SELECT count(*) FROM isolation_table WHERE id = 5;

count
---------------------------------------------------------------------
    1
(1 row)

step s2-begin:
 BEGIN;

step s2-isolate-tenant:
 SELECT isolate_tenant_to_new_shard('isolation_table', 5, shard_transfer_mode => 'force_logical');
 <waiting ...>
step s1-delete: 
 DELETE FROM isolation_table WHERE id = 5;

step s1-commit:
 COMMIT;

step s3-release-advisory-lock:
    SELECT pg_advisory_unlock(44000, 55152);

pg_advisory_unlock
---------------------------------------------------------------------
t
(1 row)

step s2-isolate-tenant: <... completed>
isolate_tenant_to_new_shard
---------------------------------------------------------------------
                    1500118
(1 row)

step s2-commit:
 COMMIT;

step s2-print-cluster:
 -- row count per shard
 SELECT
  nodeport, shardid, success, result
 FROM
  run_command_on_placements('isolation_table', 'select count(*) from %s')
 ORDER BY
  nodeport, shardid;
 -- rows
 SELECT id, value FROM isolation_table ORDER BY id, value;

nodeport|shardid|success|result
---------------------------------------------------------------------
   57637|1500117|t      |     0
   57637|1500118|t      |     0
   57637|1500119|t      |     0
   57638|1500114|t      |     0
(4 rows)

id|value
---------------------------------------------------------------------
(0 rows)


starting permutation: s3-acquire-advisory-lock s1-begin s1-select s2-begin s2-isolate-tenant s1-insert s1-commit s3-release-advisory-lock s2-commit s2-print-cluster
create_distributed_table
---------------------------------------------------------------------

(1 row)

step s3-acquire-advisory-lock:
    SELECT pg_advisory_lock(44000, 55152);

pg_advisory_lock
---------------------------------------------------------------------

(1 row)

step s1-begin:
    BEGIN;
    -- the tests are written with the logic where single shard SELECTs
    -- do not to open transaction blocks
    SET citus.select_opens_transaction_block TO false;

step s1-select:
 SELECT count(*) FROM isolation_table WHERE id = 5;

count
---------------------------------------------------------------------
    0
(1 row)

step s2-begin:
 BEGIN;

step s2-isolate-tenant:
 SELECT isolate_tenant_to_new_shard('isolation_table', 5, shard_transfer_mode => 'force_logical');
 <waiting ...>
step s1-insert: 
 INSERT INTO isolation_table VALUES (5, 10);
 INSERT INTO isolation_table2 VALUES (5, 10);

step s1-commit:
 COMMIT;

step s3-release-advisory-lock:
    SELECT pg_advisory_unlock(44000, 55152);

pg_advisory_unlock
---------------------------------------------------------------------
t
(1 row)

step s2-isolate-tenant: <... completed>
isolate_tenant_to_new_shard
---------------------------------------------------------------------
                    1500126
(1 row)

step s2-commit:
 COMMIT;

step s2-print-cluster:
 -- row count per shard
 SELECT
  nodeport, shardid, success, result
 FROM
  run_command_on_placements('isolation_table', 'select count(*) from %s')
 ORDER BY
  nodeport, shardid;
 -- rows
 SELECT id, value FROM isolation_table ORDER BY id, value;

nodeport|shardid|success|result
---------------------------------------------------------------------
   57637|1500125|t      |     0
   57637|1500126|t      |     1
   57637|1500127|t      |     0
   57638|1500122|t      |     0
(4 rows)

id|value
---------------------------------------------------------------------
 5|   10
(1 row)


starting permutation: s3-acquire-advisory-lock s1-begin s1-select s2-begin s2-isolate-tenant s1-copy s1-commit s3-release-advisory-lock s2-commit s2-print-cluster
create_distributed_table
---------------------------------------------------------------------

(1 row)

step s3-acquire-advisory-lock:
    SELECT pg_advisory_lock(44000, 55152);

pg_advisory_lock
---------------------------------------------------------------------

(1 row)

step s1-begin:
    BEGIN;
    -- the tests are written with the logic where single shard SELECTs
    -- do not to open transaction blocks
    SET citus.select_opens_transaction_block TO false;

step s1-select:
 SELECT count(*) FROM isolation_table WHERE id = 5;

count
---------------------------------------------------------------------
    0
(1 row)

step s2-begin:
 BEGIN;

step s2-isolate-tenant:
 SELECT isolate_tenant_to_new_shard('isolation_table', 5, shard_transfer_mode => 'force_logical');
 <waiting ...>
step s1-copy: 
 COPY isolation_table FROM PROGRAM 'echo "1,1\n2,2\n3,3\n4,4\n5,5"' WITH CSV;

step s1-commit:
 COMMIT;

step s3-release-advisory-lock:
    SELECT pg_advisory_unlock(44000, 55152);

pg_advisory_unlock
---------------------------------------------------------------------
t
(1 row)

step s2-isolate-tenant: <... completed>
isolate_tenant_to_new_shard
---------------------------------------------------------------------
                    1500134
(1 row)

step s2-commit:
 COMMIT;

step s2-print-cluster:
 -- row count per shard
 SELECT
  nodeport, shardid, success, result
 FROM
  run_command_on_placements('isolation_table', 'select count(*) from %s')
 ORDER BY
  nodeport, shardid;
 -- rows
 SELECT id, value FROM isolation_table ORDER BY id, value;

nodeport|shardid|success|result
---------------------------------------------------------------------
   57637|1500133|t      |     1
   57637|1500134|t      |     1
   57637|1500135|t      |     2
   57638|1500130|t      |     1
(4 rows)

id|value
---------------------------------------------------------------------
 1|    1
 2|    2
 3|    3
 4|    4
 5|    5
(5 rows)


starting permutation: s1-load-cache s1-insert s3-acquire-advisory-lock s2-isolate-tenant s1-isolate-tenant-same-coloc s3-release-advisory-lock s2-print-cluster
create_distributed_table
---------------------------------------------------------------------

(1 row)

step s1-load-cache:
 TRUNCATE isolation_table;
 TRUNCATE isolation_table2;

step s1-insert:
 INSERT INTO isolation_table VALUES (5, 10);
 INSERT INTO isolation_table2 VALUES (5, 10);

step s3-acquire-advisory-lock:
    SELECT pg_advisory_lock(44000, 55152);

pg_advisory_lock
---------------------------------------------------------------------

(1 row)

step s2-isolate-tenant:
 SELECT isolate_tenant_to_new_shard('isolation_table', 5, shard_transfer_mode => 'force_logical');
 <waiting ...>
step s1-isolate-tenant-same-coloc: 
 SELECT isolate_tenant_to_new_shard('isolation_table', 2, shard_transfer_mode => 'force_logical');

ERROR:  could not acquire the lock required to split public.isolation_table
step s3-release-advisory-lock:
    SELECT pg_advisory_unlock(44000, 55152);

pg_advisory_unlock
---------------------------------------------------------------------
t
(1 row)

step s2-isolate-tenant: <... completed>
isolate_tenant_to_new_shard
---------------------------------------------------------------------
                    1500142
(1 row)

step s2-print-cluster:
 -- row count per shard
 SELECT
  nodeport, shardid, success, result
 FROM
  run_command_on_placements('isolation_table', 'select count(*) from %s')
 ORDER BY
  nodeport, shardid;
 -- rows
 SELECT id, value FROM isolation_table ORDER BY id, value;

nodeport|shardid|success|result
---------------------------------------------------------------------
   57637|1500141|t      |     0
   57637|1500142|t      |     1
   57637|1500143|t      |     0
   57638|1500138|t      |     0
(4 rows)

id|value
---------------------------------------------------------------------
 5|   10
(1 row)


starting permutation: s1-load-cache s1-insert s3-acquire-advisory-lock s2-isolate-tenant s1-isolate-tenant-same-coloc-blocking s3-release-advisory-lock s2-print-cluster
create_distributed_table
---------------------------------------------------------------------

(1 row)

step s1-load-cache:
 TRUNCATE isolation_table;
 TRUNCATE isolation_table2;

step s1-insert:
 INSERT INTO isolation_table VALUES (5, 10);
 INSERT INTO isolation_table2 VALUES (5, 10);

step s3-acquire-advisory-lock:
    SELECT pg_advisory_lock(44000, 55152);

pg_advisory_lock
---------------------------------------------------------------------

(1 row)

step s2-isolate-tenant:
 SELECT isolate_tenant_to_new_shard('isolation_table', 5, shard_transfer_mode => 'force_logical');
 <waiting ...>
step s1-isolate-tenant-same-coloc-blocking: 
 SELECT isolate_tenant_to_new_shard('isolation_table', 2, shard_transfer_mode => 'block_writes');

ERROR:  could not acquire the lock required to split public.isolation_table
step s3-release-advisory-lock:
    SELECT pg_advisory_unlock(44000, 55152);

pg_advisory_unlock
---------------------------------------------------------------------
t
(1 row)

step s2-isolate-tenant: <... completed>
isolate_tenant_to_new_shard
---------------------------------------------------------------------
                    1500150
(1 row)

step s2-print-cluster:
 -- row count per shard
 SELECT
  nodeport, shardid, success, result
 FROM
  run_command_on_placements('isolation_table', 'select count(*) from %s')
 ORDER BY
  nodeport, shardid;
 -- rows
 SELECT id, value FROM isolation_table ORDER BY id, value;

nodeport|shardid|success|result
---------------------------------------------------------------------
   57637|1500149|t      |     0
   57637|1500150|t      |     1
   57637|1500151|t      |     0
   57638|1500146|t      |     0
(4 rows)

id|value
---------------------------------------------------------------------
 5|   10
(1 row)


starting permutation: s1-load-cache s1-insert s3-acquire-advisory-lock s2-isolate-tenant s1-isolate-tenant-no-same-coloc s3-release-advisory-lock s2-print-cluster
create_distributed_table
---------------------------------------------------------------------

(1 row)

step s1-load-cache:
 TRUNCATE isolation_table;
 TRUNCATE isolation_table2;

step s1-insert:
 INSERT INTO isolation_table VALUES (5, 10);
 INSERT INTO isolation_table2 VALUES (5, 10);

step s3-acquire-advisory-lock:
    SELECT pg_advisory_lock(44000, 55152);

pg_advisory_lock
---------------------------------------------------------------------

(1 row)

step s2-isolate-tenant:
 SELECT isolate_tenant_to_new_shard('isolation_table', 5, shard_transfer_mode => 'force_logical');
 <waiting ...>
step s1-isolate-tenant-no-same-coloc: 
 SELECT isolate_tenant_to_new_shard('isolation_table2', 2, shard_transfer_mode => 'force_logical');

ERROR:  could not acquire the lock required to split concurrently public.isolation_table2.
step s3-release-advisory-lock:
    SELECT pg_advisory_unlock(44000, 55152);

pg_advisory_unlock
---------------------------------------------------------------------
t
(1 row)

step s2-isolate-tenant: <... completed>
isolate_tenant_to_new_shard
---------------------------------------------------------------------
                    1500158
(1 row)

step s2-print-cluster:
 -- row count per shard
 SELECT
  nodeport, shardid, success, result
 FROM
  run_command_on_placements('isolation_table', 'select count(*) from %s')
 ORDER BY
  nodeport, shardid;
 -- rows
 SELECT id, value FROM isolation_table ORDER BY id, value;

nodeport|shardid|success|result
---------------------------------------------------------------------
   57637|1500157|t      |     0
   57637|1500158|t      |     1
   57637|1500159|t      |     0
   57638|1500154|t      |     0
(4 rows)

id|value
---------------------------------------------------------------------
 5|   10
(1 row)


starting permutation: s1-load-cache s1-insert s3-acquire-advisory-lock s2-begin s2-isolate-tenant s1-isolate-tenant-no-same-coloc s3-release-advisory-lock s2-commit s2-print-cluster
create_distributed_table
---------------------------------------------------------------------

(1 row)

step s1-load-cache:
 TRUNCATE isolation_table;
 TRUNCATE isolation_table2;

step s1-insert:
 INSERT INTO isolation_table VALUES (5, 10);
 INSERT INTO isolation_table2 VALUES (5, 10);

step s3-acquire-advisory-lock:
    SELECT pg_advisory_lock(44000, 55152);

pg_advisory_lock
---------------------------------------------------------------------

(1 row)

step s2-begin:
 BEGIN;

step s2-isolate-tenant:
 SELECT isolate_tenant_to_new_shard('isolation_table', 5, shard_transfer_mode => 'force_logical');
 <waiting ...>
step s1-isolate-tenant-no-same-coloc: 
 SELECT isolate_tenant_to_new_shard('isolation_table2', 2, shard_transfer_mode => 'force_logical');

ERROR:  could not acquire the lock required to split concurrently public.isolation_table2.
step s3-release-advisory-lock:
    SELECT pg_advisory_unlock(44000, 55152);

pg_advisory_unlock
---------------------------------------------------------------------
t
(1 row)

step s2-isolate-tenant: <... completed>
isolate_tenant_to_new_shard
---------------------------------------------------------------------
                    1500169
(1 row)

step s2-commit:
 COMMIT;

step s2-print-cluster:
 -- row count per shard
 SELECT
  nodeport, shardid, success, result
 FROM
  run_command_on_placements('isolation_table', 'select count(*) from %s')
 ORDER BY
  nodeport, shardid;
 -- rows
 SELECT id, value FROM isolation_table ORDER BY id, value;

nodeport|shardid|success|result
---------------------------------------------------------------------
   57637|1500168|t      |     0
   57637|1500169|t      |     1
   57637|1500170|t      |     0
   57638|1500165|t      |     0
(4 rows)

id|value
---------------------------------------------------------------------
 5|   10
(1 row)


starting permutation: s1-load-cache s1-insert s3-acquire-advisory-lock s2-isolate-tenant s1-isolate-tenant-no-same-coloc-blocking s3-release-advisory-lock s2-print-cluster
create_distributed_table
---------------------------------------------------------------------

(1 row)

step s1-load-cache:
 TRUNCATE isolation_table;
 TRUNCATE isolation_table2;

step s1-insert:
 INSERT INTO isolation_table VALUES (5, 10);
 INSERT INTO isolation_table2 VALUES (5, 10);

step s3-acquire-advisory-lock:
    SELECT pg_advisory_lock(44000, 55152);

pg_advisory_lock
---------------------------------------------------------------------

(1 row)

step s2-isolate-tenant:
 SELECT isolate_tenant_to_new_shard('isolation_table', 5, shard_transfer_mode => 'force_logical');
 <waiting ...>
step s1-isolate-tenant-no-same-coloc-blocking: 
 SELECT isolate_tenant_to_new_shard('isolation_table2', 2, shard_transfer_mode => 'block_writes');

isolate_tenant_to_new_shard
---------------------------------------------------------------------
                    1500183
(1 row)

step s3-release-advisory-lock:
    SELECT pg_advisory_unlock(44000, 55152);

pg_advisory_unlock
---------------------------------------------------------------------
t
(1 row)

step s2-isolate-tenant: <... completed>
isolate_tenant_to_new_shard
---------------------------------------------------------------------
                    1500180
(1 row)

step s2-print-cluster:
 -- row count per shard
 SELECT
  nodeport, shardid, success, result
 FROM
  run_command_on_placements('isolation_table', 'select count(*) from %s')
 ORDER BY
  nodeport, shardid;
 -- rows
 SELECT id, value FROM isolation_table ORDER BY id, value;

nodeport|shardid|success|result
---------------------------------------------------------------------
   57637|1500179|t      |     0
   57637|1500180|t      |     1
   57637|1500181|t      |     0
   57638|1500176|t      |     0
(4 rows)

id|value
---------------------------------------------------------------------
 5|   10
(1 row)


starting permutation: s1-load-cache s1-insert s3-acquire-advisory-lock s2-isolate-tenant s1-isolate-tenant-no-same-coloc-blocking s3-release-advisory-lock s2-print-cluster
create_distributed_table
---------------------------------------------------------------------

(1 row)

step s1-load-cache:
 TRUNCATE isolation_table;
 TRUNCATE isolation_table2;

step s1-insert:
 INSERT INTO isolation_table VALUES (5, 10);
 INSERT INTO isolation_table2 VALUES (5, 10);

step s3-acquire-advisory-lock:
    SELECT pg_advisory_lock(44000, 55152);

pg_advisory_lock
---------------------------------------------------------------------

(1 row)

step s2-isolate-tenant:
 SELECT isolate_tenant_to_new_shard('isolation_table', 5, shard_transfer_mode => 'force_logical');
 <waiting ...>
step s1-isolate-tenant-no-same-coloc-blocking: 
 SELECT isolate_tenant_to_new_shard('isolation_table2', 2, shard_transfer_mode => 'block_writes');

isolate_tenant_to_new_shard
---------------------------------------------------------------------
                    1500194
(1 row)

step s3-release-advisory-lock:
    SELECT pg_advisory_unlock(44000, 55152);

pg_advisory_unlock
---------------------------------------------------------------------
t
(1 row)

step s2-isolate-tenant: <... completed>
isolate_tenant_to_new_shard
---------------------------------------------------------------------
                    1500191
(1 row)

step s2-print-cluster:
 -- row count per shard
 SELECT
  nodeport, shardid, success, result
 FROM
  run_command_on_placements('isolation_table', 'select count(*) from %s')
 ORDER BY
  nodeport, shardid;
 -- rows
 SELECT id, value FROM isolation_table ORDER BY id, value;

nodeport|shardid|success|result
---------------------------------------------------------------------
   57637|1500190|t      |     0
   57637|1500191|t      |     1
   57637|1500192|t      |     0
   57638|1500187|t      |     0
(4 rows)

id|value
---------------------------------------------------------------------
 5|   10
(1 row)

