Parsed test spec with 3 sessions

starting permutation: s1-load-cache s1-insert s3-acquire-advisory-lock s1-begin s1-select s2-begin s2-isolate-tenant s1-update s1-commit s3-release-advisory-lock s2-commit s2-print-cluster
create_distributed_table
---------------------------------------------------------------------

(1 row)

step s1-load-cache:
 TRUNCATE isolation_table;
 TRUNCATE isolation_table2;

step s1-insert:
 INSERT INTO isolation_table VALUES (5, 10);
 INSERT INTO isolation_table2 VALUES (5, 10);

step s3-acquire-advisory-lock:
    SELECT pg_advisory_lock(44000, 55152);

pg_advisory_lock
---------------------------------------------------------------------

(1 row)

step s1-begin:
    BEGIN;
    -- the tests are written with the logic where single shard SELECTs
    -- do not to open transaction blocks
    SET citus.select_opens_transaction_block TO false;

step s1-select:
 SELECT count(*) FROM isolation_table WHERE id = 5;

count
---------------------------------------------------------------------
    1
(1 row)

step s2-begin:
 BEGIN;

step s2-isolate-tenant:
 SELECT isolate_tenant_to_new_shard('isolation_table', 5, shard_transfer_mode => 'force_logical');
 <waiting ...>
step s1-update: 
 UPDATE isolation_table SET value = 5 WHERE id = 5;

step s1-commit:
 COMMIT;

step s3-release-advisory-lock:
    SELECT pg_advisory_unlock(44000, 55152);

pg_advisory_unlock
---------------------------------------------------------------------
t
(1 row)

step s2-isolate-tenant: <... completed>
isolate_tenant_to_new_shard
---------------------------------------------------------------------
                    1500162
(1 row)

step s2-commit:
 COMMIT;

step s2-print-cluster:
 -- row count per shard
 SELECT
  nodeport, shardid, success, result
 FROM
  run_command_on_placements('isolation_table', 'select count(*) from %s')
 ORDER BY
  nodeport, shardid;
 -- rows
 SELECT id, value FROM isolation_table ORDER BY id, value;

nodeport|shardid|success|result
---------------------------------------------------------------------
   57637|1500161|t      |     0
   57637|1500162|t      |     1
   57637|1500163|t      |     0
   57638|1500158|t      |     0
(4 rows)

id|value
---------------------------------------------------------------------
 5|    5
(1 row)


starting permutation: s1-load-cache s1-insert s3-acquire-advisory-lock s1-begin s1-select s2-begin s2-isolate-tenant s1-delete s1-commit s3-release-advisory-lock s2-commit s2-print-cluster
create_distributed_table
---------------------------------------------------------------------

(1 row)

step s1-load-cache:
 TRUNCATE isolation_table;
 TRUNCATE isolation_table2;

step s1-insert:
 INSERT INTO isolation_table VALUES (5, 10);
 INSERT INTO isolation_table2 VALUES (5, 10);

step s3-acquire-advisory-lock:
    SELECT pg_advisory_lock(44000, 55152);

pg_advisory_lock
---------------------------------------------------------------------

(1 row)

step s1-begin:
    BEGIN;
    -- the tests are written with the logic where single shard SELECTs
    -- do not to open transaction blocks
    SET citus.select_opens_transaction_block TO false;

step s1-select:
 SELECT count(*) FROM isolation_table WHERE id = 5;

count
---------------------------------------------------------------------
    1
(1 row)

step s2-begin:
 BEGIN;

step s2-isolate-tenant:
 SELECT isolate_tenant_to_new_shard('isolation_table', 5, shard_transfer_mode => 'force_logical');
 <waiting ...>
step s1-delete: 
 DELETE FROM isolation_table WHERE id = 5;

step s1-commit:
 COMMIT;

step s3-release-advisory-lock:
    SELECT pg_advisory_unlock(44000, 55152);

pg_advisory_unlock
---------------------------------------------------------------------
t
(1 row)

step s2-isolate-tenant: <... completed>
isolate_tenant_to_new_shard
---------------------------------------------------------------------
                    1500170
(1 row)

step s2-commit:
 COMMIT;

step s2-print-cluster:
 -- row count per shard
 SELECT
  nodeport, shardid, success, result
 FROM
  run_command_on_placements('isolation_table', 'select count(*) from %s')
 ORDER BY
  nodeport, shardid;
 -- rows
 SELECT id, value FROM isolation_table ORDER BY id, value;

nodeport|shardid|success|result
---------------------------------------------------------------------
   57637|1500169|t      |     0
   57637|1500170|t      |     0
   57637|1500171|t      |     0
   57638|1500166|t      |     0
(4 rows)

id|value
---------------------------------------------------------------------
(0 rows)


starting permutation: s1-load-cache s1-insert s3-acquire-advisory-lock s1-begin s1-select s2-begin s2-isolate-tenant s1-update-complex s1-commit s3-release-advisory-lock s2-commit s2-print-cluster
create_distributed_table
---------------------------------------------------------------------

(1 row)

step s1-load-cache:
 TRUNCATE isolation_table;
 TRUNCATE isolation_table2;

step s1-insert:
 INSERT INTO isolation_table VALUES (5, 10);
 INSERT INTO isolation_table2 VALUES (5, 10);

step s3-acquire-advisory-lock:
    SELECT pg_advisory_lock(44000, 55152);

pg_advisory_lock
---------------------------------------------------------------------

(1 row)

step s1-begin:
    BEGIN;
    -- the tests are written with the logic where single shard SELECTs
    -- do not to open transaction blocks
    SET citus.select_opens_transaction_block TO false;

step s1-select:
 SELECT count(*) FROM isolation_table WHERE id = 5;

count
---------------------------------------------------------------------
    1
(1 row)

step s2-begin:
 BEGIN;

step s2-isolate-tenant:
 SELECT isolate_tenant_to_new_shard('isolation_table', 5, shard_transfer_mode => 'force_logical');
 <waiting ...>
step s1-update-complex: 
 UPDATE isolation_table SET value = 5 WHERE id IN (
        SELECT max(id) FROM isolation_table
    );

step s1-commit:
 COMMIT;

step s3-release-advisory-lock:
    SELECT pg_advisory_unlock(44000, 55152);

pg_advisory_unlock
---------------------------------------------------------------------
t
(1 row)

step s2-isolate-tenant: <... completed>
isolate_tenant_to_new_shard
---------------------------------------------------------------------
                    1500178
(1 row)

step s2-commit:
 COMMIT;

step s2-print-cluster:
 -- row count per shard
 SELECT
  nodeport, shardid, success, result
 FROM
  run_command_on_placements('isolation_table', 'select count(*) from %s')
 ORDER BY
  nodeport, shardid;
 -- rows
 SELECT id, value FROM isolation_table ORDER BY id, value;

nodeport|shardid|success|result
---------------------------------------------------------------------
   57637|1500177|t      |     0
   57637|1500178|t      |     1
   57637|1500179|t      |     0
   57638|1500174|t      |     0
(4 rows)

id|value
---------------------------------------------------------------------
 5|    5
(1 row)


starting permutation: s1-load-cache s3-acquire-advisory-lock s1-begin s1-select s2-begin s2-isolate-tenant s1-insert s1-commit s3-release-advisory-lock s2-commit s2-print-cluster
create_distributed_table
---------------------------------------------------------------------

(1 row)

step s1-load-cache:
 TRUNCATE isolation_table;
 TRUNCATE isolation_table2;

step s3-acquire-advisory-lock:
    SELECT pg_advisory_lock(44000, 55152);

pg_advisory_lock
---------------------------------------------------------------------

(1 row)

step s1-begin:
    BEGIN;
    -- the tests are written with the logic where single shard SELECTs
    -- do not to open transaction blocks
    SET citus.select_opens_transaction_block TO false;

step s1-select:
 SELECT count(*) FROM isolation_table WHERE id = 5;

count
---------------------------------------------------------------------
    0
(1 row)

step s2-begin:
 BEGIN;

step s2-isolate-tenant:
 SELECT isolate_tenant_to_new_shard('isolation_table', 5, shard_transfer_mode => 'force_logical');
 <waiting ...>
step s1-insert: 
 INSERT INTO isolation_table VALUES (5, 10);
 INSERT INTO isolation_table2 VALUES (5, 10);

step s1-commit:
 COMMIT;

step s3-release-advisory-lock:
    SELECT pg_advisory_unlock(44000, 55152);

pg_advisory_unlock
---------------------------------------------------------------------
t
(1 row)

step s2-isolate-tenant: <... completed>
isolate_tenant_to_new_shard
---------------------------------------------------------------------
                    1500186
(1 row)

step s2-commit:
 COMMIT;

step s2-print-cluster:
 -- row count per shard
 SELECT
  nodeport, shardid, success, result
 FROM
  run_command_on_placements('isolation_table', 'select count(*) from %s')
 ORDER BY
  nodeport, shardid;
 -- rows
 SELECT id, value FROM isolation_table ORDER BY id, value;

nodeport|shardid|success|result
---------------------------------------------------------------------
   57637|1500185|t      |     0
   57637|1500186|t      |     1
   57637|1500187|t      |     0
   57638|1500182|t      |     0
(4 rows)

id|value
---------------------------------------------------------------------
 5|   10
(1 row)


starting permutation: s1-load-cache s3-acquire-advisory-lock s1-begin s1-select s2-begin s2-isolate-tenant s1-copy s1-commit s3-release-advisory-lock s2-commit s2-print-cluster
create_distributed_table
---------------------------------------------------------------------

(1 row)

step s1-load-cache:
 TRUNCATE isolation_table;
 TRUNCATE isolation_table2;

step s3-acquire-advisory-lock:
    SELECT pg_advisory_lock(44000, 55152);

pg_advisory_lock
---------------------------------------------------------------------

(1 row)

step s1-begin:
    BEGIN;
    -- the tests are written with the logic where single shard SELECTs
    -- do not to open transaction blocks
    SET citus.select_opens_transaction_block TO false;

step s1-select:
 SELECT count(*) FROM isolation_table WHERE id = 5;

count
---------------------------------------------------------------------
    0
(1 row)

step s2-begin:
 BEGIN;

step s2-isolate-tenant:
 SELECT isolate_tenant_to_new_shard('isolation_table', 5, shard_transfer_mode => 'force_logical');
 <waiting ...>
step s1-copy: 
 COPY isolation_table FROM PROGRAM 'echo "1,1\n2,2\n3,3\n4,4\n5,5"' WITH CSV;

step s1-commit:
 COMMIT;

step s3-release-advisory-lock:
    SELECT pg_advisory_unlock(44000, 55152);

pg_advisory_unlock
---------------------------------------------------------------------
t
(1 row)

step s2-isolate-tenant: <... completed>
isolate_tenant_to_new_shard
---------------------------------------------------------------------
                    1500194
(1 row)

step s2-commit:
 COMMIT;

step s2-print-cluster:
 -- row count per shard
 SELECT
  nodeport, shardid, success, result
 FROM
  run_command_on_placements('isolation_table', 'select count(*) from %s')
 ORDER BY
  nodeport, shardid;
 -- rows
 SELECT id, value FROM isolation_table ORDER BY id, value;

nodeport|shardid|success|result
---------------------------------------------------------------------
   57637|1500193|t      |     1
   57637|1500194|t      |     1
   57637|1500195|t      |     2
   57638|1500190|t      |     1
(4 rows)

id|value
---------------------------------------------------------------------
 1|    1
 2|    2
 3|    3
 4|    4
 5|    5
(5 rows)


starting permutation: s1-insert s3-acquire-advisory-lock s1-begin s1-select s2-begin s2-isolate-tenant s1-update s1-commit s3-release-advisory-lock s2-commit s2-print-cluster
create_distributed_table
---------------------------------------------------------------------

(1 row)

step s1-insert:
 INSERT INTO isolation_table VALUES (5, 10);
 INSERT INTO isolation_table2 VALUES (5, 10);

step s3-acquire-advisory-lock:
    SELECT pg_advisory_lock(44000, 55152);

pg_advisory_lock
---------------------------------------------------------------------

(1 row)

step s1-begin:
    BEGIN;
    -- the tests are written with the logic where single shard SELECTs
    -- do not to open transaction blocks
    SET citus.select_opens_transaction_block TO false;

step s1-select:
 SELECT count(*) FROM isolation_table WHERE id = 5;

count
---------------------------------------------------------------------
    1
(1 row)

step s2-begin:
 BEGIN;

step s2-isolate-tenant:
 SELECT isolate_tenant_to_new_shard('isolation_table', 5, shard_transfer_mode => 'force_logical');
 <waiting ...>
step s1-update: 
 UPDATE isolation_table SET value = 5 WHERE id = 5;

step s1-commit:
 COMMIT;

step s3-release-advisory-lock:
    SELECT pg_advisory_unlock(44000, 55152);

pg_advisory_unlock
---------------------------------------------------------------------
t
(1 row)

step s2-isolate-tenant: <... completed>
isolate_tenant_to_new_shard
---------------------------------------------------------------------
                    1500202
(1 row)

step s2-commit:
 COMMIT;

step s2-print-cluster:
 -- row count per shard
 SELECT
  nodeport, shardid, success, result
 FROM
  run_command_on_placements('isolation_table', 'select count(*) from %s')
 ORDER BY
  nodeport, shardid;
 -- rows
 SELECT id, value FROM isolation_table ORDER BY id, value;

nodeport|shardid|success|result
---------------------------------------------------------------------
   57637|1500201|t      |     0
   57637|1500202|t      |     1
   57637|1500203|t      |     0
   57638|1500198|t      |     0
(4 rows)

id|value
---------------------------------------------------------------------
 5|    5
(1 row)


starting permutation: s1-insert s3-acquire-advisory-lock s1-begin s1-select s2-begin s2-isolate-tenant s1-delete s1-commit s3-release-advisory-lock s2-commit s2-print-cluster
create_distributed_table
---------------------------------------------------------------------

(1 row)

step s1-insert:
 INSERT INTO isolation_table VALUES (5, 10);
 INSERT INTO isolation_table2 VALUES (5, 10);

step s3-acquire-advisory-lock:
    SELECT pg_advisory_lock(44000, 55152);

pg_advisory_lock
---------------------------------------------------------------------

(1 row)

step s1-begin:
    BEGIN;
    -- the tests are written with the logic where single shard SELECTs
    -- do not to open transaction blocks
    SET citus.select_opens_transaction_block TO false;

step s1-select:
 SELECT count(*) FROM isolation_table WHERE id = 5;

count
---------------------------------------------------------------------
    1
(1 row)

step s2-begin:
 BEGIN;

step s2-isolate-tenant:
 SELECT isolate_tenant_to_new_shard('isolation_table', 5, shard_transfer_mode => 'force_logical');
 <waiting ...>
step s1-delete: 
 DELETE FROM isolation_table WHERE id = 5;

step s1-commit:
 COMMIT;

step s3-release-advisory-lock:
    SELECT pg_advisory_unlock(44000, 55152);

pg_advisory_unlock
---------------------------------------------------------------------
t
(1 row)

step s2-isolate-tenant: <... completed>
isolate_tenant_to_new_shard
---------------------------------------------------------------------
                    1500210
(1 row)

step s2-commit:
 COMMIT;

step s2-print-cluster:
 -- row count per shard
 SELECT
  nodeport, shardid, success, result
 FROM
  run_command_on_placements('isolation_table', 'select count(*) from %s')
 ORDER BY
  nodeport, shardid;
 -- rows
 SELECT id, value FROM isolation_table ORDER BY id, value;

nodeport|shardid|success|result
---------------------------------------------------------------------
   57637|1500209|t      |     0
   57637|1500210|t      |     0
   57637|1500211|t      |     0
   57638|1500206|t      |     0
(4 rows)

id|value
---------------------------------------------------------------------
(0 rows)


starting permutation: s1-insert s3-acquire-advisory-lock s1-begin s1-select s2-begin s2-isolate-tenant s1-update-complex s1-commit s3-release-advisory-lock s2-commit s2-print-cluster
create_distributed_table
---------------------------------------------------------------------

(1 row)

step s1-insert:
 INSERT INTO isolation_table VALUES (5, 10);
 INSERT INTO isolation_table2 VALUES (5, 10);

step s3-acquire-advisory-lock:
    SELECT pg_advisory_lock(44000, 55152);

pg_advisory_lock
---------------------------------------------------------------------

(1 row)

step s1-begin:
    BEGIN;
    -- the tests are written with the logic where single shard SELECTs
    -- do not to open transaction blocks
    SET citus.select_opens_transaction_block TO false;

step s1-select:
 SELECT count(*) FROM isolation_table WHERE id = 5;

count
---------------------------------------------------------------------
    1
(1 row)

step s2-begin:
 BEGIN;

step s2-isolate-tenant:
 SELECT isolate_tenant_to_new_shard('isolation_table', 5, shard_transfer_mode => 'force_logical');
 <waiting ...>
step s1-update-complex: 
 UPDATE isolation_table SET value = 5 WHERE id IN (
        SELECT max(id) FROM isolation_table
    );

step s1-commit:
 COMMIT;

step s3-release-advisory-lock:
    SELECT pg_advisory_unlock(44000, 55152);

pg_advisory_unlock
---------------------------------------------------------------------
t
(1 row)

step s2-isolate-tenant: <... completed>
isolate_tenant_to_new_shard
---------------------------------------------------------------------
                    1500218
(1 row)

step s2-commit:
 COMMIT;

step s2-print-cluster:
 -- row count per shard
 SELECT
  nodeport, shardid, success, result
 FROM
  run_command_on_placements('isolation_table', 'select count(*) from %s')
 ORDER BY
  nodeport, shardid;
 -- rows
 SELECT id, value FROM isolation_table ORDER BY id, value;

nodeport|shardid|success|result
---------------------------------------------------------------------
   57637|1500217|t      |     0
   57637|1500218|t      |     1
   57637|1500219|t      |     0
   57638|1500214|t      |     0
(4 rows)

id|value
---------------------------------------------------------------------
 5|    5
(1 row)


starting permutation: s3-acquire-advisory-lock s1-begin s1-select s2-begin s2-isolate-tenant s1-insert s1-commit s3-release-advisory-lock s2-commit s2-print-cluster
create_distributed_table
---------------------------------------------------------------------

(1 row)

step s3-acquire-advisory-lock:
    SELECT pg_advisory_lock(44000, 55152);

pg_advisory_lock
---------------------------------------------------------------------

(1 row)

step s1-begin:
    BEGIN;
    -- the tests are written with the logic where single shard SELECTs
    -- do not to open transaction blocks
    SET citus.select_opens_transaction_block TO false;

step s1-select:
 SELECT count(*) FROM isolation_table WHERE id = 5;

count
---------------------------------------------------------------------
    0
(1 row)

step s2-begin:
 BEGIN;

step s2-isolate-tenant:
 SELECT isolate_tenant_to_new_shard('isolation_table', 5, shard_transfer_mode => 'force_logical');
 <waiting ...>
step s1-insert: 
 INSERT INTO isolation_table VALUES (5, 10);
 INSERT INTO isolation_table2 VALUES (5, 10);

step s1-commit:
 COMMIT;

step s3-release-advisory-lock:
    SELECT pg_advisory_unlock(44000, 55152);

pg_advisory_unlock
---------------------------------------------------------------------
t
(1 row)

step s2-isolate-tenant: <... completed>
isolate_tenant_to_new_shard
---------------------------------------------------------------------
                    1500226
(1 row)

step s2-commit:
 COMMIT;

step s2-print-cluster:
 -- row count per shard
 SELECT
  nodeport, shardid, success, result
 FROM
  run_command_on_placements('isolation_table', 'select count(*) from %s')
 ORDER BY
  nodeport, shardid;
 -- rows
 SELECT id, value FROM isolation_table ORDER BY id, value;

nodeport|shardid|success|result
---------------------------------------------------------------------
   57637|1500225|t      |     0
   57637|1500226|t      |     1
   57637|1500227|t      |     0
   57638|1500222|t      |     0
(4 rows)

id|value
---------------------------------------------------------------------
 5|   10
(1 row)


starting permutation: s3-acquire-advisory-lock s1-begin s1-select s2-begin s2-isolate-tenant s1-copy s1-commit s3-release-advisory-lock s2-commit s2-print-cluster
create_distributed_table
---------------------------------------------------------------------

(1 row)

step s3-acquire-advisory-lock:
    SELECT pg_advisory_lock(44000, 55152);

pg_advisory_lock
---------------------------------------------------------------------

(1 row)

step s1-begin:
    BEGIN;
    -- the tests are written with the logic where single shard SELECTs
    -- do not to open transaction blocks
    SET citus.select_opens_transaction_block TO false;

step s1-select:
 SELECT count(*) FROM isolation_table WHERE id = 5;

count
---------------------------------------------------------------------
    0
(1 row)

step s2-begin:
 BEGIN;

step s2-isolate-tenant:
 SELECT isolate_tenant_to_new_shard('isolation_table', 5, shard_transfer_mode => 'force_logical');
 <waiting ...>
step s1-copy: 
 COPY isolation_table FROM PROGRAM 'echo "1,1\n2,2\n3,3\n4,4\n5,5"' WITH CSV;

step s1-commit:
 COMMIT;

step s3-release-advisory-lock:
    SELECT pg_advisory_unlock(44000, 55152);

pg_advisory_unlock
---------------------------------------------------------------------
t
(1 row)

step s2-isolate-tenant: <... completed>
isolate_tenant_to_new_shard
---------------------------------------------------------------------
                    1500234
(1 row)

step s2-commit:
 COMMIT;

step s2-print-cluster:
 -- row count per shard
 SELECT
  nodeport, shardid, success, result
 FROM
  run_command_on_placements('isolation_table', 'select count(*) from %s')
 ORDER BY
  nodeport, shardid;
 -- rows
 SELECT id, value FROM isolation_table ORDER BY id, value;

nodeport|shardid|success|result
---------------------------------------------------------------------
   57637|1500233|t      |     1
   57637|1500234|t      |     1
   57637|1500235|t      |     2
   57638|1500230|t      |     1
(4 rows)

id|value
---------------------------------------------------------------------
 1|    1
 2|    2
 3|    3
 4|    4
 5|    5
(5 rows)


starting permutation: s1-load-cache s1-insert s3-acquire-advisory-lock s2-isolate-tenant s1-isolate-tenant-same-coloc s3-release-advisory-lock s2-print-cluster
create_distributed_table
---------------------------------------------------------------------

(1 row)

step s1-load-cache:
 TRUNCATE isolation_table;
 TRUNCATE isolation_table2;

step s1-insert:
 INSERT INTO isolation_table VALUES (5, 10);
 INSERT INTO isolation_table2 VALUES (5, 10);

step s3-acquire-advisory-lock:
    SELECT pg_advisory_lock(44000, 55152);

pg_advisory_lock
---------------------------------------------------------------------

(1 row)

step s2-isolate-tenant:
 SELECT isolate_tenant_to_new_shard('isolation_table', 5, shard_transfer_mode => 'force_logical');
 <waiting ...>
step s1-isolate-tenant-same-coloc: 
 SELECT isolate_tenant_to_new_shard('isolation_table', 2, shard_transfer_mode => 'force_logical');

ERROR:  could not acquire the lock required to split public.isolation_table
step s3-release-advisory-lock:
    SELECT pg_advisory_unlock(44000, 55152);

pg_advisory_unlock
---------------------------------------------------------------------
t
(1 row)

step s2-isolate-tenant: <... completed>
isolate_tenant_to_new_shard
---------------------------------------------------------------------
                    1500242
(1 row)

step s2-print-cluster:
 -- row count per shard
 SELECT
  nodeport, shardid, success, result
 FROM
  run_command_on_placements('isolation_table', 'select count(*) from %s')
 ORDER BY
  nodeport, shardid;
 -- rows
 SELECT id, value FROM isolation_table ORDER BY id, value;

nodeport|shardid|success|result
---------------------------------------------------------------------
   57637|1500241|t      |     0
   57637|1500242|t      |     1
   57637|1500243|t      |     0
   57638|1500238|t      |     0
(4 rows)

id|value
---------------------------------------------------------------------
 5|   10
(1 row)


starting permutation: s1-load-cache s1-insert s3-acquire-advisory-lock s2-isolate-tenant s1-isolate-tenant-same-coloc-blocking s3-release-advisory-lock s2-print-cluster
create_distributed_table
---------------------------------------------------------------------

(1 row)

step s1-load-cache:
 TRUNCATE isolation_table;
 TRUNCATE isolation_table2;

step s1-insert:
 INSERT INTO isolation_table VALUES (5, 10);
 INSERT INTO isolation_table2 VALUES (5, 10);

step s3-acquire-advisory-lock:
    SELECT pg_advisory_lock(44000, 55152);

pg_advisory_lock
---------------------------------------------------------------------

(1 row)

step s2-isolate-tenant:
 SELECT isolate_tenant_to_new_shard('isolation_table', 5, shard_transfer_mode => 'force_logical');
 <waiting ...>
step s1-isolate-tenant-same-coloc-blocking: 
 SELECT isolate_tenant_to_new_shard('isolation_table', 2, shard_transfer_mode => 'block_writes');

ERROR:  could not acquire the lock required to split public.isolation_table
step s3-release-advisory-lock:
    SELECT pg_advisory_unlock(44000, 55152);

pg_advisory_unlock
---------------------------------------------------------------------
t
(1 row)

step s2-isolate-tenant: <... completed>
isolate_tenant_to_new_shard
---------------------------------------------------------------------
                    1500250
(1 row)

step s2-print-cluster:
 -- row count per shard
 SELECT
  nodeport, shardid, success, result
 FROM
  run_command_on_placements('isolation_table', 'select count(*) from %s')
 ORDER BY
  nodeport, shardid;
 -- rows
 SELECT id, value FROM isolation_table ORDER BY id, value;

nodeport|shardid|success|result
---------------------------------------------------------------------
   57637|1500249|t      |     0
   57637|1500250|t      |     1
   57637|1500251|t      |     0
   57638|1500246|t      |     0
(4 rows)

id|value
---------------------------------------------------------------------
 5|   10
(1 row)


starting permutation: s1-load-cache s1-insert s3-acquire-advisory-lock s2-isolate-tenant s1-isolate-tenant-no-same-coloc s3-release-advisory-lock s2-print-cluster
create_distributed_table
---------------------------------------------------------------------

(1 row)

step s1-load-cache:
 TRUNCATE isolation_table;
 TRUNCATE isolation_table2;

step s1-insert:
 INSERT INTO isolation_table VALUES (5, 10);
 INSERT INTO isolation_table2 VALUES (5, 10);

step s3-acquire-advisory-lock:
    SELECT pg_advisory_lock(44000, 55152);

pg_advisory_lock
---------------------------------------------------------------------

(1 row)

step s2-isolate-tenant:
 SELECT isolate_tenant_to_new_shard('isolation_table', 5, shard_transfer_mode => 'force_logical');
 <waiting ...>
step s1-isolate-tenant-no-same-coloc: 
 SELECT isolate_tenant_to_new_shard('isolation_table2', 2, shard_transfer_mode => 'force_logical');

ERROR:  could not acquire the lock required to split concurrently public.isolation_table2.
step s3-release-advisory-lock:
    SELECT pg_advisory_unlock(44000, 55152);

pg_advisory_unlock
---------------------------------------------------------------------
t
(1 row)

step s2-isolate-tenant: <... completed>
isolate_tenant_to_new_shard
---------------------------------------------------------------------
                    1500258
(1 row)

step s2-print-cluster:
 -- row count per shard
 SELECT
  nodeport, shardid, success, result
 FROM
  run_command_on_placements('isolation_table', 'select count(*) from %s')
 ORDER BY
  nodeport, shardid;
 -- rows
 SELECT id, value FROM isolation_table ORDER BY id, value;

nodeport|shardid|success|result
---------------------------------------------------------------------
   57637|1500257|t      |     0
   57637|1500258|t      |     1
   57637|1500259|t      |     0
   57638|1500254|t      |     0
(4 rows)

id|value
---------------------------------------------------------------------
 5|   10
(1 row)


starting permutation: s1-load-cache s1-insert s3-acquire-advisory-lock s2-begin s2-isolate-tenant s1-isolate-tenant-no-same-coloc s3-release-advisory-lock s2-commit s2-print-cluster
create_distributed_table
---------------------------------------------------------------------

(1 row)

step s1-load-cache:
 TRUNCATE isolation_table;
 TRUNCATE isolation_table2;

step s1-insert:
 INSERT INTO isolation_table VALUES (5, 10);
 INSERT INTO isolation_table2 VALUES (5, 10);

step s3-acquire-advisory-lock:
    SELECT pg_advisory_lock(44000, 55152);

pg_advisory_lock
---------------------------------------------------------------------

(1 row)

step s2-begin:
 BEGIN;

step s2-isolate-tenant:
 SELECT isolate_tenant_to_new_shard('isolation_table', 5, shard_transfer_mode => 'force_logical');
 <waiting ...>
step s1-isolate-tenant-no-same-coloc: 
 SELECT isolate_tenant_to_new_shard('isolation_table2', 2, shard_transfer_mode => 'force_logical');

ERROR:  could not acquire the lock required to split concurrently public.isolation_table2.
step s3-release-advisory-lock:
    SELECT pg_advisory_unlock(44000, 55152);

pg_advisory_unlock
---------------------------------------------------------------------
t
(1 row)

step s2-isolate-tenant: <... completed>
isolate_tenant_to_new_shard
---------------------------------------------------------------------
                    1500269
(1 row)

step s2-commit:
 COMMIT;

step s2-print-cluster:
 -- row count per shard
 SELECT
  nodeport, shardid, success, result
 FROM
  run_command_on_placements('isolation_table', 'select count(*) from %s')
 ORDER BY
  nodeport, shardid;
 -- rows
 SELECT id, value FROM isolation_table ORDER BY id, value;

nodeport|shardid|success|result
---------------------------------------------------------------------
   57637|1500268|t      |     0
   57637|1500269|t      |     1
   57637|1500270|t      |     0
   57638|1500265|t      |     0
(4 rows)

id|value
---------------------------------------------------------------------
 5|   10
(1 row)


starting permutation: s1-load-cache s1-insert s3-acquire-advisory-lock s2-isolate-tenant s1-isolate-tenant-no-same-coloc-blocking s3-release-advisory-lock s2-print-cluster
create_distributed_table
---------------------------------------------------------------------

(1 row)

step s1-load-cache:
 TRUNCATE isolation_table;
 TRUNCATE isolation_table2;

step s1-insert:
 INSERT INTO isolation_table VALUES (5, 10);
 INSERT INTO isolation_table2 VALUES (5, 10);

step s3-acquire-advisory-lock:
    SELECT pg_advisory_lock(44000, 55152);

pg_advisory_lock
---------------------------------------------------------------------

(1 row)

step s2-isolate-tenant:
 SELECT isolate_tenant_to_new_shard('isolation_table', 5, shard_transfer_mode => 'force_logical');
 <waiting ...>
step s1-isolate-tenant-no-same-coloc-blocking: 
 SELECT isolate_tenant_to_new_shard('isolation_table2', 2, shard_transfer_mode => 'block_writes');
 <waiting ...>
step s3-release-advisory-lock: 
    SELECT pg_advisory_unlock(44000, 55152);

pg_advisory_unlock
---------------------------------------------------------------------
t
(1 row)

step s2-isolate-tenant: <... completed>
isolate_tenant_to_new_shard
---------------------------------------------------------------------
                    1500280
(1 row)

step s1-isolate-tenant-no-same-coloc-blocking: <... completed>
isolate_tenant_to_new_shard
---------------------------------------------------------------------
                    1500283
(1 row)

step s2-print-cluster:
 -- row count per shard
 SELECT
  nodeport, shardid, success, result
 FROM
  run_command_on_placements('isolation_table', 'select count(*) from %s')
 ORDER BY
  nodeport, shardid;
 -- rows
 SELECT id, value FROM isolation_table ORDER BY id, value;

nodeport|shardid|success|result
---------------------------------------------------------------------
   57637|1500279|t      |     0
   57637|1500280|t      |     1
   57637|1500281|t      |     0
   57638|1500276|t      |     0
(4 rows)

id|value
---------------------------------------------------------------------
 5|   10
(1 row)


starting permutation: s1-load-cache s1-insert s3-acquire-advisory-lock s2-isolate-tenant s1-isolate-tenant-no-same-coloc-blocking s3-release-advisory-lock s2-print-cluster
create_distributed_table
---------------------------------------------------------------------

(1 row)

step s1-load-cache:
 TRUNCATE isolation_table;
 TRUNCATE isolation_table2;

step s1-insert:
 INSERT INTO isolation_table VALUES (5, 10);
 INSERT INTO isolation_table2 VALUES (5, 10);

step s3-acquire-advisory-lock:
    SELECT pg_advisory_lock(44000, 55152);

pg_advisory_lock
---------------------------------------------------------------------

(1 row)

step s2-isolate-tenant:
 SELECT isolate_tenant_to_new_shard('isolation_table', 5, shard_transfer_mode => 'force_logical');
 <waiting ...>
step s1-isolate-tenant-no-same-coloc-blocking: 
 SELECT isolate_tenant_to_new_shard('isolation_table2', 2, shard_transfer_mode => 'block_writes');
 <waiting ...>
step s3-release-advisory-lock: 
    SELECT pg_advisory_unlock(44000, 55152);

pg_advisory_unlock
---------------------------------------------------------------------
t
(1 row)

step s2-isolate-tenant: <... completed>
isolate_tenant_to_new_shard
---------------------------------------------------------------------
                    1500291
(1 row)

step s1-isolate-tenant-no-same-coloc-blocking: <... completed>
isolate_tenant_to_new_shard
---------------------------------------------------------------------
                    1500294
(1 row)

step s2-print-cluster:
 -- row count per shard
 SELECT
  nodeport, shardid, success, result
 FROM
  run_command_on_placements('isolation_table', 'select count(*) from %s')
 ORDER BY
  nodeport, shardid;
 -- rows
 SELECT id, value FROM isolation_table ORDER BY id, value;

nodeport|shardid|success|result
---------------------------------------------------------------------
   57637|1500290|t      |     0
   57637|1500291|t      |     1
   57637|1500292|t      |     0
   57638|1500287|t      |     0
(4 rows)

id|value
---------------------------------------------------------------------
 5|   10
(1 row)

