SHOW server_version \gset
SELECT substring(:'server_version', '\d+')::int >= 15 AS server_version_ge_15
\gset
\if :server_version_ge_15
\else
\q
\endif
-- MERGE command performs a join from data_source to target_table_name
DROP SCHEMA IF EXISTS merge_schema CASCADE;
NOTICE:  schema "merge_schema" does not exist, skipping
--MERGE INTO target
--USING source
--WHEN NOT MATCHED
--WHEN MATCHED AND <condition>
--WHEN MATCHED
CREATE SCHEMA merge_schema;
SET search_path TO merge_schema;
SET citus.shard_count TO 4;
SET citus.next_shard_id TO 4000000;
SET citus.explain_all_tasks to true;
SELECT 1 FROM master_add_node('localhost', :master_port, groupid => 0);
NOTICE:  localhost:xxxxx is the coordinator and already contains metadata, skipping syncing the metadata
 ?column?
---------------------------------------------------------------------
        1
(1 row)

CREATE TABLE source
(
   order_id        INT,
   customer_id     INT,
   order_center    VARCHAR,
   order_time timestamp
);
CREATE TABLE target
(
   customer_id     INT,
   last_order_id   INT,
   order_center    VARCHAR,
   order_count     INT,
   last_order      timestamp
);
CREATE FUNCTION insert_data() RETURNS VOID AS $$

INSERT INTO source (order_id, customer_id, order_center, order_time)
   VALUES (101, 30000, 'WX', '2022-01-01 00:00:00'); -- Do not match
INSERT INTO source (order_id, customer_id, order_center, order_time)
   VALUES (102, 30001, 'CX', '2022-01-01 00:00:00'); -- Do not match

INSERT INTO source (order_id, customer_id, order_center, order_time)
   VALUES (103, 30002, 'AX', '2022-01-01 00:00:00'); -- Does match
INSERT INTO source (order_id, customer_id, order_center, order_time)
   VALUES (104, 30003, 'JX','2022-01-01 00:00:00' ); -- Does match
INSERT INTO source (order_id, customer_id, order_center, order_time)
   VALUES (105, 30004, 'JX','2022-01-01 00:00:00' ); -- Does match

INSERT INTO target (customer_id, last_order_id, order_center, order_count, last_order)
   VALUES (40000, 097, 'MK', -1, '2019-09-15 08:13:00');
INSERT INTO target (customer_id, last_order_id, order_center, order_count, last_order)
   VALUES (40001, 098, 'NU', -1, '2020-07-12 01:05:00');
INSERT INTO target (customer_id, last_order_id, order_center, order_count, last_order)
   VALUES (40002, 100, 'DS', -1, '2022-05-21 04:12:00');
INSERT INTO target (customer_id, last_order_id, order_center, order_count, last_order)
   VALUES (30002, 103, 'AX', -1, '2021-01-17 19:53:00'); -- Matches the source
INSERT INTO target (customer_id, last_order_id, order_center, order_count, last_order)
   VALUES (30003, 099, 'JX', -1, '2020-09-11 03:23:00'); -- Matches the source
INSERT INTO target (customer_id, last_order_id, order_center, order_count, last_order)
   VALUES (30004, 099, 'XX', -1, '2020-09-11 03:23:00'); -- Matches the source id AND the condition.
$$
LANGUAGE SQL;
SELECT insert_data();
 insert_data
---------------------------------------------------------------------

(1 row)

SELECT 'Testing PG tables';
     ?column?
---------------------------------------------------------------------
 Testing PG tables
(1 row)

MERGE INTO target t
   USING source s
   ON (t.customer_id = s.customer_id)
   WHEN MATCHED AND t.order_center = 'XX' THEN
       DELETE
   WHEN MATCHED THEN
       UPDATE SET     -- Existing customer, update the order count and last_order_id
           order_count = t.order_count + 1,
           last_order_id = s.order_id
   WHEN NOT MATCHED THEN       -- New entry, record it.
       INSERT (customer_id, last_order_id, order_center, order_count, last_order)
           VALUES (customer_id, s.order_id, s.order_center, 123, s.order_time);
-- Our gold result to compare against
SELECT * INTO pg_result FROM target ORDER BY 1 ;
-- Clean the slate
TRUNCATE source;
TRUNCATE target;
SELECT insert_data();
 insert_data
---------------------------------------------------------------------

(1 row)

-- Test with both target and source as Citus local
SELECT 'local - local';
   ?column?
---------------------------------------------------------------------
 local - local
(1 row)

SELECT citus_add_local_table_to_metadata('target');
 citus_add_local_table_to_metadata
---------------------------------------------------------------------

(1 row)

SELECT citus_add_local_table_to_metadata('source');
 citus_add_local_table_to_metadata
---------------------------------------------------------------------

(1 row)

MERGE INTO target t
   USING source s
   ON (t.customer_id = s.customer_id)
   WHEN MATCHED AND t.order_center = 'XX' THEN
       DELETE
   WHEN MATCHED THEN
       UPDATE SET     -- Existing customer, update the order count and last_order_id
           order_count = t.order_count + 1,
           last_order_id = s.order_id
   WHEN NOT MATCHED THEN       -- New entry, record it.
       INSERT (customer_id, last_order_id, order_center, order_count, last_order)
           VALUES (customer_id, s.order_id, s.order_center, 123, s.order_time);
SELECT * INTO local_local FROM target ORDER BY 1 ;
-- Should be equal
SELECT c.*, p.*
FROM local_local c, pg_result p
WHERE c.customer_id = p.customer_id
ORDER BY 1,2;
 customer_id | last_order_id | order_center | order_count |        last_order        | customer_id | last_order_id | order_center | order_count |        last_order
---------------------------------------------------------------------
       30000 |           101 | WX           |         123 | Sat Jan 01 00:00:00 2022 |       30000 |           101 | WX           |         123 | Sat Jan 01 00:00:00 2022
       30001 |           102 | CX           |         123 | Sat Jan 01 00:00:00 2022 |       30001 |           102 | CX           |         123 | Sat Jan 01 00:00:00 2022
       30002 |           103 | AX           |           0 | Sun Jan 17 19:53:00 2021 |       30002 |           103 | AX           |           0 | Sun Jan 17 19:53:00 2021
       30003 |           104 | JX           |           0 | Fri Sep 11 03:23:00 2020 |       30003 |           104 | JX           |           0 | Fri Sep 11 03:23:00 2020
       40000 |            97 | MK           |          -1 | Sun Sep 15 08:13:00 2019 |       40000 |            97 | MK           |          -1 | Sun Sep 15 08:13:00 2019
       40001 |            98 | NU           |          -1 | Sun Jul 12 01:05:00 2020 |       40001 |            98 | NU           |          -1 | Sun Jul 12 01:05:00 2020
       40002 |           100 | DS           |          -1 | Sat May 21 04:12:00 2022 |       40002 |           100 | DS           |          -1 | Sat May 21 04:12:00 2022
(7 rows)

-- Must return zero rows
SELECT *
FROM pg_result p
WHERE NOT EXISTS (SELECT FROM local_local c WHERE c.customer_id = p.customer_id);
 customer_id | last_order_id | order_center | order_count | last_order
---------------------------------------------------------------------
(0 rows)

SELECT 'Testing Dist - Dist';
      ?column?
---------------------------------------------------------------------
 Testing Dist - Dist
(1 row)

-- Clean the slate
TRUNCATE source;
TRUNCATE target;
SELECT insert_data();
 insert_data
---------------------------------------------------------------------

(1 row)

SELECT undistribute_table('target');
NOTICE:  creating a new table for merge_schema.target
NOTICE:  moving the data of merge_schema.target
NOTICE:  dropping the old merge_schema.target
NOTICE:  renaming the new table to merge_schema.target
 undistribute_table
---------------------------------------------------------------------

(1 row)

SELECT undistribute_table('source');
NOTICE:  creating a new table for merge_schema.source
NOTICE:  moving the data of merge_schema.source
NOTICE:  dropping the old merge_schema.source
NOTICE:  renaming the new table to merge_schema.source
 undistribute_table
---------------------------------------------------------------------

(1 row)

SELECT create_distributed_table('target', 'customer_id');
NOTICE:  Copying data from local table...
NOTICE:  copying the data has completed
DETAIL:  The local data in the table is no longer visible, but is still on disk.
HINT:  To remove the local data, run: SELECT truncate_local_data_after_distributing_table($$merge_schema.target$$)
 create_distributed_table
---------------------------------------------------------------------

(1 row)

SELECT create_distributed_table('source', 'customer_id');
NOTICE:  Copying data from local table...
NOTICE:  copying the data has completed
DETAIL:  The local data in the table is no longer visible, but is still on disk.
HINT:  To remove the local data, run: SELECT truncate_local_data_after_distributing_table($$merge_schema.source$$)
 create_distributed_table
---------------------------------------------------------------------

(1 row)

MERGE INTO target t
   USING source s
   ON (t.customer_id = s.customer_id)
   WHEN MATCHED AND t.order_center = 'XX' THEN
       DELETE
   WHEN MATCHED THEN
       UPDATE SET     -- Existing customer, update the order count and last_order_id
           order_count = t.order_count + 1,
           last_order_id = s.order_id
   WHEN NOT MATCHED THEN       -- New entry, record it.
       INSERT (customer_id, last_order_id, order_center, order_count, last_order)
           VALUES (customer_id, s.order_id, s.order_center, 123, s.order_time);
ERROR:  MERGE command is not supported on distributed/reference tables yet
--
-- Test MERGE with CTE as source
--
CREATE TABLE t1(id int, val int);
CREATE TABLE s1(id int, val int);
CREATE FUNCTION load() RETURNS VOID AS $$

INSERT INTO s1 VALUES(1, 0); -- Matches DELETE clause
INSERT INTO s1 VALUES(2, 1); -- Matches UPDATE clause
INSERT INTO s1 VALUES(3, 1); -- No Match INSERT clause
INSERT INTO s1 VALUES(4, 1); -- No Match INSERT clause
INSERT INTO s1 VALUES(6, 1); -- No Match INSERT clause

INSERT INTO t1 VALUES(1, 0); -- Will be deleted
INSERT INTO t1 VALUES(2, 0); -- Will be updated
INSERT INTO t1 VALUES(5, 0); -- Will be intact

$$
LANGUAGE SQL;
SELECT 'Testing PG tables';
     ?column?
---------------------------------------------------------------------
 Testing PG tables
(1 row)

SELECT load();
 load
---------------------------------------------------------------------

(1 row)

WITH pg_res AS (
	SELECT * FROM s1
)
MERGE INTO t1
	USING pg_res ON (pg_res.id = t1.id)
	WHEN MATCHED AND pg_res.val = 0 THEN
		DELETE
	WHEN MATCHED THEN
		UPDATE SET val = t1.val + 1
	WHEN NOT MATCHED THEN
		INSERT (id, val) VALUES (pg_res.id, pg_res.val);
-- Two rows with id 2 and val incremented, id 3, and id 1 is deleted
SELECT * FROM t1 order by id;
 id | val
---------------------------------------------------------------------
  2 |   1
  3 |   1
  4 |   1
  5 |   0
  6 |   1
(5 rows)

SELECT * INTO merge_result FROM t1 order by id;
-- Test Citus local tables
TRUNCATE t1;
TRUNCATE s1;
SELECT load();
 load
---------------------------------------------------------------------

(1 row)

SELECT citus_add_local_table_to_metadata('t1');
 citus_add_local_table_to_metadata
---------------------------------------------------------------------

(1 row)

SELECT citus_add_local_table_to_metadata('s1');
 citus_add_local_table_to_metadata
---------------------------------------------------------------------

(1 row)

WITH s1_res AS (
	SELECT * FROM s1
)
MERGE INTO t1
	USING s1_res ON (s1_res.id = t1.id)
	WHEN MATCHED AND s1_res.val = 0 THEN
		DELETE
	WHEN MATCHED THEN
		UPDATE SET val = t1.val + 1
	WHEN NOT MATCHED THEN
		INSERT (id, val) VALUES (s1_res.id, s1_res.val);
-- Two rows with id 2 and val incremented, id 3, and id 1 is deleted
SELECT * FROM t1 order by id;
 id | val
---------------------------------------------------------------------
  2 |   1
  3 |   1
  4 |   1
  5 |   0
  6 |   1
(5 rows)

-- Should be empty
SELECT *
FROM merge_result p
WHERE NOT EXISTS (SELECT 1 FROM t1 c WHERE c.id = p.id AND c.val = p.val);
 id | val
---------------------------------------------------------------------
(0 rows)

SELECT 'Testing dist - dist';
      ?column?
---------------------------------------------------------------------
 Testing dist - dist
(1 row)

SELECT undistribute_table('t1');
NOTICE:  creating a new table for merge_schema.t1
NOTICE:  moving the data of merge_schema.t1
NOTICE:  dropping the old merge_schema.t1
NOTICE:  renaming the new table to merge_schema.t1
 undistribute_table
---------------------------------------------------------------------

(1 row)

SELECT undistribute_table('s1');
NOTICE:  creating a new table for merge_schema.s1
NOTICE:  moving the data of merge_schema.s1
NOTICE:  dropping the old merge_schema.s1
NOTICE:  renaming the new table to merge_schema.s1
 undistribute_table
---------------------------------------------------------------------

(1 row)

TRUNCATE t1;
TRUNCATE s1;
SELECT load();
 load
---------------------------------------------------------------------

(1 row)

SELECT create_distributed_table('t1', 'id');
NOTICE:  Copying data from local table...
NOTICE:  copying the data has completed
DETAIL:  The local data in the table is no longer visible, but is still on disk.
HINT:  To remove the local data, run: SELECT truncate_local_data_after_distributing_table($$merge_schema.t1$$)
 create_distributed_table
---------------------------------------------------------------------

(1 row)

SELECT create_distributed_table('s1', 'id');
NOTICE:  Copying data from local table...
NOTICE:  copying the data has completed
DETAIL:  The local data in the table is no longer visible, but is still on disk.
HINT:  To remove the local data, run: SELECT truncate_local_data_after_distributing_table($$merge_schema.s1$$)
 create_distributed_table
---------------------------------------------------------------------

(1 row)

WITH s1_res AS (
	SELECT * FROM s1
)
MERGE INTO t1
	USING s1_res ON (s1_res.id = t1.id)
	WHEN MATCHED AND s1_res.val = 0 THEN
		DELETE
	WHEN MATCHED THEN
		UPDATE SET val = t1.val + 1
	WHEN NOT MATCHED THEN
		INSERT (id, val) VALUES (s1_res.id, s1_res.val);
ERROR:  MERGE command is not supported on distributed/reference tables yet
--
-- Test with multiple join conditions
--
CREATE TABLE t2(id int, val int, src text);
CREATE TABLE s2(id int, val int, src text);
CREATE OR REPLACE FUNCTION insert_data() RETURNS VOID AS $$
INSERT INTO t2 VALUES(1, 0, 'target');
INSERT INTO t2 VALUES(2, 0, 'target');
INSERT INTO t2 VALUES(3, 1, 'match');
INSERT INTO t2 VALUES(4, 0, 'match');

INSERT INTO s2 VALUES(2, 0, 'source'); -- No match insert
INSERT INTO s2 VALUES(4, 0, 'match'); -- Match delete
INSERT INTO s2 VALUES(3, 10, 'match'); -- Match update

$$
LANGUAGE SQL;
SELECT 'Testing PG tables';
     ?column?
---------------------------------------------------------------------
 Testing PG tables
(1 row)

SELECT insert_data();
 insert_data
---------------------------------------------------------------------

(1 row)

MERGE INTO t2
USING s2
ON t2.id = s2.id AND t2.src = s2.src
	WHEN MATCHED AND t2.val = 1 THEN
		UPDATE SET val = s2.val + 10
	WHEN MATCHED THEN
		DELETE
	WHEN NOT MATCHED THEN
		INSERT (id, val, src) VALUES (s2.id, s2.val, s2.src);
SELECT * FROM t2 ORDER BY 1;
 id | val |  src
---------------------------------------------------------------------
  1 |   0 | target
  2 |   0 | target
  2 |   0 | source
  3 |  20 | match
(4 rows)

SELECT * INTO pg_t2 FROM t2;
SELECT 'Testing Citus local tables';
          ?column?
---------------------------------------------------------------------
 Testing Citus local tables
(1 row)

TRUNCATE t2;
TRUNCATE s2;
SELECT insert_data();
 insert_data
---------------------------------------------------------------------

(1 row)

SELECT citus_add_local_table_to_metadata('t2');
 citus_add_local_table_to_metadata
---------------------------------------------------------------------

(1 row)

SELECT citus_add_local_table_to_metadata('s2');
 citus_add_local_table_to_metadata
---------------------------------------------------------------------

(1 row)

MERGE INTO t2
USING s2
ON t2.id = s2.id AND t2.src = s2.src
	WHEN MATCHED AND t2.val = 1 THEN
		UPDATE SET val = s2.val + 10
	WHEN MATCHED THEN
		DELETE
	WHEN NOT MATCHED THEN
		INSERT (id, val, src) VALUES (s2.id, s2.val, s2.src);
SELECT * FROM t2 ORDER BY 1;
 id | val |  src
---------------------------------------------------------------------
  1 |   0 | target
  2 |   0 | target
  2 |   0 | source
  3 |  20 | match
(4 rows)

-- Should be empty
SELECT *
FROM pg_t2 p
WHERE NOT EXISTS (SELECT 1 FROM t2 c WHERE c.id = p.id AND c.val = p.val AND c.src = p.src);
 id | val | src
---------------------------------------------------------------------
(0 rows)

SELECT 'Testing Dist - Dist';
      ?column?
---------------------------------------------------------------------
 Testing Dist - Dist
(1 row)

-- Clean the slate
TRUNCATE t2;
TRUNCATE s2;
SELECT insert_data();
 insert_data
---------------------------------------------------------------------

(1 row)

SELECT undistribute_table('t2');
NOTICE:  creating a new table for merge_schema.t2
NOTICE:  moving the data of merge_schema.t2
NOTICE:  dropping the old merge_schema.t2
NOTICE:  renaming the new table to merge_schema.t2
 undistribute_table
---------------------------------------------------------------------

(1 row)

SELECT undistribute_table('s2');
NOTICE:  creating a new table for merge_schema.s2
NOTICE:  moving the data of merge_schema.s2
NOTICE:  dropping the old merge_schema.s2
NOTICE:  renaming the new table to merge_schema.s2
 undistribute_table
---------------------------------------------------------------------

(1 row)

SELECT create_distributed_table('t2', 'id');
NOTICE:  Copying data from local table...
NOTICE:  copying the data has completed
DETAIL:  The local data in the table is no longer visible, but is still on disk.
HINT:  To remove the local data, run: SELECT truncate_local_data_after_distributing_table($$merge_schema.t2$$)
 create_distributed_table
---------------------------------------------------------------------

(1 row)

SELECT create_distributed_table('s2', 'id');
NOTICE:  Copying data from local table...
NOTICE:  copying the data has completed
DETAIL:  The local data in the table is no longer visible, but is still on disk.
HINT:  To remove the local data, run: SELECT truncate_local_data_after_distributing_table($$merge_schema.s2$$)
 create_distributed_table
---------------------------------------------------------------------

(1 row)

MERGE INTO t2
USING s2
ON t2.id = s2.id AND t2.src = s2.src
	WHEN MATCHED AND t2.val = 1 THEN
		UPDATE SET val = s2.val + 10
	WHEN MATCHED THEN
		DELETE
	WHEN NOT MATCHED THEN
		INSERT (id, val, src) VALUES (s2.id, s2.val, s2.src);
ERROR:  MERGE command is not supported on distributed/reference tables yet
--
-- With sub-query as the MERGE source
--
TRUNCATE t2;
TRUNCATE s2;
SELECT undistribute_table('t2');
NOTICE:  creating a new table for merge_schema.t2
NOTICE:  moving the data of merge_schema.t2
NOTICE:  dropping the old merge_schema.t2
NOTICE:  renaming the new table to merge_schema.t2
 undistribute_table
---------------------------------------------------------------------

(1 row)

SELECT undistribute_table('s2');
NOTICE:  creating a new table for merge_schema.s2
NOTICE:  moving the data of merge_schema.s2
NOTICE:  dropping the old merge_schema.s2
NOTICE:  renaming the new table to merge_schema.s2
 undistribute_table
---------------------------------------------------------------------

(1 row)

SELECT citus_add_local_table_to_metadata('t2');
 citus_add_local_table_to_metadata
---------------------------------------------------------------------

(1 row)

SELECT citus_add_local_table_to_metadata('s2');
 citus_add_local_table_to_metadata
---------------------------------------------------------------------

(1 row)

SELECT insert_data();
 insert_data
---------------------------------------------------------------------

(1 row)

MERGE INTO t2 t
USING (SELECT * FROM s2) s
ON t.id = s.id AND t.src = s.src
	WHEN MATCHED AND t.val = 1 THEN
		UPDATE SET val = s.val + 10
	WHEN MATCHED THEN
		DELETE
	WHEN NOT MATCHED THEN
		INSERT (id, val, src) VALUES (s.id, s.val, s.src);
SELECT * FROM t2 ORDER BY 1;
 id | val |  src
---------------------------------------------------------------------
  1 |   0 | target
  2 |   0 | target
  2 |   0 | source
  3 |  20 | match
(4 rows)

SELECT * INTO dist_res FROM t2 ORDER BY 1;
-- Should be equal
SELECT c.*, p.*
FROM t2 c, pg_t2 p
WHERE c.id = p.id AND c.src = p.src
ORDER BY 1,2;
 id | val |  src   | id | val |  src
---------------------------------------------------------------------
  1 |   0 | target |  1 |   0 | target
  2 |   0 | source |  2 |   0 | source
  2 |   0 | target |  2 |   0 | target
  3 |  20 | match  |  3 |  20 | match
(4 rows)

-- Should be empty
SELECT *
FROM pg_t2 p
WHERE NOT EXISTS (SELECT 1 FROM t2 c WHERE c.id = p.id AND c.val = p.val AND c.src = p.src);
 id | val | src
---------------------------------------------------------------------
(0 rows)

--
-- Using two source tables
--
CREATE TABLE t3(id int, val int, src text);
CREATE TABLE s3_1(id int, val int, src text);
CREATE TABLE s3_2(id int, val int, src text);
CREATE OR REPLACE FUNCTION insert_data() RETURNS VOID AS $$
INSERT INTO t3 VALUES(1, 0, 'target'); -- Intact
INSERT INTO t3 VALUES(2, 0, 'target');
INSERT INTO t3 VALUES(3, 0, 'target');
INSERT INTO t3 VALUES(5, 0, 'target'); -- Intact

INSERT INTO s3_1 VALUES(2, 0, 'source1');
INSERT INTO s3_1 VALUES(3, 0, 'source1');
INSERT INTO s3_1 VALUES(4, 0, 'source1');

INSERT INTO s3_2 VALUES(2, 1, 'source2'); -- Match update
INSERT INTO s3_2 VALUES(3, 0, 'source2'); -- Match delete
INSERT INTO s3_2 VALUES(4, 0, 'source2'); -- No match insert
INSERT INTO s3_2 VALUES(6, 0, 'source2'); -- Will miss the source-subquery-join
$$
LANGUAGE SQL;
SELECT insert_data();
 insert_data
---------------------------------------------------------------------

(1 row)

MERGE INTO t3
	USING (SELECT s3_1.id, s3_2.val, s3_2.src FROM s3_1, s3_2 WHERE s3_1.id = s3_2.id) sub
	ON (t3.id = sub.id)
	WHEN MATCHED AND sub.val = 1 THEN
		UPDATE SET val = t3.val + 10
	WHEN MATCHED THEN
		DELETE
	WHEN NOT MATCHED THEN
		INSERT (id, val, src) VALUES (sub.id, sub.val, sub.src);
-- Joining on columns inside the sub-query
MERGE INTO t3
	USING (SELECT s3_1.id, s3_2.val, s3_2.src FROM s3_1, s3_2 WHERE s3_1.id = s3_2.id) sub
	ON (t3.id = sub.id)
	WHEN MATCHED AND sub.val = 1 THEN
		UPDATE SET val = t3.val + 1
	WHEN MATCHED THEN
		DELETE
	WHEN NOT MATCHED THEN
		INSERT (id, val, src) VALUES (sub.id, sub.val, sub.src);
-- Constant Join condition
WITH s3_res AS (
	SELECT * FROM s3_1
)
MERGE INTO t3
	USING s3_res ON (FALSE)
	WHEN MATCHED AND s3_res.val = 0 THEN
		DELETE
	WHEN MATCHED THEN
		UPDATE SET val = t3.val + 1
	WHEN NOT MATCHED THEN
		INSERT (id, val, src) VALUES (s3_res.id, s3_res.val, s3_res.src);
SELECT * FROM t3 ORDER BY 1,3;
 id | val |   src
---------------------------------------------------------------------
  1 |   0 | target
  2 |   0 | source1
  2 |  11 | target
  3 |   0 | source1
  3 |   0 | source2
  4 |   0 | source1
  5 |   0 | target
(7 rows)

SELECT * INTO pg_t3 FROM t3 ORDER BY 1;
SELECT 'Testing Local - Local';
       ?column?
---------------------------------------------------------------------
 Testing Local - Local
(1 row)

TRUNCATE t3;
TRUNCATE s3_1;
TRUNCATE s3_2;
SELECT citus_add_local_table_to_metadata('t3');
 citus_add_local_table_to_metadata
---------------------------------------------------------------------

(1 row)

SELECT citus_add_local_table_to_metadata('s3_1');
 citus_add_local_table_to_metadata
---------------------------------------------------------------------

(1 row)

SELECT citus_add_local_table_to_metadata('s3_2');
 citus_add_local_table_to_metadata
---------------------------------------------------------------------

(1 row)

SELECT insert_data();
 insert_data
---------------------------------------------------------------------

(1 row)

MERGE INTO t3
	USING (SELECT s3_1.id, s3_2.val, s3_2.src FROM s3_1, s3_2 WHERE s3_1.id = s3_2.id) sub
	ON (t3.id = sub.id)
	WHEN MATCHED AND sub.val = 1 THEN
		UPDATE SET val = t3.val + 10
	WHEN MATCHED THEN
		DELETE
	WHEN NOT MATCHED THEN
		INSERT (id, val, src) VALUES (sub.id, sub.val, sub.src);
-- Joining on columns inside the sub-query
MERGE INTO t3
	USING (SELECT s3_1.id, s3_2.val, s3_2.src FROM s3_1, s3_2 WHERE s3_1.id = s3_2.id) sub
	ON (t3.id = sub.id)
	WHEN MATCHED AND sub.val = 1 THEN
		UPDATE SET val = t3.val + 1
	WHEN MATCHED THEN
		DELETE
	WHEN NOT MATCHED THEN
		INSERT (id, val, src) VALUES (sub.id, sub.val, sub.src);
-- Constant Join condition
WITH s3_res AS (
	SELECT * FROM s3_1
)
MERGE INTO t3
	USING s3_res ON (FALSE)
	WHEN MATCHED AND s3_res.val = 0 THEN
		DELETE
	WHEN MATCHED THEN
		UPDATE SET val = t3.val + 1
	WHEN NOT MATCHED THEN
		INSERT (id, val, src) VALUES (s3_res.id, s3_res.val, s3_res.src);
SELECT * FROM t3 ORDER BY 1,3;
 id | val |   src
---------------------------------------------------------------------
  1 |   0 | target
  2 |   0 | source1
  2 |  11 | target
  3 |   0 | source1
  3 |   0 | source2
  4 |   0 | source1
  5 |   0 | target
(7 rows)

SELECT * INTO local_t3 FROM t3 ORDER BY 1;
-- Should be equal
SELECT c.*, p.*
FROM t3 c, pg_t3 p
WHERE c.id = p.id
ORDER BY 1,2;
 id | val |   src   | id | val |   src
---------------------------------------------------------------------
  1 |   0 | target  |  1 |   0 | target
  2 |   0 | source1 |  2 |   0 | source1
  2 |   0 | source1 |  2 |  11 | target
  2 |  11 | target  |  2 |   0 | source1
  2 |  11 | target  |  2 |  11 | target
  3 |   0 | source2 |  3 |   0 | source2
  3 |   0 | source2 |  3 |   0 | source1
  3 |   0 | source1 |  3 |   0 | source2
  3 |   0 | source1 |  3 |   0 | source1
  4 |   0 | source1 |  4 |   0 | source1
  5 |   0 | target  |  5 |   0 | target
(11 rows)

-- Should be empty
SELECT *
FROM pg_t3 p
WHERE NOT EXISTS (SELECT 1 FROM local_t3 c WHERE c.id = p.id AND c.val = p.val AND c.src = p.src);
 id | val | src
---------------------------------------------------------------------
(0 rows)

--
-- Test table functions
--
CREATE TABLE tf_target(first_name varchar, last_name varchar, eid text);
WITH doc as (
SELECT '<people>
    <person>
        <first_name>foo</first_name>
        <last_name>bar</last_name>
        <eid>100</eid>
    </person>
    <person>
        <first_name>moo</first_name>
        <last_name>bar</last_name>
        <eid>200</eid>
    </person>
</people>'::xml as source_xml
)
MERGE INTO tf_target
USING (
SELECT decoded.*
FROM doc, xmltable(
        '//people/person'
        passing source_xml
        columns
            first_name text,
            last_name text,
            eid text) as decoded) as tf_source
ON tf_source.first_name = tf_target.first_name
WHEN NOT MATCHED THEN
INSERT VALUES (tf_source.first_name, tf_source.last_name, tf_source.eid);
-- Our gold result to compare against
SELECT * INTO tf_result FROM tf_target ORDER BY 1 ;
TRUNCATE tf_target;
SELECT citus_add_local_table_to_metadata('tf_target');
 citus_add_local_table_to_metadata
---------------------------------------------------------------------

(1 row)

WITH doc as (
SELECT '<people>
    <person>
        <first_name>foo</first_name>
        <last_name>bar</last_name>
        <eid>100</eid>
    </person>
    <person>
        <first_name>moo</first_name>
        <last_name>bar</last_name>
        <eid>200</eid>
    </person>
</people>'::xml as source_xml
)
MERGE INTO tf_target
USING (
SELECT decoded.*
FROM doc, xmltable(
        '//people/person'
        passing source_xml
        columns
            first_name text,
            last_name text,
            eid text) as decoded) as tf_source
ON tf_source.first_name = tf_target.first_name
WHEN NOT MATCHED THEN
INSERT VALUES (tf_source.first_name, tf_source.last_name, tf_source.eid);
SELECT * INTO tf_local FROM tf_target ORDER BY 1 ;
-- Should be equal
SELECT c.*, p.*
FROM tf_local c, tf_result p
WHERE c.eid = p.eid
ORDER BY 1,2;
 first_name | last_name | eid | first_name | last_name | eid
---------------------------------------------------------------------
 foo        | bar       | 100 | foo        | bar       | 100
 moo        | bar       | 200 | moo        | bar       | 200
(2 rows)

-- Must return zero rows
SELECT *
FROM tf_result p
WHERE NOT EXISTS (SELECT FROM tf_local c WHERE c.eid = p.eid);
 first_name | last_name | eid
---------------------------------------------------------------------
(0 rows)

--
-- Test VALUES RTE type
--
CREATE TABLE vl_target(id int, value varchar);
INSERT INTO vl_target VALUES(100, 'target');
MERGE INTO vl_target
USING (SELECT *
        FROM (VALUES(100, 'source1'), (200, 'source2')) AS vl (ID, value)) as vl_source
ON vl_source.ID = vl_target.ID
WHEN MATCHED THEN
UPDATE SET value = vl_source.value, id = vl_target.id + 1
WHEN NOT MATCHED THEN
INSERT VALUES(vl_source.ID, vl_source.value);
-- Our gold result to compare against
SELECT * INTO vl_result FROM vl_target ORDER BY 1 ;
-- Clean the slate
TRUNCATE vl_target;
INSERT INTO vl_target VALUES(100, 'target');
SELECT citus_add_local_table_to_metadata('vl_target');
 citus_add_local_table_to_metadata
---------------------------------------------------------------------

(1 row)

SET client_min_messages TO DEBUG1;
MERGE INTO vl_target
USING (SELECT *
        FROM (VALUES(100, 'source1'), (200, 'source2')) AS vl (ID, value)) as vl_source
ON vl_source.ID = vl_target.ID
WHEN MATCHED THEN
UPDATE SET value = vl_source.value, id = vl_target.id + 1
WHEN NOT MATCHED THEN
INSERT VALUES(vl_source.ID, vl_source.value);
DEBUG:  <Deparsed MERGE query: MERGE INTO merge_schema.vl_target_4000036 vl_target USING (SELECT vl.id, vl.value FROM (VALUES (100,'source1'::text), (200,'source2'::text)) vl(id, value)) vl_source ON (vl_source.id OPERATOR(pg_catalog.=) vl_target.id) WHEN MATCHED THEN UPDATE SET id = (vl_target.id OPERATOR(pg_catalog.+) 1), value = (vl_source.value COLLATE "default") WHEN NOT MATCHED THEN INSERT (id, value) VALUES (vl_source.id, (vl_source.value COLLATE "default"))>
RESET client_min_messages;
SELECT * INTO vl_local FROM vl_target ORDER BY 1 ;
-- Should be equal
SELECT c.*, p.*
FROM vl_local c, vl_result p
WHERE c.id = p.id
ORDER BY 1,2;
 id  |  value  | id  |  value
---------------------------------------------------------------------
 101 | source1 | 101 | source1
 200 | source2 | 200 | source2
(2 rows)

-- Must return zero rows
SELECT *
FROM vl_result p
WHERE NOT EXISTS (SELECT FROM vl_local c WHERE c.id = p.id);
 id | value
---------------------------------------------------------------------
(0 rows)

--
-- Test function scan
--
CREATE FUNCTION f_immutable(i integer) RETURNS INTEGER AS
$$ BEGIN RETURN i; END; $$ LANGUAGE PLPGSQL IMMUTABLE;
CREATE TABLE rs_target(id int);
MERGE INTO rs_target
USING (SELECT * FROM f_immutable(99) id WHERE id in (SELECT 99)) AS rs_source
ON rs_source.id = rs_target.id
WHEN MATCHED THEN
DO NOTHING
WHEN NOT MATCHED THEN
INSERT VALUES(rs_source.id);
-- Our gold result to compare against
SELECT * INTO rs_result FROM rs_target ORDER BY 1 ;
-- Clean the slate
TRUNCATE rs_target;
SELECT citus_add_local_table_to_metadata('rs_target');
 citus_add_local_table_to_metadata
---------------------------------------------------------------------

(1 row)

SET client_min_messages TO DEBUG1;
MERGE INTO rs_target
USING (SELECT * FROM f_immutable(99) id WHERE id in (SELECT 99)) AS rs_source
ON rs_source.id = rs_target.id
WHEN MATCHED THEN
DO NOTHING
WHEN NOT MATCHED THEN
INSERT VALUES(rs_source.id);
DEBUG:  <Deparsed MERGE query: MERGE INTO merge_schema.rs_target_4000037 rs_target USING (SELECT id.id FROM merge_schema.f_immutable(99) id(id) WHERE (id.id OPERATOR(pg_catalog.=) ANY (SELECT 99))) rs_source ON (rs_source.id OPERATOR(pg_catalog.=) rs_target.id) WHEN MATCHED THEN DO NOTHING  WHEN NOT MATCHED THEN INSERT (id) VALUES (rs_source.id)>
RESET client_min_messages;
SELECT * INTO rs_local FROM rs_target ORDER BY 1 ;
-- Should be equal
SELECT c.*, p.*
FROM rs_local c, rs_result p
WHERE c.id = p.id
ORDER BY 1,2;
 id | id
---------------------------------------------------------------------
 99 | 99
(1 row)

-- Must return zero rows
SELECT *
FROM rs_result p
WHERE NOT EXISTS (SELECT FROM rs_local c WHERE c.id = p.id);
 id
---------------------------------------------------------------------
(0 rows)

--
-- Test Materialized view
--
CREATE TABLE mv_target(id int, val varchar);
CREATE TABLE mv_source_table(id int, val varchar);
INSERT INTO mv_source_table VALUES(1, 'src1');
INSERT INTO mv_source_table VALUES(2, 'src2');
CREATE MATERIALIZED VIEW mv_source AS
SELECT * FROM mv_source_table;
MERGE INTO mv_target
USING mv_source
ON mv_source.id = mv_target.id
WHEN MATCHED THEN
    DO NOTHING
WHEN NOT MATCHED THEN
    INSERT VALUES(mv_source.id, mv_source.val);
-- Our gold result to compare against
SELECT * INTO mv_result FROM mv_target ORDER BY 1 ;
-- Clean the slate
TRUNCATE mv_target;
SELECT citus_add_local_table_to_metadata('mv_target');
 citus_add_local_table_to_metadata
---------------------------------------------------------------------

(1 row)

SELECT citus_add_local_table_to_metadata('mv_source_table');
 citus_add_local_table_to_metadata
---------------------------------------------------------------------

(1 row)

DROP MATERIALIZED VIEW mv_source;
CREATE MATERIALIZED VIEW mv_source AS
SELECT * FROM mv_source_table;
MERGE INTO mv_target
USING mv_source
ON mv_source.id = mv_target.id
WHEN MATCHED THEN
    DO NOTHING
WHEN NOT MATCHED THEN
    INSERT VALUES(mv_source.id, mv_source.val);
SELECT * INTO mv_local FROM mv_target ORDER BY 1 ;
-- Should be equal
SELECT c.*, p.*
FROM mv_local c, mv_result p
WHERE c.id = p.id
ORDER BY 1,2;
 id | val  | id | val
---------------------------------------------------------------------
  1 | src1 |  1 | src1
  2 | src2 |  2 | src2
(2 rows)

-- Must return zero rows
SELECT *
FROM mv_result p
WHERE NOT EXISTS (SELECT FROM mv_local c WHERE c.id = p.id);
 id | val
---------------------------------------------------------------------
(0 rows)

--
-- Distributed table as source (indirect)
--
CREATE TABLE dist_table(id int, source varchar);
INSERT INTO dist_table VALUES(2, 'dist_table');
INSERT INTO dist_table VALUES(3, 'dist_table');
INSERT INTO dist_table VALUES(100, 'dist_table');
CREATE FUNCTION f_dist() returns SETOF RECORD AS
$$
BEGIN
RETURN QUERY SELECT id, source FROM dist_table;
END;
$$ language plpgsql volatile;
CREATE TABLE fn_target(id int, data varchar);
MERGE INTO fn_target
USING (SELECT * FROM f_dist() f(id integer, source varchar)) as fn_source
ON fn_source.id = fn_target.id
WHEN MATCHED THEN
DO NOTHING
WHEN NOT MATCHED THEN
INSERT VALUES(fn_source.id, fn_source.source);
-- Our gold result to compare against
SELECT * INTO fn_result FROM fn_target ORDER BY 1 ;
-- Clean the slate
TRUNCATE TABLE fn_target;
SELECT citus_add_local_table_to_metadata('fn_target');
 citus_add_local_table_to_metadata
---------------------------------------------------------------------

(1 row)

SELECT create_distributed_table('dist_table', 'id');
NOTICE:  Copying data from local table...
NOTICE:  copying the data has completed
DETAIL:  The local data in the table is no longer visible, but is still on disk.
HINT:  To remove the local data, run: SELECT truncate_local_data_after_distributing_table($$merge_schema.dist_table$$)
 create_distributed_table
---------------------------------------------------------------------

(1 row)

SET client_min_messages TO DEBUG1;
MERGE INTO fn_target
USING (SELECT * FROM f_dist() f(id integer, source varchar)) as fn_source
ON fn_source.id = fn_target.id
WHEN MATCHED THEN
DO NOTHING
WHEN NOT MATCHED THEN
INSERT VALUES(fn_source.id, fn_source.source);
DEBUG:  function does not have co-located tables
DEBUG:  generating subplan XXX_1 for subquery SELECT id, source FROM merge_schema.f_dist() f(id integer, source character varying)
DEBUG:  <Deparsed MERGE query: MERGE INTO merge_schema.fn_target USING (SELECT intermediate_result.id, intermediate_result.source FROM read_intermediate_result('XXX_1'::text, 'binary'::citus_copy_format) intermediate_result(id integer, source character varying)) fn_source ON (fn_source.id OPERATOR(pg_catalog.=) fn_target.id) WHEN MATCHED THEN DO NOTHING  WHEN NOT MATCHED THEN INSERT (id, data) VALUES (fn_source.id, fn_source.source)>
DEBUG:  Plan XXX query after replacing subqueries and CTEs: MERGE INTO merge_schema.fn_target USING (SELECT intermediate_result.id, intermediate_result.source FROM read_intermediate_result('XXX_1'::text, 'binary'::citus_copy_format) intermediate_result(id integer, source character varying)) fn_source ON (fn_source.id OPERATOR(pg_catalog.=) fn_target.id) WHEN MATCHED THEN DO NOTHING  WHEN NOT MATCHED THEN INSERT (id, data) VALUES (fn_source.id, fn_source.source)
DEBUG:  <Deparsed MERGE query: MERGE INTO merge_schema.fn_target_4000040 fn_target USING (SELECT intermediate_result.id, intermediate_result.source FROM read_intermediate_result('XXX_1'::text, 'binary'::citus_copy_format) intermediate_result(id integer, source character varying)) fn_source ON (fn_source.id OPERATOR(pg_catalog.=) fn_target.id) WHEN MATCHED THEN DO NOTHING  WHEN NOT MATCHED THEN INSERT (id, data) VALUES (fn_source.id, fn_source.source)>
RESET client_min_messages;
SELECT * INTO fn_local FROM fn_target ORDER BY 1 ;
-- Should be equal
SELECT c.*, p.*
FROM fn_local c, fn_result p
WHERE c.id = p.id
ORDER BY 1,2;
 id  |    data    | id  |    data
---------------------------------------------------------------------
   2 | dist_table |   2 | dist_table
   3 | dist_table |   3 | dist_table
 100 | dist_table | 100 | dist_table
(3 rows)

-- Must return zero rows
SELECT *
FROM fn_result p
WHERE NOT EXISTS (SELECT FROM fn_local c WHERE c.id = p.id);
 id | data
---------------------------------------------------------------------
(0 rows)

--
-- Foreign tables
--
CREATE TABLE ft_target (id integer NOT NULL, user_val varchar);
CREATE TABLE ft_source (id integer NOT NULL, user_val varchar);
SELECT citus_add_local_table_to_metadata('ft_source');
 citus_add_local_table_to_metadata
---------------------------------------------------------------------

(1 row)

INSERT INTO ft_target VALUES (1, 'target');
INSERT INTO ft_target VALUES (2, 'target');
INSERT INTO ft_source VALUES (2, 'source');
INSERT INTO ft_source VALUES (3, 'source');
SELECT * FROM ft_target;
 id | user_val
---------------------------------------------------------------------
  1 | target
  2 | target
(2 rows)

CREATE EXTENSION postgres_fdw;
CREATE SERVER foreign_server
        FOREIGN DATA WRAPPER postgres_fdw
        OPTIONS (host 'localhost', port :'master_port', dbname 'regression');
CREATE USER MAPPING FOR CURRENT_USER
        SERVER foreign_server
        OPTIONS (user 'postgres');
CREATE FOREIGN TABLE foreign_table (
        id integer NOT NULL,
        user_val text
)
        SERVER foreign_server
        OPTIONS (schema_name 'merge_schema', table_name 'ft_source');
SELECT citus_add_local_table_to_metadata('foreign_table');
 citus_add_local_table_to_metadata
---------------------------------------------------------------------

(1 row)

-- Foreign table as source
SET client_min_messages TO DEBUG1;
MERGE INTO ft_target
	USING foreign_table ON (foreign_table.id = ft_target.id)
	WHEN MATCHED THEN
		DELETE
	WHEN NOT MATCHED THEN
		INSERT (id, user_val) VALUES (foreign_table.id, foreign_table.user_val);
DEBUG:  <Deparsed MERGE query: MERGE INTO merge_schema.ft_target USING merge_schema.foreign_table_4000046 foreign_table ON (foreign_table.id OPERATOR(pg_catalog.=) ft_target.id) WHEN MATCHED THEN DELETE WHEN NOT MATCHED THEN INSERT (id, user_val) VALUES (foreign_table.id, (foreign_table.user_val COLLATE "default"))>
RESET client_min_messages;
SELECT * FROM ft_target;
 id | user_val
---------------------------------------------------------------------
  1 | target
  3 | source
(2 rows)

--
-- Error and Unsupported scenarios
--
-- Foreign table as target
MERGE INTO foreign_table
	USING ft_target ON (foreign_table.id = ft_target.id)
	WHEN MATCHED THEN
		DELETE
	WHEN NOT MATCHED THEN
		INSERT (id, user_val) VALUES (ft_target.id, ft_target.user_val);
ERROR:  cannot execute MERGE on relation "foreign_table"
DETAIL:  This operation is not supported for foreign tables.
TRUNCATE t1;
TRUNCATE s1;
SELECT undistribute_table('t1');
NOTICE:  creating a new table for merge_schema.t1
NOTICE:  moving the data of merge_schema.t1
NOTICE:  dropping the old merge_schema.t1
NOTICE:  renaming the new table to merge_schema.t1
 undistribute_table
---------------------------------------------------------------------

(1 row)

SELECT undistribute_table('s1');
NOTICE:  creating a new table for merge_schema.s1
NOTICE:  moving the data of merge_schema.s1
NOTICE:  dropping the old merge_schema.s1
NOTICE:  renaming the new table to merge_schema.s1
 undistribute_table
---------------------------------------------------------------------

(1 row)

SELECT citus_add_local_table_to_metadata('t1');
 citus_add_local_table_to_metadata
---------------------------------------------------------------------

(1 row)

SELECT create_distributed_table('s1', 'id');
 create_distributed_table
---------------------------------------------------------------------

(1 row)

SELECT load();
 load
---------------------------------------------------------------------

(1 row)

-- Combination of Citus local table and distributed table
MERGE INTO t1
	USING s1 ON (s1.id = t1.val) -- val is not a distribution column
	WHEN MATCHED AND s1.val = 0 THEN
		DELETE
	WHEN MATCHED THEN
		UPDATE SET val = t1.val + 1
	WHEN NOT MATCHED THEN
		INSERT (id, val) VALUES (s1.id, s1.val);
ERROR:  MERGE command is not supported on distributed/reference tables yet
-- Joining on partition columns with sub-query
MERGE INTO t1
	USING (SELECT * FROM s1) sub ON (sub.val = t1.id) -- sub.val is not a distribution column
	WHEN MATCHED AND sub.val = 0 THEN
		DELETE
	WHEN MATCHED THEN
		UPDATE SET val = t1.val + 1
	WHEN NOT MATCHED THEN
		INSERT (id, val) VALUES (sub.id, sub.val);
ERROR:  MERGE command is not supported on distributed/reference tables yet
-- Joining on partition columns with CTE
WITH s1_res AS (
	SELECT * FROM s1
)
MERGE INTO t1
	USING s1_res ON (s1_res.val = t1.id)
	WHEN MATCHED AND s1_res.val = 0 THEN
		DELETE
	WHEN MATCHED THEN
		UPDATE SET val = t1.val + 1
	WHEN NOT MATCHED THEN
		INSERT (id, val) VALUES (s1_res.id, s1_res.val);
ERROR:  MERGE command is not supported on distributed/reference tables yet
-- Constant Join condition
WITH s1_res AS (
	SELECT * FROM s1
)
MERGE INTO t1
	USING s1_res ON (TRUE)
	WHEN MATCHED AND s1_res.val = 0 THEN
		DELETE
	WHEN MATCHED THEN
		UPDATE SET val = t1.val + 1
	WHEN NOT MATCHED THEN
		INSERT (id, val) VALUES (s1_res.id, s1_res.val);
ERROR:  MERGE command is not supported on distributed/reference tables yet
-- With a single WHEN clause, which causes a non-left join
WITH s1_res AS (
     SELECT * FROM s1
 )
 MERGE INTO t1 USING s1_res ON (s1_res.id = t1.val)
 WHEN MATCHED THEN DELETE
	WHEN NOT MATCHED THEN
		INSERT (id, val) VALUES (s1_res.id, s1_res.val);
ERROR:  MERGE command is not supported on distributed/reference tables yet
--
-- Reference tables
--
SELECT undistribute_table('t1');
NOTICE:  creating a new table for merge_schema.t1
NOTICE:  moving the data of merge_schema.t1
NOTICE:  dropping the old merge_schema.t1
NOTICE:  renaming the new table to merge_schema.t1
 undistribute_table
---------------------------------------------------------------------

(1 row)

SELECT undistribute_table('s1');
NOTICE:  creating a new table for merge_schema.s1
NOTICE:  moving the data of merge_schema.s1
NOTICE:  dropping the old merge_schema.s1
NOTICE:  renaming the new table to merge_schema.s1
 undistribute_table
---------------------------------------------------------------------

(1 row)

SELECT create_reference_table('t1');
NOTICE:  Copying data from local table...
NOTICE:  copying the data has completed
DETAIL:  The local data in the table is no longer visible, but is still on disk.
HINT:  To remove the local data, run: SELECT truncate_local_data_after_distributing_table($$merge_schema.t1$$)
 create_reference_table
---------------------------------------------------------------------

(1 row)

SELECT create_reference_table('s1');
NOTICE:  Copying data from local table...
NOTICE:  copying the data has completed
DETAIL:  The local data in the table is no longer visible, but is still on disk.
HINT:  To remove the local data, run: SELECT truncate_local_data_after_distributing_table($$merge_schema.s1$$)
 create_reference_table
---------------------------------------------------------------------

(1 row)

MERGE INTO t1
	USING s1 ON (s1.id = t1.id)
	WHEN MATCHED AND s1.val = 0 THEN
		DELETE
	WHEN MATCHED THEN
		UPDATE SET val = t1.val + 1
	WHEN NOT MATCHED THEN
		INSERT (id, val) VALUES (s1.id, s1.val);
ERROR:  MERGE command is not supported on distributed/reference tables yet
--
-- Postgres + Citus-Distributed table
--
SELECT undistribute_table('t1');
NOTICE:  creating a new table for merge_schema.t1
NOTICE:  moving the data of merge_schema.t1
NOTICE:  dropping the old merge_schema.t1
NOTICE:  renaming the new table to merge_schema.t1
 undistribute_table
---------------------------------------------------------------------

(1 row)

SELECT undistribute_table('s1');
NOTICE:  creating a new table for merge_schema.s1
NOTICE:  moving the data of merge_schema.s1
NOTICE:  dropping the old merge_schema.s1
NOTICE:  renaming the new table to merge_schema.s1
 undistribute_table
---------------------------------------------------------------------

(1 row)

SELECT create_distributed_table('t1', 'id');
NOTICE:  Copying data from local table...
NOTICE:  copying the data has completed
DETAIL:  The local data in the table is no longer visible, but is still on disk.
HINT:  To remove the local data, run: SELECT truncate_local_data_after_distributing_table($$merge_schema.t1$$)
 create_distributed_table
---------------------------------------------------------------------

(1 row)

MERGE INTO t1
	USING s1 ON (s1.id = t1.id)
	WHEN MATCHED AND s1.val = 0 THEN
		DELETE
	WHEN MATCHED THEN
		UPDATE SET val = t1.val + 1
	WHEN NOT MATCHED THEN
		INSERT (id, val) VALUES (s1.id, s1.val);
ERROR:  MERGE command is not supported on distributed/reference tables yet
MERGE INTO t1
	USING (SELECT * FROM s1) sub ON (sub.id = t1.id)
	WHEN MATCHED AND sub.val = 0 THEN
		DELETE
	WHEN MATCHED THEN
		UPDATE SET val = t1.val + 1
	WHEN NOT MATCHED THEN
		INSERT (id, val) VALUES (sub.id, sub.val);
ERROR:  MERGE command is not supported on distributed/reference tables yet
CREATE TABLE pg(val int);
SELECT create_distributed_table('s1', 'id');
NOTICE:  Copying data from local table...
NOTICE:  copying the data has completed
DETAIL:  The local data in the table is no longer visible, but is still on disk.
HINT:  To remove the local data, run: SELECT truncate_local_data_after_distributing_table($$merge_schema.s1$$)
 create_distributed_table
---------------------------------------------------------------------

(1 row)

-- Both t1 and s1 are citus distributed tables now, mix Postgres table in sub-query
MERGE INTO t1
	USING (SELECT s1.id, pg.val FROM s1, pg) sub ON (sub.id = t1.id)
	WHEN MATCHED AND sub.val = 0 THEN
		DELETE
	WHEN MATCHED THEN
		UPDATE SET val = t1.val + 1
	WHEN NOT MATCHED THEN
		INSERT (id, val) VALUES (sub.id, sub.val);
ERROR:  MERGE command is not supported on distributed/reference tables yet
-- Mix Postgres table in CTE
WITH pg_res AS (
	SELECT * FROM pg
)
MERGE INTO t1
	USING (SELECT s1.id, pg_res.val FROM s1, pg_res) sub ON (sub.id = t1.id)
	WHEN MATCHED AND sub.val = 0 THEN
		DELETE
	WHEN MATCHED THEN
		UPDATE SET val = t1.val + 1
	WHEN NOT MATCHED THEN
		INSERT (id, val) VALUES (sub.id, sub.val);
ERROR:  MERGE command is not supported on distributed/reference tables yet
-- Match more than one source row should fail same as Postgres behavior
SELECT undistribute_table('t1');
NOTICE:  creating a new table for merge_schema.t1
NOTICE:  moving the data of merge_schema.t1
NOTICE:  dropping the old merge_schema.t1
NOTICE:  renaming the new table to merge_schema.t1
 undistribute_table
---------------------------------------------------------------------

(1 row)

SELECT undistribute_table('s1');
NOTICE:  creating a new table for merge_schema.s1
NOTICE:  moving the data of merge_schema.s1
NOTICE:  dropping the old merge_schema.s1
NOTICE:  renaming the new table to merge_schema.s1
 undistribute_table
---------------------------------------------------------------------

(1 row)

SELECT citus_add_local_table_to_metadata('t1');
 citus_add_local_table_to_metadata
---------------------------------------------------------------------

(1 row)

SELECT citus_add_local_table_to_metadata('s1');
 citus_add_local_table_to_metadata
---------------------------------------------------------------------

(1 row)

INSERT INTO s1 VALUES(1, 1); -- From load(), we already have row with id = 1
MERGE INTO t1
	USING s1 ON (s1.id = t1.id)
	WHEN MATCHED AND s1.val = 0 THEN
		DELETE
	WHEN MATCHED THEN
		UPDATE SET val = t1.val + 1
	WHEN NOT MATCHED THEN
		INSERT (id, val) VALUES (s1.id, s1.val);
ERROR:  MERGE command cannot affect row a second time
HINT:  Ensure that not more than one source row matches any one target row.
-- Materialized view as target is not allowed
MERGE INTO mv_source
USING mv_target
ON mv_source.id = mv_target.id
WHEN MATCHED THEN
    DO NOTHING
WHEN NOT MATCHED THEN
    INSERT VALUES(mv_source.id, mv_source.val);
ERROR:  cannot execute MERGE on relation "mv_source"
DETAIL:  This operation is not supported for materialized views.
DROP SERVER foreign_server CASCADE;
NOTICE:  drop cascades to 3 other objects
DETAIL:  drop cascades to user mapping for postgres on server foreign_server
drop cascades to foreign table foreign_table_4000046
drop cascades to foreign table foreign_table
NOTICE:  foreign table "foreign_table_4000046" does not exist, skipping
CONTEXT:  SQL statement "SELECT citus_drop_all_shards(v_obj.objid, v_obj.schema_name, v_obj.object_name, drop_shards_metadata_only := false)"
PL/pgSQL function citus_drop_trigger() line XX at PERFORM
DROP SCHEMA merge_schema CASCADE;
NOTICE:  drop cascades to 56 other objects
DETAIL:  drop cascades to function insert_data()
drop cascades to table pg_result
drop cascades to table local_local
drop cascades to table target
drop cascades to table source
drop cascades to function load()
drop cascades to table merge_result
drop cascades to table pg_t2
drop cascades to table t2_4000030
drop cascades to table s2_4000031
drop cascades to table t2
drop cascades to table s2
drop cascades to table dist_res
drop cascades to table t3_4000032
drop cascades to table s3_1_4000033
drop cascades to table s3_2_4000034
drop cascades to table pg_t3
drop cascades to table t3
drop cascades to table s3_1
drop cascades to table s3_2
drop cascades to table local_t3
drop cascades to table tf_target_4000035
drop cascades to table tf_result
drop cascades to table tf_target
drop cascades to table tf_local
drop cascades to table vl_target_4000036
drop cascades to table vl_result
drop cascades to table vl_target
drop cascades to table vl_local
drop cascades to function f_immutable(integer)
drop cascades to table rs_target_4000037
drop cascades to table rs_result
drop cascades to table rs_target
drop cascades to table rs_local
drop cascades to table mv_target_4000038
drop cascades to table mv_source_table_4000039
drop cascades to table mv_result
drop cascades to table mv_target
drop cascades to table mv_source_table
drop cascades to materialized view mv_source
drop cascades to table mv_local
drop cascades to table dist_table
drop cascades to function f_dist()
drop cascades to table fn_target_4000040
drop cascades to table fn_result
drop cascades to table fn_target
drop cascades to table fn_local
drop cascades to table ft_target
drop cascades to table ft_source_4000045
drop cascades to table ft_source
drop cascades to extension postgres_fdw
drop cascades to table pg
drop cascades to table t1_4000062
drop cascades to table s1_4000063
drop cascades to table t1
drop cascades to table s1
SELECT 1 FROM master_remove_node('localhost', :master_port);
 ?column?
---------------------------------------------------------------------
        1
(1 row)

