--
-- MULTI_METADATA_SNAPSHOT
--
-- Tests for metadata snapshot functions.
ALTER SEQUENCE pg_catalog.pg_dist_shardid_seq RESTART 1310000;
ALTER SEQUENCE pg_catalog.pg_dist_jobid_seq RESTART 1310000;
-- Create the necessary test utility function
CREATE FUNCTION master_metadata_snapshot()
    RETURNS text[]
    LANGUAGE C STRICT
    AS 'citus';
    
COMMENT ON FUNCTION master_metadata_snapshot()
    IS 'commands to create the metadata snapshot';
    
-- Show that none of the existing tables are qualified to be MX tables
SELECT * FROM pg_dist_partition WHERE partmethod='h' AND repmodel='s';
 logicalrelid | partmethod | partkey | colocationid | repmodel 
--------------+------------+---------+--------------+----------
(0 rows)

-- Show that, with no MX tables, metadata snapshot contains only the delete commands and 
-- pg_dist_node entries
SELECT unnest(master_metadata_snapshot());
                                                                           unnest                                                                            
-------------------------------------------------------------------------------------------------------------------------------------------------------------
 TRUNCATE pg_dist_node
 SELECT worker_drop_distributed_table(logicalrelid) FROM pg_dist_partition
 INSERT INTO pg_dist_node (nodeid, groupid, nodename, nodeport, noderack) VALUES (2, 2, 'localhost', 57638, 'default'),(1, 1, 'localhost', 57637, 'default')
(3 rows)

-- Create a test table with constraints and SERIAL
CREATE TABLE mx_test_table (col_1 int UNIQUE, col_2 text NOT NULL, col_3 SERIAL);
SELECT master_create_distributed_table('mx_test_table', 'col_1', 'hash');
 master_create_distributed_table 
---------------------------------
 
(1 row)

SELECT master_create_worker_shards('mx_test_table', 8, 1);
 master_create_worker_shards 
-----------------------------
 
(1 row)

-- Set the replication model of the test table to streaming replication so that it is 
-- considered as an MX table
UPDATE pg_dist_partition SET repmodel='s' WHERE logicalrelid='mx_test_table'::regclass;
-- Show that the created MX table is included in the metadata snapshot
SELECT unnest(master_metadata_snapshot());
                                                                                                                                                                                                                                                                                                                                                             unnest                                                                                                                                                                                                                                                                                                                                                             
--------------------------------------------------------------------------------------------------------------------------------------------------------------------------------------------------------------------------------------------------------------------------------------------------------------------------------------------------------------------------------------------------------------------------------------------------------------------------------------------------------------------------------------------------------------------------------------------------------------------------------------------------------------------------------------------------------------------------------
 TRUNCATE pg_dist_node
 SELECT worker_drop_distributed_table(logicalrelid) FROM pg_dist_partition
 INSERT INTO pg_dist_node (nodeid, groupid, nodename, nodeport, noderack) VALUES (2, 2, 'localhost', 57638, 'default'),(1, 1, 'localhost', 57637, 'default')
 CREATE SEQUENCE IF NOT EXISTS public.mx_test_table_col_3_seq INCREMENT BY 1 MINVALUE 1 MAXVALUE 9223372036854775807 START WITH 1 NO CYCLE
 CREATE TABLE public.mx_test_table (col_1 integer, col_2 text NOT NULL, col_3 integer DEFAULT nextval('public.mx_test_table_col_3_seq'::regclass) NOT NULL)
 ALTER TABLE public.mx_test_table ADD CONSTRAINT mx_test_table_col_1_key UNIQUE (col_1)
 ALTER TABLE public.mx_test_table OWNER TO postgres
 INSERT INTO pg_dist_partition (logicalrelid, partmethod, partkey, colocationid, repmodel) VALUES ('public.mx_test_table'::regclass, 'h', column_name_to_column('public.mx_test_table','col_1'), 0, 's')
 INSERT INTO pg_dist_shard_placement (shardid, shardstate, shardlength, nodename, nodeport, placementid) VALUES (1310000, 1, 0, 'localhost', 57637, 549),(1310001, 1, 0, 'localhost', 57638, 550),(1310002, 1, 0, 'localhost', 57637, 551),(1310003, 1, 0, 'localhost', 57638, 552),(1310004, 1, 0, 'localhost', 57637, 553),(1310005, 1, 0, 'localhost', 57638, 554),(1310006, 1, 0, 'localhost', 57637, 555),(1310007, 1, 0, 'localhost', 57638, 556)
 INSERT INTO pg_dist_shard (logicalrelid, shardid, shardstorage, shardminvalue, shardmaxvalue) VALUES ('public.mx_test_table'::regclass, 1310000, 't', '-2147483648', '-1610612737'),('public.mx_test_table'::regclass, 1310001, 't', '-1610612736', '-1073741825'),('public.mx_test_table'::regclass, 1310002, 't', '-1073741824', '-536870913'),('public.mx_test_table'::regclass, 1310003, 't', '-536870912', '-1'),('public.mx_test_table'::regclass, 1310004, 't', '0', '536870911'),('public.mx_test_table'::regclass, 1310005, 't', '536870912', '1073741823'),('public.mx_test_table'::regclass, 1310006, 't', '1073741824', '1610612735'),('public.mx_test_table'::regclass, 1310007, 't', '1610612736', '2147483647')
(10 rows)

-- Show that CREATE INDEX commands are included in the metadata snapshot
CREATE INDEX mx_index ON mx_test_table(col_2);
NOTICE:  using one-phase commit for distributed DDL commands
HINT:  You can enable two-phase commit for extra safety with: SET citus.multi_shard_commit_protocol TO '2pc'
SELECT unnest(master_metadata_snapshot());
                                                                                                                                                                                                                                                                                                                                                             unnest                                                                                                                                                                                                                                                                                                                                                             
--------------------------------------------------------------------------------------------------------------------------------------------------------------------------------------------------------------------------------------------------------------------------------------------------------------------------------------------------------------------------------------------------------------------------------------------------------------------------------------------------------------------------------------------------------------------------------------------------------------------------------------------------------------------------------------------------------------------------------
 TRUNCATE pg_dist_node
 SELECT worker_drop_distributed_table(logicalrelid) FROM pg_dist_partition
 INSERT INTO pg_dist_node (nodeid, groupid, nodename, nodeport, noderack) VALUES (2, 2, 'localhost', 57638, 'default'),(1, 1, 'localhost', 57637, 'default')
 CREATE SEQUENCE IF NOT EXISTS public.mx_test_table_col_3_seq INCREMENT BY 1 MINVALUE 1 MAXVALUE 9223372036854775807 START WITH 1 NO CYCLE
 CREATE TABLE public.mx_test_table (col_1 integer, col_2 text NOT NULL, col_3 integer DEFAULT nextval('public.mx_test_table_col_3_seq'::regclass) NOT NULL)
 CREATE INDEX mx_index ON public.mx_test_table USING btree (col_2)
 ALTER TABLE public.mx_test_table ADD CONSTRAINT mx_test_table_col_1_key UNIQUE (col_1)
 ALTER TABLE public.mx_test_table OWNER TO postgres
 INSERT INTO pg_dist_partition (logicalrelid, partmethod, partkey, colocationid, repmodel) VALUES ('public.mx_test_table'::regclass, 'h', column_name_to_column('public.mx_test_table','col_1'), 0, 's')
 INSERT INTO pg_dist_shard_placement (shardid, shardstate, shardlength, nodename, nodeport, placementid) VALUES (1310000, 1, 0, 'localhost', 57637, 549),(1310001, 1, 0, 'localhost', 57638, 550),(1310002, 1, 0, 'localhost', 57637, 551),(1310003, 1, 0, 'localhost', 57638, 552),(1310004, 1, 0, 'localhost', 57637, 553),(1310005, 1, 0, 'localhost', 57638, 554),(1310006, 1, 0, 'localhost', 57637, 555),(1310007, 1, 0, 'localhost', 57638, 556)
 INSERT INTO pg_dist_shard (logicalrelid, shardid, shardstorage, shardminvalue, shardmaxvalue) VALUES ('public.mx_test_table'::regclass, 1310000, 't', '-2147483648', '-1610612737'),('public.mx_test_table'::regclass, 1310001, 't', '-1610612736', '-1073741825'),('public.mx_test_table'::regclass, 1310002, 't', '-1073741824', '-536870913'),('public.mx_test_table'::regclass, 1310003, 't', '-536870912', '-1'),('public.mx_test_table'::regclass, 1310004, 't', '0', '536870911'),('public.mx_test_table'::regclass, 1310005, 't', '536870912', '1073741823'),('public.mx_test_table'::regclass, 1310006, 't', '1073741824', '1610612735'),('public.mx_test_table'::regclass, 1310007, 't', '1610612736', '2147483647')
(11 rows)

-- Show that schema changes are included in the metadata snapshot
CREATE SCHEMA mx_testing_schema;
ALTER TABLE mx_test_table SET SCHEMA mx_testing_schema;
WARNING:  not propagating ALTER ... SET SCHEMA commands to worker nodes
HINT:  Connect to worker nodes directly to manually change schemas of affected objects.
SELECT unnest(master_metadata_snapshot());
                                                                                                                                                                                                                                                                                                                                                                                                         unnest                                                                                                                                                                                                                                                                                                                                                                                                         
------------------------------------------------------------------------------------------------------------------------------------------------------------------------------------------------------------------------------------------------------------------------------------------------------------------------------------------------------------------------------------------------------------------------------------------------------------------------------------------------------------------------------------------------------------------------------------------------------------------------------------------------------------------------------------------------------------------------------------------------------------------------------------------------------------------------
 TRUNCATE pg_dist_node
 SELECT worker_drop_distributed_table(logicalrelid) FROM pg_dist_partition
 INSERT INTO pg_dist_node (nodeid, groupid, nodename, nodeport, noderack) VALUES (2, 2, 'localhost', 57638, 'default'),(1, 1, 'localhost', 57637, 'default')
 CREATE SCHEMA IF NOT EXISTS mx_testing_schema
 CREATE SEQUENCE IF NOT EXISTS mx_testing_schema.mx_test_table_col_3_seq INCREMENT BY 1 MINVALUE 1 MAXVALUE 9223372036854775807 START WITH 1 NO CYCLE
 CREATE TABLE mx_testing_schema.mx_test_table (col_1 integer, col_2 text NOT NULL, col_3 integer DEFAULT nextval('mx_testing_schema.mx_test_table_col_3_seq'::regclass) NOT NULL)
 CREATE INDEX mx_index ON mx_testing_schema.mx_test_table USING btree (col_2)
 ALTER TABLE mx_testing_schema.mx_test_table ADD CONSTRAINT mx_test_table_col_1_key UNIQUE (col_1)
 ALTER TABLE mx_testing_schema.mx_test_table OWNER TO postgres
 INSERT INTO pg_dist_partition (logicalrelid, partmethod, partkey, colocationid, repmodel) VALUES ('mx_testing_schema.mx_test_table'::regclass, 'h', column_name_to_column('mx_testing_schema.mx_test_table','col_1'), 0, 's')
 INSERT INTO pg_dist_shard_placement (shardid, shardstate, shardlength, nodename, nodeport, placementid) VALUES (1310000, 1, 0, 'localhost', 57637, 549),(1310001, 1, 0, 'localhost', 57638, 550),(1310002, 1, 0, 'localhost', 57637, 551),(1310003, 1, 0, 'localhost', 57638, 552),(1310004, 1, 0, 'localhost', 57637, 553),(1310005, 1, 0, 'localhost', 57638, 554),(1310006, 1, 0, 'localhost', 57637, 555),(1310007, 1, 0, 'localhost', 57638, 556)
 INSERT INTO pg_dist_shard (logicalrelid, shardid, shardstorage, shardminvalue, shardmaxvalue) VALUES ('mx_testing_schema.mx_test_table'::regclass, 1310000, 't', '-2147483648', '-1610612737'),('mx_testing_schema.mx_test_table'::regclass, 1310001, 't', '-1610612736', '-1073741825'),('mx_testing_schema.mx_test_table'::regclass, 1310002, 't', '-1073741824', '-536870913'),('mx_testing_schema.mx_test_table'::regclass, 1310003, 't', '-536870912', '-1'),('mx_testing_schema.mx_test_table'::regclass, 1310004, 't', '0', '536870911'),('mx_testing_schema.mx_test_table'::regclass, 1310005, 't', '536870912', '1073741823'),('mx_testing_schema.mx_test_table'::regclass, 1310006, 't', '1073741824', '1610612735'),('mx_testing_schema.mx_test_table'::regclass, 1310007, 't', '1610612736', '2147483647')
(12 rows)

-- Show that append distributed tables are not included in the metadata snapshot
CREATE TABLE non_mx_test_table (col_1 int, col_2 text);
SELECT master_create_distributed_table('non_mx_test_table', 'col_1', 'append');
 master_create_distributed_table 
---------------------------------
 
(1 row)

UPDATE pg_dist_partition SET repmodel='s' WHERE logicalrelid='non_mx_test_table'::regclass;
SELECT unnest(master_metadata_snapshot());
                                                                                                                                                                                                                                                                                                                                                                                                         unnest                                                                                                                                                                                                                                                                                                                                                                                                         
------------------------------------------------------------------------------------------------------------------------------------------------------------------------------------------------------------------------------------------------------------------------------------------------------------------------------------------------------------------------------------------------------------------------------------------------------------------------------------------------------------------------------------------------------------------------------------------------------------------------------------------------------------------------------------------------------------------------------------------------------------------------------------------------------------------------
 TRUNCATE pg_dist_node
 SELECT worker_drop_distributed_table(logicalrelid) FROM pg_dist_partition
 INSERT INTO pg_dist_node (nodeid, groupid, nodename, nodeport, noderack) VALUES (2, 2, 'localhost', 57638, 'default'),(1, 1, 'localhost', 57637, 'default')
 CREATE SCHEMA IF NOT EXISTS mx_testing_schema
 CREATE SEQUENCE IF NOT EXISTS mx_testing_schema.mx_test_table_col_3_seq INCREMENT BY 1 MINVALUE 1 MAXVALUE 9223372036854775807 START WITH 1 NO CYCLE
 CREATE TABLE mx_testing_schema.mx_test_table (col_1 integer, col_2 text NOT NULL, col_3 integer DEFAULT nextval('mx_testing_schema.mx_test_table_col_3_seq'::regclass) NOT NULL)
 CREATE INDEX mx_index ON mx_testing_schema.mx_test_table USING btree (col_2)
 ALTER TABLE mx_testing_schema.mx_test_table ADD CONSTRAINT mx_test_table_col_1_key UNIQUE (col_1)
 ALTER TABLE mx_testing_schema.mx_test_table OWNER TO postgres
 INSERT INTO pg_dist_partition (logicalrelid, partmethod, partkey, colocationid, repmodel) VALUES ('mx_testing_schema.mx_test_table'::regclass, 'h', column_name_to_column('mx_testing_schema.mx_test_table','col_1'), 0, 's')
 INSERT INTO pg_dist_shard_placement (shardid, shardstate, shardlength, nodename, nodeport, placementid) VALUES (1310000, 1, 0, 'localhost', 57637, 549),(1310001, 1, 0, 'localhost', 57638, 550),(1310002, 1, 0, 'localhost', 57637, 551),(1310003, 1, 0, 'localhost', 57638, 552),(1310004, 1, 0, 'localhost', 57637, 553),(1310005, 1, 0, 'localhost', 57638, 554),(1310006, 1, 0, 'localhost', 57637, 555),(1310007, 1, 0, 'localhost', 57638, 556)
 INSERT INTO pg_dist_shard (logicalrelid, shardid, shardstorage, shardminvalue, shardmaxvalue) VALUES ('mx_testing_schema.mx_test_table'::regclass, 1310000, 't', '-2147483648', '-1610612737'),('mx_testing_schema.mx_test_table'::regclass, 1310001, 't', '-1610612736', '-1073741825'),('mx_testing_schema.mx_test_table'::regclass, 1310002, 't', '-1073741824', '-536870913'),('mx_testing_schema.mx_test_table'::regclass, 1310003, 't', '-536870912', '-1'),('mx_testing_schema.mx_test_table'::regclass, 1310004, 't', '0', '536870911'),('mx_testing_schema.mx_test_table'::regclass, 1310005, 't', '536870912', '1073741823'),('mx_testing_schema.mx_test_table'::regclass, 1310006, 't', '1073741824', '1610612735'),('mx_testing_schema.mx_test_table'::regclass, 1310007, 't', '1610612736', '2147483647')
(12 rows)

-- Show that range distributed tables are not included in the metadata snapshot
UPDATE pg_dist_partition SET partmethod='r' WHERE logicalrelid='non_mx_test_table'::regclass;
SELECT unnest(master_metadata_snapshot());
                                                                                                                                                                                                                                                                                                                                                                                                         unnest                                                                                                                                                                                                                                                                                                                                                                                                         
------------------------------------------------------------------------------------------------------------------------------------------------------------------------------------------------------------------------------------------------------------------------------------------------------------------------------------------------------------------------------------------------------------------------------------------------------------------------------------------------------------------------------------------------------------------------------------------------------------------------------------------------------------------------------------------------------------------------------------------------------------------------------------------------------------------------
 TRUNCATE pg_dist_node
 SELECT worker_drop_distributed_table(logicalrelid) FROM pg_dist_partition
 INSERT INTO pg_dist_node (nodeid, groupid, nodename, nodeport, noderack) VALUES (2, 2, 'localhost', 57638, 'default'),(1, 1, 'localhost', 57637, 'default')
 CREATE SCHEMA IF NOT EXISTS mx_testing_schema
 CREATE SEQUENCE IF NOT EXISTS mx_testing_schema.mx_test_table_col_3_seq INCREMENT BY 1 MINVALUE 1 MAXVALUE 9223372036854775807 START WITH 1 NO CYCLE
 CREATE TABLE mx_testing_schema.mx_test_table (col_1 integer, col_2 text NOT NULL, col_3 integer DEFAULT nextval('mx_testing_schema.mx_test_table_col_3_seq'::regclass) NOT NULL)
 CREATE INDEX mx_index ON mx_testing_schema.mx_test_table USING btree (col_2)
 ALTER TABLE mx_testing_schema.mx_test_table ADD CONSTRAINT mx_test_table_col_1_key UNIQUE (col_1)
 ALTER TABLE mx_testing_schema.mx_test_table OWNER TO postgres
 INSERT INTO pg_dist_partition (logicalrelid, partmethod, partkey, colocationid, repmodel) VALUES ('mx_testing_schema.mx_test_table'::regclass, 'h', column_name_to_column('mx_testing_schema.mx_test_table','col_1'), 0, 's')
 INSERT INTO pg_dist_shard_placement (shardid, shardstate, shardlength, nodename, nodeport, placementid) VALUES (1310000, 1, 0, 'localhost', 57637, 549),(1310001, 1, 0, 'localhost', 57638, 550),(1310002, 1, 0, 'localhost', 57637, 551),(1310003, 1, 0, 'localhost', 57638, 552),(1310004, 1, 0, 'localhost', 57637, 553),(1310005, 1, 0, 'localhost', 57638, 554),(1310006, 1, 0, 'localhost', 57637, 555),(1310007, 1, 0, 'localhost', 57638, 556)
 INSERT INTO pg_dist_shard (logicalrelid, shardid, shardstorage, shardminvalue, shardmaxvalue) VALUES ('mx_testing_schema.mx_test_table'::regclass, 1310000, 't', '-2147483648', '-1610612737'),('mx_testing_schema.mx_test_table'::regclass, 1310001, 't', '-1610612736', '-1073741825'),('mx_testing_schema.mx_test_table'::regclass, 1310002, 't', '-1073741824', '-536870913'),('mx_testing_schema.mx_test_table'::regclass, 1310003, 't', '-536870912', '-1'),('mx_testing_schema.mx_test_table'::regclass, 1310004, 't', '0', '536870911'),('mx_testing_schema.mx_test_table'::regclass, 1310005, 't', '536870912', '1073741823'),('mx_testing_schema.mx_test_table'::regclass, 1310006, 't', '1073741824', '1610612735'),('mx_testing_schema.mx_test_table'::regclass, 1310007, 't', '1610612736', '2147483647')
(12 rows)

