CREATE SCHEMA prune_shard_list;
SET search_path TO prune_shard_list;
SET citus.next_shard_id TO 800000;
-- ===================================================================
-- create test functions
-- ===================================================================
CREATE FUNCTION prune_using_no_values(regclass)
	RETURNS text[]
	AS 'citus'
	LANGUAGE C STRICT;
CREATE FUNCTION prune_using_single_value(regclass, text)
	RETURNS text[]
	AS 'citus'
	LANGUAGE C;
CREATE FUNCTION prune_using_either_value(regclass, text, text)
	RETURNS text[]
	AS 'citus'
	LANGUAGE C STRICT;
CREATE FUNCTION prune_using_both_values(regclass, text, text)
	RETURNS text[]
	AS 'citus'
	LANGUAGE C STRICT;
CREATE FUNCTION debug_equality_expression(regclass)
	RETURNS cstring
	AS 'citus'
	LANGUAGE C STRICT;
CREATE FUNCTION print_sorted_shard_intervals(regclass)
	RETURNS text[]
	AS 'citus'
	LANGUAGE C STRICT;
-- ===================================================================
-- test shard pruning functionality
-- ===================================================================
-- create distributed table observe shard pruning
CREATE TABLE pruning ( species text, last_pruned date, plant_id integer );
SET citus.shard_replication_factor TO 1;
SELECT create_distributed_table('pruning', 'species', 'hash');
 create_distributed_table
---------------------------------------------------------------------

(1 row)

-- with no values, expect all shards
SELECT prune_using_no_values('pruning');
     prune_using_no_values
---------------------------------------------------------------------
 {800000,800001,800002,800003}
(1 row)

-- with a single value, expect a single shard
SELECT prune_using_single_value('pruning', 'tomato');
 prune_using_single_value
---------------------------------------------------------------------
 {800002}
(1 row)

-- null values should result in no pruning
SELECT prune_using_single_value('pruning', NULL);
   prune_using_single_value
---------------------------------------------------------------------
 {800000,800001,800002,800003}
(1 row)

-- build an OR clause and expect more than one sahrd
SELECT prune_using_either_value('pruning', 'tomato', 'petunia');
 prune_using_either_value
---------------------------------------------------------------------
 {800002,800001}
(1 row)

-- an AND clause with values on different shards returns no shards
SELECT prune_using_both_values('pruning', 'tomato', 'petunia');
 prune_using_both_values
---------------------------------------------------------------------
 {}
(1 row)

-- even if both values are on the same shard, a value can't be equal to two others
SELECT prune_using_both_values('pruning', 'tomato', 'rose');
 prune_using_both_values
---------------------------------------------------------------------
 {}
(1 row)

-- unit test of the equality expression generation code
SELECT debug_equality_expression('pruning');
                                                                                                                                                                            debug_equality_expression
---------------------------------------------------------------------
 {OPEXPR :opno 98 :opfuncid 67 :opresulttype 16 :opretset false :opcollid 0 :inputcollid 100 :args ({VAR :varno 1 :varattno 1 :vartype 25 :vartypmod -1 :varcollid 100 :varnullingrels (b) :varlevelsup 0 :varnosyn 1 :varattnosyn 1 :location -1} {CONST :consttype 25 :consttypmod -1 :constcollid 100 :constlen -1 :constbyval false :constisnull true :location -1 :constvalue <>}) :location -1}
(1 row)

-- print the initial ordering of shard intervals
SELECT print_sorted_shard_intervals('pruning');
 print_sorted_shard_intervals
---------------------------------------------------------------------
 {800000,800001,800002,800003}
(1 row)

-- update only min value for one shard
UPDATE pg_dist_shard set shardminvalue = NULL WHERE shardid = 800001;
SELECT print_sorted_shard_intervals('pruning');
ERROR:  hash partitioned table has uninitialized shards
-- repair shard
UPDATE pg_dist_shard set shardminvalue = -1073741824 WHERE shardid = 800001;
-- create range distributed table observe shard pruning
CREATE TABLE pruning_range ( species text, last_pruned date, plant_id integer );
SELECT create_distributed_table('pruning_range', 'species', 'range');
 create_distributed_table
---------------------------------------------------------------------

(1 row)

-- create worker shards
SELECT master_create_empty_shard('pruning_range');
 master_create_empty_shard
---------------------------------------------------------------------
                    800004
(1 row)

SELECT master_create_empty_shard('pruning_range');
 master_create_empty_shard
---------------------------------------------------------------------
                    800005
(1 row)

SELECT master_create_empty_shard('pruning_range');
 master_create_empty_shard
---------------------------------------------------------------------
                    800006
(1 row)

SELECT master_create_empty_shard('pruning_range');
 master_create_empty_shard
---------------------------------------------------------------------
                    800007
(1 row)

-- now the comparison is done via the partition column type, which is text
UPDATE pg_dist_shard SET shardminvalue = 'a', shardmaxvalue = 'b' WHERE shardid = 800004;
UPDATE pg_dist_shard SET shardminvalue = 'c', shardmaxvalue = 'd' WHERE shardid = 800005;
UPDATE pg_dist_shard SET shardminvalue = 'e', shardmaxvalue = 'f' WHERE shardid = 800006;
UPDATE pg_dist_shard SET shardminvalue = 'g', shardmaxvalue = 'h' WHERE shardid = 800007;
-- print the ordering of shard intervals with range partitioning as well
SELECT print_sorted_shard_intervals('pruning_range');
 print_sorted_shard_intervals
---------------------------------------------------------------------
 {800004,800005,800006,800007}
(1 row)

-- update only min value for one shard
UPDATE pg_dist_shard set shardminvalue = NULL WHERE shardid = 800005;
SELECT print_sorted_shard_intervals('pruning_range');
 print_sorted_shard_intervals
---------------------------------------------------------------------
 {800004,800006,800007,800005}
(1 row)

-- now lets have one more shard without min/max values
UPDATE pg_dist_shard set shardminvalue = NULL, shardmaxvalue = NULL WHERE shardid = 800006;
SELECT print_sorted_shard_intervals('pruning_range');
 print_sorted_shard_intervals
---------------------------------------------------------------------
 {800004,800007,800005,800006}
(1 row)

-- now lets have one more shard without min/max values
UPDATE pg_dist_shard set shardminvalue = NULL, shardmaxvalue = NULL WHERE shardid = 800004;
SELECT print_sorted_shard_intervals('pruning_range');
 print_sorted_shard_intervals
---------------------------------------------------------------------
 {800007,800004,800005,800006}
(1 row)

-- all shard placements are uninitialized
UPDATE pg_dist_shard set shardminvalue = NULL, shardmaxvalue = NULL WHERE shardid = 800007;
SELECT print_sorted_shard_intervals('pruning_range');
 print_sorted_shard_intervals
---------------------------------------------------------------------
 {800004,800005,800006,800007}
(1 row)

-- ===================================================================
-- test pruning using values whose types are coerced
-- ===================================================================
CREATE TABLE coerce_hash (
	id bigint NOT NULL,
	value text NOT NULL
);
SELECT create_distributed_table('coerce_hash', 'id');
 create_distributed_table
---------------------------------------------------------------------

(1 row)

INSERT INTO coerce_hash VALUES (1, 'test value');
-- All three of the following should return the same results...
-- SELECT with same type as partition column
SELECT * FROM coerce_hash WHERE id = 1::bigint;
 id |   value
---------------------------------------------------------------------
  1 | test value
(1 row)

-- SELECT with similar type to partition column
SELECT * FROM coerce_hash WHERE id = 1;
 id |   value
---------------------------------------------------------------------
  1 | test value
(1 row)

-- SELECT with numeric type (original impetus for this change)
-- PostgreSQL will cast id to numeric rather than 1.0 to bigint...
-- We used to blindly pass the RHS' Datum to our comparison func.,
-- resulting in inaccurate pruning. An Assert now verifies type-
-- compatibility; the following would crash the server in an Assert-
-- before the underlying issue was addressed. It looks like a boring
-- test now, but if the old behavior is restored, it should crash again.
SELECT * FROM coerce_hash WHERE id = 1.0;
 id |   value
---------------------------------------------------------------------
  1 | test value
(1 row)

SELECT * FROM coerce_hash WHERE id = 1.0::numeric;
 id |   value
---------------------------------------------------------------------
  1 | test value
(1 row)

-- same queries with PREPARE
PREPARE coerce_bigint(bigint) AS SELECT * FROM coerce_hash WHERE id=$1::bigint;
PREPARE coerce_numeric(bigint) AS SELECT * FROM coerce_hash WHERE id=$1::numeric;
PREPARE coerce_numeric_2(numeric) AS SELECT * FROM coerce_hash WHERE id=$1;
EXECUTE coerce_bigint(1);
 id |   value
---------------------------------------------------------------------
  1 | test value
(1 row)

EXECUTE coerce_bigint(1);
 id |   value
---------------------------------------------------------------------
  1 | test value
(1 row)

EXECUTE coerce_bigint(1);
 id |   value
---------------------------------------------------------------------
  1 | test value
(1 row)

EXECUTE coerce_bigint(1);
 id |   value
---------------------------------------------------------------------
  1 | test value
(1 row)

EXECUTE coerce_bigint(1);
 id |   value
---------------------------------------------------------------------
  1 | test value
(1 row)

EXECUTE coerce_bigint(1);
 id |   value
---------------------------------------------------------------------
  1 | test value
(1 row)

EXECUTE coerce_bigint(1);
 id |   value
---------------------------------------------------------------------
  1 | test value
(1 row)

EXECUTE coerce_bigint(1);
 id |   value
---------------------------------------------------------------------
  1 | test value
(1 row)

EXECUTE coerce_numeric(1);
 id |   value
---------------------------------------------------------------------
  1 | test value
(1 row)

EXECUTE coerce_numeric(1);
 id |   value
---------------------------------------------------------------------
  1 | test value
(1 row)

EXECUTE coerce_numeric(1);
 id |   value
---------------------------------------------------------------------
  1 | test value
(1 row)

EXECUTE coerce_numeric(1);
 id |   value
---------------------------------------------------------------------
  1 | test value
(1 row)

EXECUTE coerce_numeric(1);
 id |   value
---------------------------------------------------------------------
  1 | test value
(1 row)

EXECUTE coerce_numeric(1);
 id |   value
---------------------------------------------------------------------
  1 | test value
(1 row)

EXECUTE coerce_numeric(1);
 id |   value
---------------------------------------------------------------------
  1 | test value
(1 row)

EXECUTE coerce_numeric_2(1);
 id |   value
---------------------------------------------------------------------
  1 | test value
(1 row)

EXECUTE coerce_numeric_2(1);
 id |   value
---------------------------------------------------------------------
  1 | test value
(1 row)

EXECUTE coerce_numeric_2(1);
 id |   value
---------------------------------------------------------------------
  1 | test value
(1 row)

EXECUTE coerce_numeric_2(1);
 id |   value
---------------------------------------------------------------------
  1 | test value
(1 row)

EXECUTE coerce_numeric_2(1);
 id |   value
---------------------------------------------------------------------
  1 | test value
(1 row)

EXECUTE coerce_numeric_2(1);
 id |   value
---------------------------------------------------------------------
  1 | test value
(1 row)

EXECUTE coerce_numeric_2(1);
 id |   value
---------------------------------------------------------------------
  1 | test value
(1 row)

-- Test that we can insert an integer literal into a numeric column as well
CREATE TABLE numeric_test (id numeric(6, 1), val int);
SELECT create_distributed_table('numeric_test', 'id');
 create_distributed_table
---------------------------------------------------------------------

(1 row)

INSERT INTO numeric_test VALUES (21, 87) RETURNING *;
  id  | val
---------------------------------------------------------------------
 21.0 |  87
(1 row)

SELECT * FROM numeric_test WHERE id = 21;
  id  | val
---------------------------------------------------------------------
 21.0 |  87
(1 row)

SELECT * FROM numeric_test WHERE id = 21::int;
  id  | val
---------------------------------------------------------------------
 21.0 |  87
(1 row)

SELECT * FROM numeric_test WHERE id = 21::bigint;
  id  | val
---------------------------------------------------------------------
 21.0 |  87
(1 row)

SELECT * FROM numeric_test WHERE id = 21.0;
  id  | val
---------------------------------------------------------------------
 21.0 |  87
(1 row)

SELECT * FROM numeric_test WHERE id = 21.0::numeric;
  id  | val
---------------------------------------------------------------------
 21.0 |  87
(1 row)

PREPARE insert_p(int) AS INSERT INTO numeric_test VALUES ($1, 87) RETURNING *;
EXECUTE insert_p(1);
 id  | val
---------------------------------------------------------------------
 1.0 |  87
(1 row)

EXECUTE insert_p(2);
 id  | val
---------------------------------------------------------------------
 2.0 |  87
(1 row)

EXECUTE insert_p(3);
 id  | val
---------------------------------------------------------------------
 3.0 |  87
(1 row)

EXECUTE insert_p(4);
 id  | val
---------------------------------------------------------------------
 4.0 |  87
(1 row)

EXECUTE insert_p(5);
 id  | val
---------------------------------------------------------------------
 5.0 |  87
(1 row)

EXECUTE insert_p(6);
 id  | val
---------------------------------------------------------------------
 6.0 |  87
(1 row)

PREPARE select_p(int) AS SELECT * FROM numeric_test WHERE id=$1;
EXECUTE select_p(1);
 id  | val
---------------------------------------------------------------------
 1.0 |  87
(1 row)

EXECUTE select_p(2);
 id  | val
---------------------------------------------------------------------
 2.0 |  87
(1 row)

EXECUTE select_p(3);
 id  | val
---------------------------------------------------------------------
 3.0 |  87
(1 row)

EXECUTE select_p(4);
 id  | val
---------------------------------------------------------------------
 4.0 |  87
(1 row)

EXECUTE select_p(5);
 id  | val
---------------------------------------------------------------------
 5.0 |  87
(1 row)

EXECUTE select_p(6);
 id  | val
---------------------------------------------------------------------
 6.0 |  87
(1 row)

SET citus.enable_fast_path_router_planner TO false;
EXECUTE select_p(1);
 id  | val
---------------------------------------------------------------------
 1.0 |  87
(1 row)

EXECUTE select_p(2);
 id  | val
---------------------------------------------------------------------
 2.0 |  87
(1 row)

EXECUTE select_p(3);
 id  | val
---------------------------------------------------------------------
 3.0 |  87
(1 row)

EXECUTE select_p(4);
 id  | val
---------------------------------------------------------------------
 4.0 |  87
(1 row)

EXECUTE select_p(5);
 id  | val
---------------------------------------------------------------------
 5.0 |  87
(1 row)

EXECUTE select_p(6);
 id  | val
---------------------------------------------------------------------
 6.0 |  87
(1 row)

-- make sure that we don't return wrong resuls
INSERT INTO numeric_test VALUES (21.1, 87) RETURNING *;
  id  | val
---------------------------------------------------------------------
 21.1 |  87
(1 row)

SELECT * FROM numeric_test WHERE id = 21;
  id  | val
---------------------------------------------------------------------
 21.0 |  87
(1 row)

SELECT * FROM numeric_test WHERE id = 21::numeric;
  id  | val
---------------------------------------------------------------------
 21.0 |  87
(1 row)

SELECT * FROM numeric_test WHERE id = 21.1::numeric;
  id  | val
---------------------------------------------------------------------
 21.1 |  87
(1 row)

CREATE TABLE range_dist_table_1 (dist_col BIGINT);
SELECT create_distributed_table('range_dist_table_1', 'dist_col', 'range');
 create_distributed_table
---------------------------------------------------------------------

(1 row)

CALL public.create_range_partitioned_shards('range_dist_table_1', '{1000,3000,6000}', '{2000,4000,7000}');
INSERT INTO range_dist_table_1 VALUES (1001);
INSERT INTO range_dist_table_1 VALUES (3800);
INSERT INTO range_dist_table_1 VALUES (6500);
-- all were returning false before fixing #5077
SELECT SUM(dist_col)=3800+6500 FROM range_dist_table_1 WHERE dist_col >= 2999;
 ?column?
---------------------------------------------------------------------
 t
(1 row)

SELECT SUM(dist_col)=3800+6500 FROM range_dist_table_1 WHERE dist_col > 2999;
 ?column?
---------------------------------------------------------------------
 t
(1 row)

SELECT SUM(dist_col)=3800+6500 FROM range_dist_table_1 WHERE dist_col >= 2500;
 ?column?
---------------------------------------------------------------------
 t
(1 row)

SELECT SUM(dist_col)=3800+6500 FROM range_dist_table_1 WHERE dist_col > 2000;
 ?column?
---------------------------------------------------------------------
 t
(1 row)

SELECT SUM(dist_col)=3800+6500 FROM range_dist_table_1 WHERE dist_col > 1001;
 ?column?
---------------------------------------------------------------------
 t
(1 row)

SELECT SUM(dist_col)=1001+3800+6500 FROM range_dist_table_1 WHERE dist_col >= 1001;
 ?column?
---------------------------------------------------------------------
 t
(1 row)

SELECT SUM(dist_col)=1001+3800+6500 FROM range_dist_table_1 WHERE dist_col > 1000;
 ?column?
---------------------------------------------------------------------
 t
(1 row)

SELECT SUM(dist_col)=1001+3800+6500 FROM range_dist_table_1 WHERE dist_col >= 1000;
 ?column?
---------------------------------------------------------------------
 t
(1 row)

-- we didn't have such an off-by-one error in upper bound
-- calculation, but let's test such cases too
SELECT SUM(dist_col)=1001+3800 FROM range_dist_table_1 WHERE dist_col <= 4001;
 ?column?
---------------------------------------------------------------------
 t
(1 row)

SELECT SUM(dist_col)=1001+3800 FROM range_dist_table_1 WHERE dist_col < 4001;
 ?column?
---------------------------------------------------------------------
 t
(1 row)

SELECT SUM(dist_col)=1001+3800 FROM range_dist_table_1 WHERE dist_col <= 4500;
 ?column?
---------------------------------------------------------------------
 t
(1 row)

SELECT SUM(dist_col)=1001+3800 FROM range_dist_table_1 WHERE dist_col < 6000;
 ?column?
---------------------------------------------------------------------
 t
(1 row)

-- now test with composite type and more shards
CREATE TYPE comp_type AS (
    int_field_1 BIGINT,
    int_field_2 BIGINT
);
CREATE TYPE comp_type_range AS RANGE (
    subtype = comp_type);
CREATE TABLE range_dist_table_2 (dist_col comp_type);
SELECT create_distributed_table('range_dist_table_2', 'dist_col', 'range');
 create_distributed_table
---------------------------------------------------------------------

(1 row)

CALL public.create_range_partitioned_shards(
	'range_dist_table_2',
    '{"(10,24)","(10,58)",
	  "(10,90)","(20,100)"}',
	'{"(10,25)","(10,65)",
	  "(10,99)","(20,100)"}');
INSERT INTO range_dist_table_2 VALUES ((10, 24));
INSERT INTO range_dist_table_2 VALUES ((10, 60));
INSERT INTO range_dist_table_2 VALUES ((10, 91));
INSERT INTO range_dist_table_2 VALUES ((20, 100));
SELECT dist_col='(10, 60)'::comp_type FROM range_dist_table_2
WHERE dist_col >= '(10,26)'::comp_type AND
      dist_col <= '(10,75)'::comp_type;
 ?column?
---------------------------------------------------------------------
 t
(1 row)

SELECT * FROM range_dist_table_2
WHERE dist_col >= '(10,57)'::comp_type AND
      dist_col <= '(10,95)'::comp_type
ORDER BY dist_col;
 dist_col
---------------------------------------------------------------------
 (10,60)
 (10,91)
(2 rows)

SELECT * FROM range_dist_table_2
WHERE dist_col >= '(10,57)'::comp_type
ORDER BY dist_col;
 dist_col
---------------------------------------------------------------------
 (10,60)
 (10,91)
 (20,100)
(3 rows)

SELECT dist_col='(20,100)'::comp_type FROM range_dist_table_2
WHERE dist_col > '(20,99)'::comp_type;
 ?column?
---------------------------------------------------------------------
 t
(1 row)

DROP TABLE range_dist_table_1, range_dist_table_2;
DROP TYPE comp_type CASCADE;
NOTICE:  drop cascades to type comp_type_range
SET search_path TO public;
DROP SCHEMA prune_shard_list CASCADE;
NOTICE:  drop cascades to 10 other objects
DETAIL:  drop cascades to function prune_shard_list.prune_using_no_values(regclass)
drop cascades to function prune_shard_list.prune_using_single_value(regclass,text)
drop cascades to function prune_shard_list.prune_using_either_value(regclass,text,text)
drop cascades to function prune_shard_list.prune_using_both_values(regclass,text,text)
drop cascades to function prune_shard_list.debug_equality_expression(regclass)
drop cascades to function prune_shard_list.print_sorted_shard_intervals(regclass)
drop cascades to table prune_shard_list.pruning
drop cascades to table prune_shard_list.pruning_range
drop cascades to table prune_shard_list.coerce_hash
drop cascades to table prune_shard_list.numeric_test
