--
-- MULTI_FUNCTION_EVALUATION
--
ALTER SEQUENCE pg_catalog.pg_dist_shardid_seq RESTART 1200000;
ALTER SEQUENCE pg_catalog.pg_dist_jobid_seq RESTART 1200000;
-- nextval() works (no good way to test DEFAULT, or, by extension, SERIAL)
CREATE TABLE example (key INT, value INT);
SELECT master_create_distributed_table('example', 'key', 'hash');
 master_create_distributed_table 
---------------------------------
 
(1 row)

CREATE SEQUENCE example_value_seq;
SELECT master_create_worker_shards('example', 1, 2);
 master_create_worker_shards 
-----------------------------
 
(1 row)

INSERT INTO example VALUES (1, nextval('example_value_seq'));
SELECT * FROM example;
 key | value 
-----+-------
   1 |     1
(1 row)

-- functions called by prepared statements are also evaluated
PREPARE stmt AS INSERT INTO example VALUES (2);
EXECUTE stmt;
EXECUTE stmt;
SELECT * FROM example;
 key | value 
-----+-------
   1 |     1
   2 |      
   2 |      
(3 rows)

-- non-immutable functions inside CASE/COALESCE aren't allowed
ALTER TABLE example DROP value;
ALTER TABLE example ADD value timestamp;
-- this is allowed because there are no mutable funcs in the CASE
UPDATE example SET value = (CASE WHEN value > timestamp '12-12-1991' THEN timestamp '12-12-1991' ELSE value + interval '1 hour' END) WHERE key = 1;
-- this is allowed because the planner strips away the CASE during constant evaluation
UPDATE example SET value = CASE WHEN true THEN now() ELSE now() + interval '1 hour' END WHERE key = 1;
-- this is not allowed because there're mutable functions in a CaseWhen clause
-- (which we can't easily evaluate on the master)
UPDATE example SET value = (CASE WHEN now() > timestamp '12-12-1991' THEN now() ELSE timestamp '10-24-1190' END) WHERE key = 1;
ERROR:  non-IMMUTABLE functions are not allowed in CASE or COALESCE statements
-- make sure we also check defresult (the ELSE clause)
UPDATE example SET value = (CASE WHEN now() > timestamp '12-12-1991' THEN timestamp '12-12-1191' ELSE now() END) WHERE key = 1;
ERROR:  non-IMMUTABLE functions are not allowed in CASE or COALESCE statements
-- COALESCE is allowed
UPDATE example SET value = COALESCE(null, null, timestamp '10-10-1000') WHERE key = 1;
-- COALESCE is not allowed if there are any mutable functions
UPDATE example SET value = COALESCE(now(), timestamp '10-10-1000') WHERE key = 1;
ERROR:  non-IMMUTABLE functions are not allowed in CASE or COALESCE statements
UPDATE example SET value = COALESCE(timestamp '10-10-1000', now()) WHERE key = 1;
ERROR:  non-IMMUTABLE functions are not allowed in CASE or COALESCE statements
-- RowCompareExpr's are checked for mutability. These are allowed:
ALTER TABLE example DROP value;
ALTER TABLE example ADD value boolean;
ALTER TABLE example ADD time_col timestamptz;
UPDATE example SET value = NULLIF(ROW(1, 2) < ROW(2, 3), true) WHERE key = 1;
UPDATE example SET value = NULLIF(ROW(true, 2) < ROW(value, 3), true) WHERE key = 1;
-- But this RowCompareExpr is not (it passes Var into STABLE)
UPDATE example SET value = NULLIF(
	ROW(date '10-10-1000', 2) < ROW(time_col, 3), true
) WHERE key = 1;
ERROR:  STABLE functions used in UPDATE queries cannot be called with column references
-- DistinctExpr's are also checked for mutability. These are allowed:
UPDATE example SET value = 1 IS DISTINCT FROM 2 WHERE key = 1;
UPDATE example SET value = date '10-10-1000' IS DISTINCT FROM timestamptz '10-10-1000' WHERE key = 1;
-- But this RowCompare references the STABLE = (date, timestamptz) operator
UPDATE example SET value = date '10-10-1000' IS DISTINCT FROM time_col WHERE key = 1;
ERROR:  STABLE functions used in UPDATE queries cannot be called with column references
-- this ScalarArrayOpExpr ("scalar op ANY/ALL (array)") is allowed
UPDATE example SET value = date '10-10-1000' = ANY ('{10-10-1000}'::date[]) WHERE key = 1;
-- this ScalarArrayOpExpr is not, it invokes the STABLE = (timestamptz, date) operator
UPDATE example SET value = time_col = ANY ('{10-10-1000}'::date[]) WHERE key = 1;
ERROR:  STABLE functions used in UPDATE queries cannot be called with column references
-- CoerceViaIO (typoutput -> typinput, a type coercion)
ALTER TABLE example DROP value;
ALTER TABLE example ADD value date;
-- this one is allowed
UPDATE example SET value = (timestamp '10-19-2000 13:29')::date WHERE key = 1;
-- this one is not
UPDATE example SET value = time_col::date WHERE key = 1;
ERROR:  STABLE functions used in UPDATE queries cannot be called with column references
-- ArrayCoerceExpr (applies elemfuncid to each elem)
ALTER TABLE example DROP value;
ALTER TABLE example ADD value date[];
-- this one is allowed
UPDATE example SET value = array[timestamptz '10-20-2013 10:20']::date[] WHERE key = 1;
-- this one is not
UPDATE example SET value = array[time_col]::date[] WHERE key = 1;
ERROR:  STABLE functions used in UPDATE queries cannot be called with column references
-- test that UPDATE and DELETE also have the functions in WHERE evaluated
ALTER TABLE example DROP time_col;
ALTER TABLE example DROP value;
ALTER TABLE example ADD value timestamptz;
INSERT INTO example VALUES (3, now());
UPDATE example SET value = timestamp '10-10-2000 00:00' WHERE key = 3 AND value > now() - interval '1 hour';
SELECT * FROM example WHERE key = 3;
 key |            value             
-----+------------------------------
   3 | Tue Oct 10 00:00:00 2000 PDT
(1 row)

DELETE FROM example WHERE key = 3 AND value < now() - interval '1 hour';
SELECT * FROM example WHERE key = 3;
 key | value 
-----+-------
(0 rows)

DROP TABLE example;
