ALTER SEQUENCE pg_catalog.pg_dist_shardid_seq RESTART 800000;
ALTER SEQUENCE pg_catalog.pg_dist_jobid_seq RESTART 800000;
-- ===================================================================
-- create test functions
-- ===================================================================
CREATE FUNCTION prune_using_no_values(regclass)
	RETURNS text[]
	AS 'citus'
	LANGUAGE C STRICT;
CREATE FUNCTION prune_using_single_value(regclass, text)
	RETURNS text[]
	AS 'citus'
	LANGUAGE C;
CREATE FUNCTION prune_using_either_value(regclass, text, text)
	RETURNS text[]
	AS 'citus'
	LANGUAGE C STRICT;
CREATE FUNCTION prune_using_both_values(regclass, text, text)
	RETURNS text[]
	AS 'citus'
	LANGUAGE C STRICT;
CREATE FUNCTION debug_equality_expression(regclass)
	RETURNS cstring
	AS 'citus'
	LANGUAGE C STRICT;
CREATE FUNCTION print_sorted_shard_intervals(regclass)
	RETURNS text[]
	AS 'citus'
	LANGUAGE C STRICT;
-- ===================================================================
-- test shard pruning functionality
-- ===================================================================
-- create distributed table observe shard pruning
CREATE TABLE pruning ( species text, last_pruned date, plant_id integer );
SELECT master_create_distributed_table('pruning', 'species', 'hash');
 master_create_distributed_table 
---------------------------------
 
(1 row)

-- create worker shards
SELECT master_create_worker_shards('pruning', 4, 1);
 master_create_worker_shards 
-----------------------------
 
(1 row)

-- with no values, expect all shards
SELECT prune_using_no_values('pruning');
     prune_using_no_values     
-------------------------------
 {800000,800001,800002,800003}
(1 row)

-- with a single value, expect a single shard
SELECT prune_using_single_value('pruning', 'tomato');
 prune_using_single_value 
--------------------------
 {800002}
(1 row)

-- the above is true even if that value is null
SELECT prune_using_single_value('pruning', NULL);
 prune_using_single_value 
--------------------------
 {800002}
(1 row)

-- build an OR clause and expect more than one sahrd
SELECT prune_using_either_value('pruning', 'tomato', 'petunia');
 prune_using_either_value 
--------------------------
 {800001,800002}
(1 row)

-- an AND clause with incompatible values returns no shards
SELECT prune_using_both_values('pruning', 'tomato', 'petunia');
 prune_using_both_values 
-------------------------
 {}
(1 row)

-- but if both values are on the same shard, should get back that shard
SELECT prune_using_both_values('pruning', 'tomato', 'rose');
 prune_using_both_values 
-------------------------
 {800002}
(1 row)

-- unit test of the equality expression generation code
SELECT debug_equality_expression('pruning');
                                                                                                                                                                           debug_equality_expression                                                                                                                                                                            
--------------------------------------------------------------------------------------------------------------------------------------------------------------------------------------------------------------------------------------------------------------------------------------------------------------------------------------------------------------------------------
 {OPEXPR :opno 98 :opfuncid 67 :opresulttype 16 :opretset false :opcollid 0 :inputcollid 100 :args ({VAR :varno 1 :varattno 1 :vartype 25 :vartypmod -1 :varcollid 100 :varlevelsup 0 :varnoold 1 :varoattno 1 :location -1} {CONST :consttype 25 :consttypmod -1 :constcollid 100 :constlen -1 :constbyval false :constisnull true :location -1 :constvalue <>}) :location -1}
(1 row)

-- print the initial ordering of shard intervals
SELECT print_sorted_shard_intervals('pruning');
 print_sorted_shard_intervals  
-------------------------------
 {800000,800001,800002,800003}
(1 row)

-- update only min value for one shard
UPDATE pg_dist_shard set shardminvalue = NULL, shardmaxvalue = NULL WHERE shardid = 103071;
SELECT print_sorted_shard_intervals('pruning');
 print_sorted_shard_intervals  
-------------------------------
 {800000,800001,800002,800003}
(1 row)

-- now lets have one more shard without min/max values
UPDATE pg_dist_shard set shardminvalue = NULL, shardmaxvalue = NULL WHERE shardid = 103072;
SELECT print_sorted_shard_intervals('pruning');
 print_sorted_shard_intervals  
-------------------------------
 {800000,800001,800002,800003}
(1 row)

-- now lets have one more shard without min/max values
UPDATE pg_dist_shard set shardminvalue = NULL, shardmaxvalue = NULL WHERE shardid = 103070;
SELECT print_sorted_shard_intervals('pruning');
 print_sorted_shard_intervals  
-------------------------------
 {800000,800001,800002,800003}
(1 row)

-- all shard placements are uninitialized
UPDATE pg_dist_shard set shardminvalue = NULL, shardmaxvalue = NULL WHERE shardid = 103073;
SELECT print_sorted_shard_intervals('pruning');
 print_sorted_shard_intervals  
-------------------------------
 {800000,800001,800002,800003}
(1 row)

-- create range distributed table observe shard pruning
CREATE TABLE pruning_range ( species text, last_pruned date, plant_id integer );
SELECT master_create_distributed_table('pruning_range', 'species', 'range');
 master_create_distributed_table 
---------------------------------
 
(1 row)

-- create worker shards
SELECT master_create_empty_shard('pruning_range');
 master_create_empty_shard 
---------------------------
                    800004
(1 row)

SELECT master_create_empty_shard('pruning_range');
 master_create_empty_shard 
---------------------------
                    800005
(1 row)

SELECT master_create_empty_shard('pruning_range');
 master_create_empty_shard 
---------------------------
                    800006
(1 row)

SELECT master_create_empty_shard('pruning_range');
 master_create_empty_shard 
---------------------------
                    800007
(1 row)

-- now the comparison is done via the partition column type, which is text
UPDATE pg_dist_shard SET shardminvalue = 'a', shardmaxvalue = 'b' WHERE shardid = 103074;
UPDATE pg_dist_shard SET shardminvalue = 'c', shardmaxvalue = 'd' WHERE shardid = 103075;
UPDATE pg_dist_shard SET shardminvalue = 'e', shardmaxvalue = 'f' WHERE shardid = 103076;
UPDATE pg_dist_shard SET shardminvalue = 'g', shardmaxvalue = 'h' WHERE shardid = 103077;
-- print the ordering of shard intervals with range partitioning as well
SELECT print_sorted_shard_intervals('pruning_range');
 print_sorted_shard_intervals  
-------------------------------
 {800004,800005,800006,800007}
(1 row)

-- update only min value for one shard
UPDATE pg_dist_shard set shardminvalue = NULL, shardmaxvalue = NULL WHERE shardid = 103075;
SELECT print_sorted_shard_intervals('pruning_range');
 print_sorted_shard_intervals  
-------------------------------
 {800004,800005,800006,800007}
(1 row)

-- now lets have one more shard without min/max values
UPDATE pg_dist_shard set shardminvalue = NULL, shardmaxvalue = NULL WHERE shardid = 103076;
SELECT print_sorted_shard_intervals('pruning_range');
 print_sorted_shard_intervals  
-------------------------------
 {800004,800005,800006,800007}
(1 row)

-- now lets have one more shard without min/max values
UPDATE pg_dist_shard set shardminvalue = NULL, shardmaxvalue = NULL WHERE shardid = 103074;
SELECT print_sorted_shard_intervals('pruning_range');
 print_sorted_shard_intervals  
-------------------------------
 {800004,800005,800006,800007}
(1 row)

-- all shard placements are uninitialized
UPDATE pg_dist_shard set shardminvalue = NULL, shardmaxvalue = NULL WHERE shardid = 103077;
SELECT print_sorted_shard_intervals('pruning_range');
 print_sorted_shard_intervals  
-------------------------------
 {800004,800005,800006,800007}
(1 row)

