SET client_min_messages TO WARNING;
SELECT 1 FROM citus_add_node('localhost', :master_port, groupid => 0);
 ?column?
---------------------------------------------------------------------
        1
(1 row)

SELECT 1 FROM master_set_node_property('localhost', :master_port, 'shouldhaveshards', true);
 ?column?
---------------------------------------------------------------------
        1
(1 row)

SET citus.next_shard_id TO 2090000;
SET citus.shard_count TO 32;
SET citus.shard_replication_factor TO 1;
SET client_min_messages TO WARNING;
CREATE SCHEMA regular_schema;
CREATE FUNCTION create_citus_local_with_data(table_name text)
RETURNS void
LANGUAGE plpgsql
AS $func$
BEGIN
    EXECUTE format('
        CREATE TABLE regular_schema.%I (
            col_1 text,
            col_2 int,
            col_3 bigint GENERATED BY DEFAULT AS IDENTITY (START WITH 1000 INCREMENT BY 1000),
            col_4 timestamp,
            col_5 int,
            col_6 bigint GENERATED ALWAYS as (col_5 * 7) stored,
            col_7 numeric,
            col_8 text GENERATED ALWAYS as (col_1 || ''_dummy'') stored,
            col_9 bigint GENERATED ALWAYS AS IDENTITY (START WITH 100 INCREMENT BY 100)
        );', table_name);

    EXECUTE format('
        INSERT INTO regular_schema.%I (col_1, col_2, col_4, col_5, col_7)
        SELECT
            i::text, -- col_1
            i + 42, -- col_2
            ''2026-01-01 00:00:00''::timestamp + (i || '' seconds'')::interval, -- col_4
            i * 3, -- col_5
            (i * 1.5)::numeric -- col_7
        FROM generate_series(1, 1000) AS i;', table_name);

    EXECUTE format('
        INSERT INTO regular_schema.%I (col_1, col_2, col_3, col_4, col_5, col_7)
        OVERRIDING SYSTEM VALUE
        SELECT
            i::text, -- col_1
            i + 42, -- col_2
            1000 + i, -- col_3
            ''2026-01-01 00:00:00''::timestamp + (i || '' seconds'')::interval, -- col_4
            i * 3, -- col_5
            (i * 1.5)::numeric -- col_7
        FROM generate_series(1001, 2000) AS i;', table_name);

    EXECUTE format('
        SELECT citus_add_local_table_to_metadata(''regular_schema.%I'');', table_name);

    EXECUTE format('
        ALTER TABLE regular_schema.%I DROP COLUMN col_2;', table_name);

    EXECUTE format('
        ALTER TABLE regular_schema.%I DROP COLUMN col_7;', table_name);

    EXECUTE format('
            ALTER TABLE regular_schema.%I ADD COLUMN col_10 bigint DEFAULT -197;', table_name);
END;
$func$;
SELECT create_citus_local_with_data('citus_local_1');
 create_citus_local_with_data
---------------------------------------------------------------------

(1 row)

SELECT create_citus_local_with_data('citus_local_2');
 create_citus_local_with_data
---------------------------------------------------------------------

(1 row)

SELECT create_citus_local_with_data('citus_local_3');
 create_citus_local_with_data
---------------------------------------------------------------------

(1 row)

SELECT create_citus_local_with_data('citus_local_4');
 create_citus_local_with_data
---------------------------------------------------------------------

(1 row)

SELECT create_citus_local_with_data('citus_local_5');
 create_citus_local_with_data
---------------------------------------------------------------------

(1 row)

SELECT create_citus_local_with_data('citus_local_6');
 create_citus_local_with_data
---------------------------------------------------------------------

(1 row)

SELECT * INTO regular_schema.old_data_coordinator FROM regular_schema.citus_local_4;
SET citus.enable_schema_based_sharding TO ON;
CREATE SCHEMA tenant_4;
CREATE SCHEMA tenant_5;
CREATE SCHEMA tenant_6;
SET citus.enable_schema_based_sharding TO OFF;
-- Verify data consistency after moving to a distributed schema.
--
-- Repeat this for three different schemas to test copying data
-- i) to shards on different workers and ii) to a shard on the
-- coordinator, i.e., this node.
--
-- First, test this within a transaction block (and rollback) and then
-- outside of a transaction block.
BEGIN;
    ALTER TABLE regular_schema.citus_local_4 SET SCHEMA tenant_4;
    SELECT COUNT(*) = 0 FROM (
        (TABLE tenant_4.citus_local_4) EXCEPT (TABLE regular_schema.old_data_coordinator)
        UNION
        (TABLE regular_schema.old_data_coordinator EXCEPT TABLE tenant_4.citus_local_4)
    );
 ?column?
---------------------------------------------------------------------
 t
(1 row)

ROLLBACK;
ALTER TABLE regular_schema.citus_local_4 SET SCHEMA tenant_4;
SELECT COUNT(*) = 0 FROM (
    (TABLE tenant_4.citus_local_4) EXCEPT (TABLE regular_schema.old_data_coordinator)
    UNION
    (TABLE regular_schema.old_data_coordinator EXCEPT TABLE tenant_4.citus_local_4)
);
 ?column?
---------------------------------------------------------------------
 t
(1 row)

BEGIN;
    ALTER TABLE regular_schema.citus_local_5 SET SCHEMA tenant_5;
    SELECT COUNT(*) = 0 FROM (
        (TABLE tenant_5.citus_local_5) EXCEPT (TABLE regular_schema.old_data_coordinator)
        UNION
        (TABLE regular_schema.old_data_coordinator EXCEPT TABLE tenant_5.citus_local_5)
    );
 ?column?
---------------------------------------------------------------------
 t
(1 row)

ROLLBACK;
ALTER TABLE regular_schema.citus_local_5 SET SCHEMA tenant_5;
SELECT COUNT(*) = 0 FROM (
    (TABLE tenant_5.citus_local_5) EXCEPT (TABLE regular_schema.old_data_coordinator)
    UNION
    (TABLE regular_schema.old_data_coordinator EXCEPT TABLE tenant_5.citus_local_5)
);
 ?column?
---------------------------------------------------------------------
 t
(1 row)

BEGIN;
    ALTER TABLE regular_schema.citus_local_6 SET SCHEMA tenant_6;
    SELECT COUNT(*) = 0 FROM (
        (TABLE tenant_6.citus_local_6) EXCEPT (TABLE regular_schema.old_data_coordinator)
        UNION
        (TABLE regular_schema.old_data_coordinator EXCEPT TABLE tenant_6.citus_local_6)
    );
 ?column?
---------------------------------------------------------------------
 t
(1 row)

ROLLBACK;
ALTER TABLE regular_schema.citus_local_6 SET SCHEMA tenant_6;
SELECT COUNT(*) = 0 FROM (
    (TABLE tenant_6.citus_local_6) EXCEPT (TABLE regular_schema.old_data_coordinator)
    UNION
    (TABLE regular_schema.old_data_coordinator EXCEPT TABLE tenant_6.citus_local_6)
);
 ?column?
---------------------------------------------------------------------
 t
(1 row)

CREATE TABLE regular_schema.reference_table (id bigint PRIMARY KEY);
SELECT create_reference_table('regular_schema.reference_table');
 create_reference_table
---------------------------------------------------------------------

(1 row)

\c - - - :worker_1_port
-- When creating a tenant table from workers, we always fetch the next shard id
-- and placement id from the coordinator because we never sync those sequences to
-- workers. For this reason, along this test file, we always set the next shard id
-- on the coordinator when needed, rather than setting it on the current worker node.
-- At the end of the test file, we reset it back fwiw.
SELECT 1 FROM run_command_on_coordinator($$ALTER SYSTEM SET citus.next_shard_id TO 2091000;$$);
 ?column?
---------------------------------------------------------------------
        1
(1 row)

SELECT 1 FROM run_command_on_coordinator($$SELECT pg_reload_conf();$$);
 ?column?
---------------------------------------------------------------------
        1
(1 row)

SELECT pg_sleep(0.1); -- make sure that the GUC change is applied
 pg_sleep
---------------------------------------------------------------------

(1 row)

SET citus.shard_count TO 32;
SET citus.shard_replication_factor TO 1;
SET client_min_messages TO WARNING;
SELECT * INTO regular_schema.old_data_worker FROM regular_schema.citus_local_1;
SET citus.enable_schema_based_sharding TO ON;
CREATE SCHEMA tenant_1;
CREATE SCHEMA tenant_2;
CREATE SCHEMA tenant_3;
-- Verify data consistency after moving to a distributed schema.
--
-- Repeat this for three different schemas to test copying data
-- i) to a shard on this worker, ii) to a shard on another worker, and
-- iii) to a shard on the coordinator.
--
-- First, test this within a transaction block (and rollback) and then
-- outside of a transaction block.
BEGIN;
    ALTER TABLE regular_schema.citus_local_1 SET SCHEMA tenant_1;
    SELECT COUNT(*) = 0 FROM (
        (TABLE tenant_1.citus_local_1) EXCEPT (TABLE regular_schema.old_data_worker)
        UNION
        (TABLE regular_schema.old_data_worker EXCEPT TABLE tenant_1.citus_local_1)
    );
 ?column?
---------------------------------------------------------------------
 t
(1 row)

ROLLBACK;
ALTER TABLE regular_schema.citus_local_1 SET SCHEMA tenant_1;
SELECT COUNT(*) = 0 FROM (
    (TABLE tenant_1.citus_local_1) EXCEPT (TABLE regular_schema.old_data_worker)
    UNION
    (TABLE regular_schema.old_data_worker EXCEPT TABLE tenant_1.citus_local_1)
);
 ?column?
---------------------------------------------------------------------
 t
(1 row)

BEGIN;
    ALTER TABLE regular_schema.citus_local_2 SET SCHEMA tenant_2;
    SELECT COUNT(*) = 0 FROM (
        (TABLE tenant_2.citus_local_2) EXCEPT (TABLE regular_schema.old_data_worker)
        UNION
        (TABLE regular_schema.old_data_worker EXCEPT TABLE tenant_2.citus_local_2)
    );
 ?column?
---------------------------------------------------------------------
 t
(1 row)

ROLLBACK;
ALTER TABLE regular_schema.citus_local_2 SET SCHEMA tenant_2;
SELECT COUNT(*) = 0 FROM (
    (TABLE tenant_2.citus_local_2) EXCEPT (TABLE regular_schema.old_data_worker)
    UNION
    (TABLE regular_schema.old_data_worker EXCEPT TABLE tenant_2.citus_local_2)
);
 ?column?
---------------------------------------------------------------------
 t
(1 row)

BEGIN;
    ALTER TABLE regular_schema.citus_local_3 SET SCHEMA tenant_3;
    SELECT COUNT(*) = 0 FROM (
        (TABLE tenant_3.citus_local_3) EXCEPT (TABLE regular_schema.old_data_worker)
        UNION
        (TABLE regular_schema.old_data_worker EXCEPT TABLE tenant_3.citus_local_3)
    );
 ?column?
---------------------------------------------------------------------
 t
(1 row)

ROLLBACK;
ALTER TABLE regular_schema.citus_local_3 SET SCHEMA tenant_3;
SELECT COUNT(*) = 0 FROM (
    (TABLE tenant_3.citus_local_3) EXCEPT (TABLE regular_schema.old_data_worker)
    UNION
    (TABLE regular_schema.old_data_worker EXCEPT TABLE tenant_3.citus_local_3)
);
 ?column?
---------------------------------------------------------------------
 t
(1 row)

CREATE TABLE regular_schema.local_table_1 (
    col_1 int,
    col_2 text,
    col_3 text GENERATED ALWAYS AS (col_1::text || '_gen') stored,
    col_4 bigint DEFAULT 42,
    col_5 bigint GENERATED BY DEFAULT AS IDENTITY (START WITH 1 INCREMENT BY 1),
    col_6 int GENERATED ALWAYS as (col_1 * 2) stored
);
INSERT INTO regular_schema.local_table_1 (col_1, col_2, col_4, col_5)
OVERRIDING SYSTEM VALUE
SELECT
    i, -- col_1
    'text_' || i, -- col_2
    i * 10, -- col_4
    100 + i -- col_5
FROM generate_series(1, 1000) AS i;
ALTER TABLE regular_schema.local_table_1 DROP COLUMN col_2;
ALTER TABLE regular_schema.local_table_1 DROP COLUMN col_5;
SELECT * INTO regular_schema.old_local_table_1 FROM regular_schema.local_table_1;
CREATE SCHEMA tenant_7;
-- test the same using a local table on this worker node
BEGIN;
    ALTER TABLE regular_schema.local_table_1 SET SCHEMA tenant_7;
    SELECT COUNT(*) = 0 FROM (
        (TABLE tenant_7.local_table_1) EXCEPT (TABLE regular_schema.old_local_table_1)
        UNION
        (TABLE regular_schema.old_local_table_1 EXCEPT TABLE tenant_7.local_table_1)
    );
 ?column?
---------------------------------------------------------------------
 t
(1 row)

ROLLBACK;
ALTER TABLE regular_schema.local_table_1 SET SCHEMA tenant_7;
SELECT COUNT(*) = 0 FROM (
    (TABLE tenant_7.local_table_1) EXCEPT (TABLE regular_schema.old_local_table_1)
    UNION
    (TABLE regular_schema.old_local_table_1 EXCEPT TABLE tenant_7.local_table_1)
);
 ?column?
---------------------------------------------------------------------
 t
(1 row)

SELECT pg_catalog.pg_table_size('tenant_7.local_table_1'::regclass) > 8192 as shell_table_has_data;
 shell_table_has_data
---------------------------------------------------------------------
 t
(1 row)

SELECT COUNT(*)=1000 FROM tenant_7.local_table_1;
 ?column?
---------------------------------------------------------------------
 t
(1 row)

SELECT truncate_local_data_after_distributing_table('tenant_7.local_table_1');
 truncate_local_data_after_distributing_table
---------------------------------------------------------------------

(1 row)

SELECT pg_catalog.pg_table_size('tenant_7.local_table_1'::regclass) = 8192 as shell_table_doesnt_have_data;
 shell_table_doesnt_have_data
---------------------------------------------------------------------
 t
(1 row)

SELECT COUNT(*)=1000 FROM tenant_7.local_table_1;
 ?column?
---------------------------------------------------------------------
 t
(1 row)

CREATE SCHEMA tenant_8;
CREATE SEQUENCE dist_seq;
CREATE TABLE tenant_8.table_1(a bigint DEFAULT nextval('dist_seq') UNIQUE, "b" text, c bigint GENERATED BY DEFAULT AS IDENTITY);
INSERT INTO tenant_8.table_1("b") VALUES ('test');
-- add column
ALTER TABLE tenant_8.table_1 ADD COLUMN d bigint DEFAULT 2;
SELECT * FROM tenant_8.table_1 ORDER BY c;
 a |  b   | c | d
---------------------------------------------------------------------
 1 | test | 1 | 2
(1 row)

-- alter default, set to 3
ALTER TABLE tenant_8.table_1 ALTER COLUMN d SET DEFAULT 3;
INSERT INTO tenant_8.table_1("b") VALUES ('test');
SELECT * FROM tenant_8.table_1 ORDER BY c;
 a |  b   | c | d
---------------------------------------------------------------------
 1 | test | 1 | 2
 2 | test | 2 | 3
(2 rows)

-- drop default, see null
ALTER TABLE tenant_8.table_1 ALTER COLUMN d DROP DEFAULT;
INSERT INTO tenant_8.table_1("b") VALUES ('test');
SELECT * FROM tenant_8.table_1 ORDER BY c;
 a |  b   | c | d
---------------------------------------------------------------------
 1 | test | 1 | 2
 2 | test | 2 | 3
 3 | test | 3 |
(3 rows)

-- cleanup the rows that were added to test the default behavior
DELETE FROM tenant_8.table_1 WHERE "b" = 'test' AND a > 1;
-- alter column type
ALTER TABLE tenant_8.table_1 ALTER COLUMN d TYPE text;
UPDATE tenant_8.table_1 SET d = 'this is a text' WHERE d = '2';
SELECT * FROM tenant_8.table_1 ORDER BY c;
 a |  b   | c |       d
---------------------------------------------------------------------
 1 | test | 1 | this is a text
(1 row)

-- drop seq column
ALTER TABLE tenant_8.table_1 DROP COLUMN a;
SELECT * FROM tenant_8.table_1 ORDER BY c;
  b   | c |       d
---------------------------------------------------------------------
 test | 1 | this is a text
(1 row)

-- add not null constraint
ALTER TABLE tenant_8.table_1 ALTER COLUMN b SET NOT NULL;
-- we want to hide the error message context because the node reporting the foreign key
-- violation might change from one run to another.
\set VERBOSITY terse
-- not null constraint violation, error out
INSERT INTO tenant_8.table_1 VALUES (NULL, 2, 'test');
ERROR:  null value in column "b" violates not-null constraint
\set VERBOSITY default
-- drop not null constraint and try again
ALTER TABLE tenant_8.table_1 ALTER COLUMN b DROP NOT NULL;
INSERT INTO tenant_8.table_1 VALUES (NULL, 3, 'test');
SELECT * FROM tenant_8.table_1 ORDER BY c;
  b   | c |       d
---------------------------------------------------------------------
 test | 1 | this is a text
      | 3 | test
(2 rows)

-- add exclusion constraint
ALTER TABLE tenant_8.table_1 ADD CONSTRAINT exc_b EXCLUDE USING btree (b with =);
-- rename the exclusion constraint, errors out
ALTER TABLE tenant_8.table_1 RENAME CONSTRAINT exc_b TO exc_b_1;
ERROR:  renaming constraints belonging to distributed tables is currently unsupported
-- create exclusion constraint without a name
ALTER TABLE tenant_8.table_1 ADD EXCLUDE USING btree (b with =);
INSERT INTO tenant_8.table_1 VALUES (100, 150, 'test150');
-- similarly, we want to hide the error message context here as well
\set VERBOSITY terse
-- should error out due to exclusion constraint violation
INSERT INTO tenant_8.table_1 VALUES (100, 151, 'test151');
ERROR:  conflicting key value violates exclusion constraint "exc_b_2091002"
\set VERBOSITY default
-- test setting autovacuum option
ALTER TABLE tenant_8.table_1 SET (autovacuum_enabled = false);
-- test multiple subcommands
ALTER TABLE tenant_8.table_1 ADD COLUMN int_column1 INTEGER, DROP COLUMN d, ADD COLUMN e int;
UPDATE tenant_8.table_1 SET e = c * 10;
-- test unique constraint without a name
ALTER TABLE tenant_8.table_1 ADD UNIQUE ("b");
-- test add / drop primary key
ALTER TABLE tenant_8.table_1 ADD PRIMARY KEY (c);
ALTER TABLE tenant_8.table_1 DROP CONSTRAINT table_1_pkey;
ALTER TABLE tenant_8.table_1 ADD PRIMARY KEY (e);
SELECT * FROM tenant_8.table_1 ORDER BY c;
  b   |  c  | int_column1 |  e
---------------------------------------------------------------------
 test |   1 |             |   10
      |   3 |             |   30
 100  | 150 |             | 1500
(3 rows)

-- test renaming table
ALTER TABLE tenant_8.table_1 RENAME TO table_2;
-- test renaming column
ALTER TABLE tenant_8.table_2 RENAME COLUMN e TO f;
-- test renaming an index
ALTER INDEX tenant_8.table_1_pkey RENAME TO table_1_pkey_renamed;
-- make sure that the shell table definition is same on all nodes
-- TODOTASK: check if sequence ranges make sense
SELECT result FROM run_command_on_all_nodes(
$$
SELECT string_agg(ddl_events, '; ') FROM master_get_table_ddl_events('tenant_8.table_2') AS ddl_events;
$$
) JOIN pg_dist_node USING (nodeid) ORDER BY nodeport;
                                                                                                                                                                                                                                                                                                                                         result
---------------------------------------------------------------------
 CREATE TABLE tenant_8.table_2 (b text, c bigint GENERATED BY DEFAULT AS IDENTITY (INCREMENT BY 1 MINVALUE 1 MAXVALUE 281474976710657 START WITH 1 CACHE 1 NO CYCLE) NOT NULL, int_column1 integer, f integer NOT NULL) USING heap WITH (autovacuum_enabled='false'); ALTER TABLE tenant_8.table_2 OWNER TO postgres; ALTER TABLE tenant_8.table_2 ADD CONSTRAINT exc_b EXCLUDE USING btree (b WITH =); ALTER TABLE tenant_8.table_2 ADD CONSTRAINT table_1_b_excl EXCLUDE USING btree (b WITH =); ALTER TABLE tenant_8.table_2 ADD CONSTRAINT table_1_b_key UNIQUE (b); ALTER TABLE tenant_8.table_2 ADD CONSTRAINT table_1_pkey_renamed PRIMARY KEY (f)
 CREATE TABLE tenant_8.table_2 (b text, c bigint GENERATED BY DEFAULT AS IDENTITY (INCREMENT BY 1 MINVALUE 1 MAXVALUE 9223372036854775807 START WITH 1 CACHE 1 NO CYCLE) NOT NULL, int_column1 integer, f integer NOT NULL) USING heap WITH (autovacuum_enabled='false'); ALTER TABLE tenant_8.table_2 OWNER TO postgres; ALTER TABLE tenant_8.table_2 ADD CONSTRAINT exc_b EXCLUDE USING btree (b WITH =); ALTER TABLE tenant_8.table_2 ADD CONSTRAINT table_1_b_excl EXCLUDE USING btree (b WITH =); ALTER TABLE tenant_8.table_2 ADD CONSTRAINT table_1_b_key UNIQUE (b); ALTER TABLE tenant_8.table_2 ADD CONSTRAINT table_1_pkey_renamed PRIMARY KEY (f)
 CREATE TABLE tenant_8.table_2 (b text, c bigint GENERATED BY DEFAULT AS IDENTITY (INCREMENT BY 1 MINVALUE 4503599627370497 MAXVALUE 4785074604081153 START WITH 4503599627370497 CACHE 1 NO CYCLE) NOT NULL, int_column1 integer, f integer NOT NULL) USING heap WITH (autovacuum_enabled='false'); ALTER TABLE tenant_8.table_2 OWNER TO postgres; ALTER TABLE tenant_8.table_2 ADD CONSTRAINT exc_b EXCLUDE USING btree (b WITH =); ALTER TABLE tenant_8.table_2 ADD CONSTRAINT table_1_b_excl EXCLUDE USING btree (b WITH =); ALTER TABLE tenant_8.table_2 ADD CONSTRAINT table_1_b_key UNIQUE (b); ALTER TABLE tenant_8.table_2 ADD CONSTRAINT table_1_pkey_renamed PRIMARY KEY (f)
(3 rows)

CREATE SCHEMA alter_table_add_column;
\c - - - :master_port
CREATE SCHEMA alter_table_add_column_other_schema;
CREATE OR REPLACE FUNCTION alter_table_add_column_other_schema.my_random(numeric)
  RETURNS numeric AS
$$
BEGIN
  RETURN 7 * $1;
END;
$$
LANGUAGE plpgsql IMMUTABLE;
SET search_path TO alter_table_add_column;
CREATE COLLATION caseinsensitive (
	provider = icu,
	locale = 'und-u-ks-level2'
);
CREATE TYPE "simple_!\'custom_type" AS (a integer, b integer);
\c - - - :worker_1_port
SELECT 1 FROM run_command_on_coordinator($$ALTER SYSTEM SET citus.next_shard_id TO 2092000;$$);
 ?column?
---------------------------------------------------------------------
        1
(1 row)

SELECT 1 FROM run_command_on_coordinator($$SELECT pg_reload_conf();$$);
 ?column?
---------------------------------------------------------------------
        1
(1 row)

SELECT pg_sleep(0.1);
 pg_sleep
---------------------------------------------------------------------

(1 row)

SET citus.shard_replication_factor TO 1;
SET search_path TO alter_table_add_column;
SET citus.enable_schema_based_sharding TO ON;
SET client_min_messages TO NOTICE;
CREATE TABLE referenced (int_col integer PRIMARY KEY);
CREATE TABLE referencing (text_col text);
-- test alter table add column with various subcommands and options
ALTER TABLE referencing ADD COLUMN test_1 integer DEFAULT (alter_table_add_column_other_schema.my_random(7) + random() + 5) NOT NULL CONSTRAINT fkey REFERENCES referenced(int_col) ON UPDATE SET DEFAULT ON DELETE CASCADE DEFERRABLE INITIALLY DEFERRED;
ALTER TABLE referencing ADD COLUMN test_2 integer UNIQUE REFERENCES referenced(int_col) ON UPDATE CASCADE ON DELETE SET DEFAULT NOT DEFERRABLE INITIALLY IMMEDIATE;
ALTER TABLE referencing ADD COLUMN test_3 integer GENERATED ALWAYS AS (test_1 * alter_table_add_column_other_schema.my_random(1)) STORED UNIQUE REFERENCES referenced(int_col) MATCH FULL;
ALTER TABLE referencing ADD COLUMN test_4 integer PRIMARY KEY WITH (fillfactor=70) NOT NULL REFERENCES referenced(int_col) MATCH SIMPLE ON UPDATE CASCADE ON DELETE SET DEFAULT;
ALTER TABLE referencing ADD COLUMN test_5 integer CONSTRAINT unique_c UNIQUE WITH (fillfactor=50) NULL;
ALTER TABLE referencing ADD COLUMN test_6 text COMPRESSION pglz COLLATE caseinsensitive NOT NULL;
ALTER TABLE referencing ADD COLUMN "test_\'!7" "simple_!\'custom_type";
-- we give up deparsing ALTER TABLE command if it needs to create a check constraint, and we fallback to legacy behavior
ALTER TABLE referencing ADD COLUMN test_8 integer CHECK (test_8 > 0);
ERROR:  cannot execute ADD COLUMN command with PRIMARY KEY, UNIQUE, FOREIGN and CHECK constraints
DETAIL:  Adding a column with a constraint in one command is not supported because all constraints in Citus must have explicit names
HINT:  You can issue each command separately such as ALTER TABLE referencing ADD COLUMN test_8 data_type; ALTER TABLE referencing ADD CONSTRAINT constraint_name CHECK (check_expression);
ALTER TABLE referencing ADD COLUMN test_8 integer CONSTRAINT check_test_8 CHECK (test_8 > 0);
-- error out properly even if the REFERENCES does not include the column list of the referenced table
ALTER TABLE referencing ADD COLUMN test_9 bool, ADD COLUMN test_10 int REFERENCES referenced;
ERROR:  cannot execute ADD COLUMN command with PRIMARY KEY, UNIQUE, FOREIGN and CHECK constraints
DETAIL:  Adding a column with a constraint in one command is not supported because all constraints in Citus must have explicit names
HINT:  You can issue each command separately such as ALTER TABLE referencing ADD COLUMN test_10 data_type; ALTER TABLE referencing ADD CONSTRAINT constraint_name FOREIGN KEY (test_10) REFERENCES referenced;
ALTER TABLE referencing ADD COLUMN test_9 bool, ADD COLUMN test_10 int REFERENCES referenced(int_col);
ERROR:  cannot execute ADD COLUMN command with PRIMARY KEY, UNIQUE, FOREIGN and CHECK constraints
DETAIL:  Adding a column with a constraint in one command is not supported because all constraints in Citus must have explicit names
HINT:  You can issue each command separately such as ALTER TABLE referencing ADD COLUMN test_10 data_type; ALTER TABLE referencing ADD CONSTRAINT constraint_name FOREIGN KEY (test_10) REFERENCES referenced (int_col );
-- supress notice messages because we want to ignore the notice about skipping adding test_6
-- on the shard, if the shard is local
SET client_min_messages TO WARNING;
-- try to add test_6 again, but with IF NOT EXISTS
ALTER TABLE referencing ADD COLUMN IF NOT EXISTS test_6 text;
ALTER TABLE referencing ADD COLUMN IF NOT EXISTS test_6 integer;
SET client_min_messages TO NOTICE;
SELECT result FROM run_command_on_all_nodes(
  $$SELECT get_grouped_fkey_constraints FROM get_grouped_fkey_constraints('alter_table_add_column.referencing')$$
)
JOIN pg_dist_node USING (nodeid)
ORDER BY result;
                                                                                                                                                                                                                                                                                                                                                                                                                                                                                                                                                                                                                                                                                                                                                                                                                                                                                                                                                                                                                          result
---------------------------------------------------------------------
 [{"deferred": true, "deferable": true, "on_delete": "c", "on_update": "d", "match_type": "s", "constraint_names": ["fkey", "fkey_xxxxxxx"], "referenced_tables": ["alter_table_add_column.referenced", "alter_table_add_column.referenced_2092000"], "referenced_columns": ["int_col"], "referencing_tables": ["alter_table_add_column.referencing", "alter_table_add_column.referencing_2092001"], "referencing_columns": ["test_1"], "referencing_columns_set_null_or_default": null}, {"deferred": false, "deferable": false, "on_delete": "d", "on_update": "c", "match_type": "s", "constraint_names": ["referencing__fkey", "referencing__fkey_2092001"], "referenced_tables": ["alter_table_add_column.referenced", "alter_table_add_column.referenced_2092000"], "referenced_columns": ["int_col"], "referencing_tables": ["alter_table_add_column.referencing", "alter_table_add_column.referencing_2092001"], "referencing_columns": ["test_2"], "referencing_columns_set_null_or_default": null}, {"deferred": false, "deferable": false, "on_delete": "a", "on_update": "a", "match_type": "f", "constraint_names": ["referencing__fkey1", "referencing__fkey1_2092001"], "referenced_tables": ["alter_table_add_column.referenced", "alter_table_add_column.referenced_2092000"], "referenced_columns": ["int_col"], "referencing_tables": ["alter_table_add_column.referencing", "alter_table_add_column.referencing_2092001"], "referencing_columns": ["test_3"], "referencing_columns_set_null_or_default": null}, {"deferred": false, "deferable": false, "on_delete": "d", "on_update": "c", "match_type": "s", "constraint_names": ["referencing__fkey2", "referencing__fkey2_2092001"], "referenced_tables": ["alter_table_add_column.referenced", "alter_table_add_column.referenced_2092000"], "referenced_columns": ["int_col"], "referencing_tables": ["alter_table_add_column.referencing", "alter_table_add_column.referencing_2092001"], "referencing_columns": ["test_4"], "referencing_columns_set_null_or_default": null}]
 [{"deferred": true, "deferable": true, "on_delete": "c", "on_update": "d", "match_type": "s", "constraint_names": ["fkey"], "referenced_tables": ["alter_table_add_column.referenced"], "referenced_columns": ["int_col"], "referencing_tables": ["alter_table_add_column.referencing"], "referencing_columns": ["test_1"], "referencing_columns_set_null_or_default": null}, {"deferred": false, "deferable": false, "on_delete": "d", "on_update": "c", "match_type": "s", "constraint_names": ["referencing__fkey"], "referenced_tables": ["alter_table_add_column.referenced"], "referenced_columns": ["int_col"], "referencing_tables": ["alter_table_add_column.referencing"], "referencing_columns": ["test_2"], "referencing_columns_set_null_or_default": null}, {"deferred": false, "deferable": false, "on_delete": "a", "on_update": "a", "match_type": "f", "constraint_names": ["referencing__fkey1"], "referenced_tables": ["alter_table_add_column.referenced"], "referenced_columns": ["int_col"], "referencing_tables": ["alter_table_add_column.referencing"], "referencing_columns": ["test_3"], "referencing_columns_set_null_or_default": null}, {"deferred": false, "deferable": false, "on_delete": "d", "on_update": "c", "match_type": "s", "constraint_names": ["referencing__fkey2"], "referenced_tables": ["alter_table_add_column.referenced"], "referenced_columns": ["int_col"], "referencing_tables": ["alter_table_add_column.referencing"], "referencing_columns": ["test_4"], "referencing_columns_set_null_or_default": null}]
 [{"deferred": true, "deferable": true, "on_delete": "c", "on_update": "d", "match_type": "s", "constraint_names": ["fkey"], "referenced_tables": ["alter_table_add_column.referenced"], "referenced_columns": ["int_col"], "referencing_tables": ["alter_table_add_column.referencing"], "referencing_columns": ["test_1"], "referencing_columns_set_null_or_default": null}, {"deferred": false, "deferable": false, "on_delete": "d", "on_update": "c", "match_type": "s", "constraint_names": ["referencing__fkey"], "referenced_tables": ["alter_table_add_column.referenced"], "referenced_columns": ["int_col"], "referencing_tables": ["alter_table_add_column.referencing"], "referencing_columns": ["test_2"], "referencing_columns_set_null_or_default": null}, {"deferred": false, "deferable": false, "on_delete": "a", "on_update": "a", "match_type": "f", "constraint_names": ["referencing__fkey1"], "referenced_tables": ["alter_table_add_column.referenced"], "referenced_columns": ["int_col"], "referencing_tables": ["alter_table_add_column.referencing"], "referencing_columns": ["test_3"], "referencing_columns_set_null_or_default": null}, {"deferred": false, "deferable": false, "on_delete": "d", "on_update": "c", "match_type": "s", "constraint_names": ["referencing__fkey2"], "referenced_tables": ["alter_table_add_column.referenced"], "referenced_columns": ["int_col"], "referencing_tables": ["alter_table_add_column.referencing"], "referencing_columns": ["test_4"], "referencing_columns_set_null_or_default": null}]
(3 rows)

SELECT result FROM run_command_on_all_nodes(
  $$SELECT get_index_defs FROM get_index_defs('alter_table_add_column', 'referencing')$$
)
JOIN pg_dist_node USING (nodeid)
ORDER BY result;
                                                                                                                                                                                                                                                                                                                                                                                                                                                                                                                                                                                                                                            result
---------------------------------------------------------------------
 [{"indexdefs": ["CREATE UNIQUE INDEX referencing__key ON alter_table_add_column.referencing USING btree (test_2)", "CREATE UNIQUE INDEX referencing__key_2092001 ON alter_table_add_column.referencing_2092001 USING btree (test_2)"], "indexnames": ["referencing__key", "referencing__key_2092001"]}, {"indexdefs": ["CREATE UNIQUE INDEX referencing__key1 ON alter_table_add_column.referencing USING btree (test_3)", "CREATE UNIQUE INDEX referencing__key1_2092001 ON alter_table_add_column.referencing_2092001 USING btree (test_3)"], "indexnames": ["referencing__key1", "referencing__key1_2092001"]}, {"indexdefs": ["CREATE UNIQUE INDEX referencing_pkey ON alter_table_add_column.referencing USING btree (test_4) WITH (fillfactor='70')", "CREATE UNIQUE INDEX referencing_pkey_2092001 ON alter_table_add_column.referencing_2092001 USING btree (test_4) WITH (fillfactor='70')"], "indexnames": ["referencing_pkey", "referencing_pkey_2092001"]}, {"indexdefs": ["CREATE UNIQUE INDEX unique_c ON alter_table_add_column.referencing USING btree (test_5) WITH (fillfactor='50')", "CREATE UNIQUE INDEX unique_c_2092001 ON alter_table_add_column.referencing_2092001 USING btree (test_5) WITH (fillfactor='50')"], "indexnames": ["unique_c", "unique_c_2092001"]}]
 [{"indexdefs": ["CREATE UNIQUE INDEX referencing__key ON alter_table_add_column.referencing USING btree (test_2)"], "indexnames": ["referencing__key"]}, {"indexdefs": ["CREATE UNIQUE INDEX referencing__key1 ON alter_table_add_column.referencing USING btree (test_3)"], "indexnames": ["referencing__key1"]}, {"indexdefs": ["CREATE UNIQUE INDEX referencing_pkey ON alter_table_add_column.referencing USING btree (test_4) WITH (fillfactor='70')"], "indexnames": ["referencing_pkey"]}, {"indexdefs": ["CREATE UNIQUE INDEX unique_c ON alter_table_add_column.referencing USING btree (test_5) WITH (fillfactor='50')"], "indexnames": ["unique_c"]}]
 [{"indexdefs": ["CREATE UNIQUE INDEX referencing__key ON alter_table_add_column.referencing USING btree (test_2)"], "indexnames": ["referencing__key"]}, {"indexdefs": ["CREATE UNIQUE INDEX referencing__key1 ON alter_table_add_column.referencing USING btree (test_3)"], "indexnames": ["referencing__key1"]}, {"indexdefs": ["CREATE UNIQUE INDEX referencing_pkey ON alter_table_add_column.referencing USING btree (test_4) WITH (fillfactor='70')"], "indexnames": ["referencing_pkey"]}, {"indexdefs": ["CREATE UNIQUE INDEX unique_c ON alter_table_add_column.referencing USING btree (test_5) WITH (fillfactor='50')"], "indexnames": ["unique_c"]}]
(3 rows)

SELECT result FROM run_command_on_all_nodes(
  $$SELECT get_column_defaults FROM get_column_defaults('alter_table_add_column', 'referencing')$$
)
JOIN pg_dist_node USING (nodeid)
ORDER BY result;
                                                                                                                                                                                 result
---------------------------------------------------------------------
 [{"column_name": "test_1", "column_default": "(((alter_table_add_column_other_schema.my_random((7)::numeric))::double precision + random()) + (5)::double precision)", "generation_expression": null}, {"column_name": "test_3", "column_default": null, "generation_expression": "((test_1)::numeric * alter_table_add_column_other_schema.my_random((1)::numeric))"}]
 [{"column_name": "test_1", "column_default": "(((alter_table_add_column_other_schema.my_random((7)::numeric))::double precision + random()) + (5)::double precision)", "generation_expression": null}, {"column_name": "test_3", "column_default": null, "generation_expression": "((test_1)::numeric * alter_table_add_column_other_schema.my_random((1)::numeric))"}]
 [{"column_name": "test_1", "column_default": "(((alter_table_add_column_other_schema.my_random((7)::numeric))::double precision + random()) + (5)::double precision)", "generation_expression": null}, {"column_name": "test_3", "column_default": null, "generation_expression": "((test_1)::numeric * alter_table_add_column_other_schema.my_random((1)::numeric))"}]
(3 rows)

SELECT result FROM run_command_on_all_nodes(
  $$SELECT get_column_attrs FROM get_column_attrs('alter_table_add_column.referencing')$$
)
JOIN pg_dist_node USING (nodeid)
ORDER BY result;
                                                                                                                                                                                                                                                                                                                                                                                                                                                                                                                                                                                                                          result
---------------------------------------------------------------------
 {"relnames": ["alter_table_add_column.referencing", "alter_table_add_column.referencing_2092001"], "column_attrs": [{"not_null": true, "type_name": "int4", "column_name": "test_1", "collation_name": null, "compression_method": ""}, {"not_null": false, "type_name": "int4", "column_name": "test_2", "collation_name": null, "compression_method": ""}, {"not_null": false, "type_name": "int4", "column_name": "test_3", "collation_name": null, "compression_method": ""}, {"not_null": true, "type_name": "int4", "column_name": "test_4", "collation_name": null, "compression_method": ""}, {"not_null": false, "type_name": "int4", "column_name": "test_5", "collation_name": null, "compression_method": ""}, {"not_null": true, "type_name": "text", "column_name": "test_6", "collation_name": "caseinsensitive", "compression_method": "p"}, {"not_null": false, "type_name": "int4", "column_name": "test_8", "collation_name": null, "compression_method": ""}, {"not_null": false, "type_name": "simple_!\\'custom_type", "column_name": "test_\\'!7", "collation_name": null, "compression_method": ""}, {"not_null": false, "type_name": "text", "column_name": "text_col", "collation_name": "default", "compression_method": ""}]}
 {"relnames": ["alter_table_add_column.referencing"], "column_attrs": [{"not_null": true, "type_name": "int4", "column_name": "test_1", "collation_name": null, "compression_method": ""}, {"not_null": false, "type_name": "int4", "column_name": "test_2", "collation_name": null, "compression_method": ""}, {"not_null": false, "type_name": "int4", "column_name": "test_3", "collation_name": null, "compression_method": ""}, {"not_null": true, "type_name": "int4", "column_name": "test_4", "collation_name": null, "compression_method": ""}, {"not_null": false, "type_name": "int4", "column_name": "test_5", "collation_name": null, "compression_method": ""}, {"not_null": true, "type_name": "text", "column_name": "test_6", "collation_name": "caseinsensitive", "compression_method": "p"}, {"not_null": false, "type_name": "int4", "column_name": "test_8", "collation_name": null, "compression_method": ""}, {"not_null": false, "type_name": "simple_!\\'custom_type", "column_name": "test_\\'!7", "collation_name": null, "compression_method": ""}, {"not_null": false, "type_name": "text", "column_name": "text_col", "collation_name": "default", "compression_method": ""}]}
 {"relnames": ["alter_table_add_column.referencing"], "column_attrs": [{"not_null": true, "type_name": "int4", "column_name": "test_1", "collation_name": null, "compression_method": ""}, {"not_null": false, "type_name": "int4", "column_name": "test_2", "collation_name": null, "compression_method": ""}, {"not_null": false, "type_name": "int4", "column_name": "test_3", "collation_name": null, "compression_method": ""}, {"not_null": true, "type_name": "int4", "column_name": "test_4", "collation_name": null, "compression_method": ""}, {"not_null": false, "type_name": "int4", "column_name": "test_5", "collation_name": null, "compression_method": ""}, {"not_null": true, "type_name": "text", "column_name": "test_6", "collation_name": "caseinsensitive", "compression_method": "p"}, {"not_null": false, "type_name": "int4", "column_name": "test_8", "collation_name": null, "compression_method": ""}, {"not_null": false, "type_name": "simple_!\\'custom_type", "column_name": "test_\\'!7", "collation_name": null, "compression_method": ""}, {"not_null": false, "type_name": "text", "column_name": "text_col", "collation_name": "default", "compression_method": ""}]}
(3 rows)

CREATE SCHEMA tenant_9;
CREATE SEQUENCE tenant_9.seq_1 START 5000 INCREMENT 5;
-- create a more complicated table
CREATE USER tenant_9_owner;
CREATE TABLE tenant_9.table_1 (
    a bigint NULL DEFAULT 100,
    b text COLLATE "C" DEFAULT now()::text,
    c int DEFAULT nextval('tenant_9.seq_1'::regclass),
    d bigint GENERATED BY DEFAULT AS IDENTITY
    (
        MINVALUE 5
        MAXVALUE 100
        START WITH 10
    ),
    e int NOT NULL REFERENCES regular_schema.reference_table(id) MATCH FULL ON UPDATE RESTRICT ON DELETE CASCADE DEFERRABLE INITIALLY DEFERRED,
    f int GENERATED ALWAYS AS (c * 2) STORED,
    CONSTRAINT table_1_pkey PRIMARY KEY (a, b),
    CONSTRAINT table_1_unique_b UNIQUE NULLS DISTINCT (b, a),
    CONSTRAINT table_1_check_a_positive CHECK (a > 0)
)
PARTITION BY RANGE (a);
-- make sure that the shell table definition is same on all nodes
-- TODOTASK: check if sequence ranges make sense
SELECT result FROM run_command_on_all_nodes(
$$
SELECT string_agg(ddl_events, '; ') FROM master_get_table_ddl_events('tenant_9.table_1') AS ddl_events;
$$
) JOIN pg_dist_node USING (nodeid) ORDER BY nodeport;
                                                                                                                                                                                                                                                                                                                                                 result
---------------------------------------------------------------------
 CREATE TABLE tenant_9.table_1 (a bigint DEFAULT 100 NOT NULL, b text DEFAULT (now())::text NOT NULL COLLATE "C", c integer DEFAULT nextval('tenant_9.seq_1'::regclass), d bigint GENERATED BY DEFAULT AS IDENTITY (INCREMENT BY 1 MINVALUE 1 MAXVALUE 281474976710657 START WITH 1 CACHE 1 NO CYCLE) NOT NULL, e integer NOT NULL, f integer GENERATED ALWAYS AS ((c * 2)) STORED, CONSTRAINT table_1_check_a_positive CHECK ((a > 0))) PARTITION BY RANGE (a) ; ALTER TABLE tenant_9.table_1 OWNER TO postgres; ALTER TABLE tenant_9.table_1 ADD CONSTRAINT table_1_pkey PRIMARY KEY (a, b); ALTER TABLE tenant_9.table_1 ADD CONSTRAINT table_1_unique_b UNIQUE (b, a)
 CREATE TABLE tenant_9.table_1 (a bigint DEFAULT 100 NOT NULL, b text DEFAULT (now())::text NOT NULL COLLATE "C", c integer DEFAULT nextval('tenant_9.seq_1'::regclass), d bigint GENERATED BY DEFAULT AS IDENTITY (INCREMENT BY 1 MINVALUE 5 MAXVALUE 100 START WITH 10 CACHE 1 NO CYCLE) NOT NULL, e integer NOT NULL, f integer GENERATED ALWAYS AS ((c * 2)) STORED, CONSTRAINT table_1_check_a_positive CHECK ((a > 0))) PARTITION BY RANGE (a) ; ALTER TABLE tenant_9.table_1 OWNER TO postgres; ALTER TABLE tenant_9.table_1 ADD CONSTRAINT table_1_pkey PRIMARY KEY (a, b); ALTER TABLE tenant_9.table_1 ADD CONSTRAINT table_1_unique_b UNIQUE (b, a)
 CREATE TABLE tenant_9.table_1 (a bigint DEFAULT 100 NOT NULL, b text DEFAULT (now())::text NOT NULL COLLATE "C", c integer DEFAULT nextval('tenant_9.seq_1'::regclass), d bigint GENERATED BY DEFAULT AS IDENTITY (INCREMENT BY 1 MINVALUE 4503599627370497 MAXVALUE 4785074604081153 START WITH 4503599627370497 CACHE 1 NO CYCLE) NOT NULL, e integer NOT NULL, f integer GENERATED ALWAYS AS ((c * 2)) STORED, CONSTRAINT table_1_check_a_positive CHECK ((a > 0))) PARTITION BY RANGE (a) ; ALTER TABLE tenant_9.table_1 OWNER TO postgres; ALTER TABLE tenant_9.table_1 ADD CONSTRAINT table_1_pkey PRIMARY KEY (a, b); ALTER TABLE tenant_9.table_1 ADD CONSTRAINT table_1_unique_b UNIQUE (b, a)
(3 rows)

-- cleanup
\c - - - :master_port
SET client_min_messages TO WARNING;
DROP SCHEMA tenant_1, tenant_2, tenant_3, tenant_4, tenant_5, tenant_6, tenant_7, tenant_8, tenant_9, alter_table_add_column CASCADE;
DROP SCHEMA regular_schema, alter_table_add_column_other_schema CASCADE;
DROP FUNCTION create_citus_local_with_data(text);
DROP SEQUENCE dist_seq;
DROP ROLE tenant_9_owner;
-- reset it fwiw
ALTER SYSTEM RESET citus.next_shard_id;
SELECT pg_reload_conf();
 pg_reload_conf
---------------------------------------------------------------------
 t
(1 row)

SELECT pg_sleep(0.1);
 pg_sleep
---------------------------------------------------------------------

(1 row)

