--
-- SINGLE_SHARD_PROCEDURE_OPTIMIZATION
--
-- Tests for citus.enable_single_shard_procedure_optimization GUC.
-- This optimization allows single-statement procedures that execute
-- a single task on a single shard to skip coordinated (2PC) transactions.
--
SET citus.next_shard_id TO 109000;
SET citus.shard_count TO 4;
SET citus.shard_replication_factor TO 1;
CREATE SCHEMA single_shard_proc_opt;
SET search_path TO single_shard_proc_opt;
CREATE TABLE test_dist (shard_key int PRIMARY KEY, other_key int);
SELECT create_distributed_table('test_dist', 'shard_key');
 create_distributed_table
---------------------------------------------------------------------

(1 row)

-- Enable remote command logging and disable local execution so that
-- all commands go through the distributed path and we can observe
-- BEGIN / PREPARE TRANSACTION / COMMIT PREPARED (or lack thereof).
SET citus.log_remote_commands TO on;
SET citus.enable_local_execution TO off;
---------------------------------------------------------------------
-- TEST 1: Single-statement INSERT with optimization ON
-- Should succeed without error
---------------------------------------------------------------------
CREATE OR REPLACE PROCEDURE single_insert(val int)
LANGUAGE plpgsql AS $$
BEGIN
    INSERT INTO test_dist VALUES (val, val * 10);
END;
$$;
SET citus.enable_single_shard_procedure_optimization TO on;
CALL single_insert(1);
NOTICE:  issuing INSERT INTO single_shard_proc_opt.test_dist_109000 (shard_key, other_key) VALUES (1, 10)
DETAIL:  on server cosmosdev@localhost:xxxxx connectionId: xxxxxxx
SELECT * FROM test_dist ORDER BY shard_key;
NOTICE:  issuing SELECT shard_key, other_key FROM single_shard_proc_opt.test_dist_109000 test_dist WHERE true
DETAIL:  on server cosmosdev@localhost:xxxxx connectionId: xxxxxxx
NOTICE:  issuing SELECT shard_key, other_key FROM single_shard_proc_opt.test_dist_109001 test_dist WHERE true
DETAIL:  on server cosmosdev@localhost:xxxxx connectionId: xxxxxxx
NOTICE:  issuing SELECT shard_key, other_key FROM single_shard_proc_opt.test_dist_109002 test_dist WHERE true
DETAIL:  on server cosmosdev@localhost:xxxxx connectionId: xxxxxxx
NOTICE:  issuing SELECT shard_key, other_key FROM single_shard_proc_opt.test_dist_109003 test_dist WHERE true
DETAIL:  on server cosmosdev@localhost:xxxxx connectionId: xxxxxxx
 shard_key | other_key
---------------------------------------------------------------------
         1 |        10
(1 row)

TRUNCATE test_dist;
NOTICE:  issuing BEGIN TRANSACTION ISOLATION LEVEL READ COMMITTED;SELECT assign_distributed_transaction_id(xx, xx, 'xxxxxxx');
DETAIL:  on server cosmosdev@localhost:xxxxx connectionId: xxxxxxx
NOTICE:  issuing TRUNCATE TABLE single_shard_proc_opt.test_dist_xxxxx CASCADE
DETAIL:  on server cosmosdev@localhost:xxxxx connectionId: xxxxxxx
NOTICE:  issuing TRUNCATE TABLE single_shard_proc_opt.test_dist_xxxxx CASCADE
DETAIL:  on server cosmosdev@localhost:xxxxx connectionId: xxxxxxx
NOTICE:  issuing TRUNCATE TABLE single_shard_proc_opt.test_dist_xxxxx CASCADE
DETAIL:  on server cosmosdev@localhost:xxxxx connectionId: xxxxxxx
NOTICE:  issuing TRUNCATE TABLE single_shard_proc_opt.test_dist_xxxxx CASCADE
DETAIL:  on server cosmosdev@localhost:xxxxx connectionId: xxxxxxx
NOTICE:  issuing PREPARE TRANSACTION 'citus_xx_xx_xx_xx'
DETAIL:  on server cosmosdev@localhost:xxxxx connectionId: xxxxxxx
NOTICE:  issuing COMMIT PREPARED 'citus_xx_xx_xx_xx'
DETAIL:  on server cosmosdev@localhost:xxxxx connectionId: xxxxxxx
---------------------------------------------------------------------
-- TEST 2: Single-statement INSERT with optimization OFF
-- Should also succeed (uses coordinated transaction)
---------------------------------------------------------------------
SET citus.enable_single_shard_procedure_optimization TO off;
CALL single_insert(2);
NOTICE:  issuing BEGIN TRANSACTION ISOLATION LEVEL READ COMMITTED;SELECT assign_distributed_transaction_id(xx, xx, 'xxxxxxx');
DETAIL:  on server cosmosdev@localhost:xxxxx connectionId: xxxxxxx
NOTICE:  issuing INSERT INTO single_shard_proc_opt.test_dist_109003 (shard_key, other_key) VALUES (2, 20)
DETAIL:  on server cosmosdev@localhost:xxxxx connectionId: xxxxxxx
NOTICE:  issuing COMMIT
DETAIL:  on server cosmosdev@localhost:xxxxx connectionId: xxxxxxx
SELECT * FROM test_dist ORDER BY shard_key;
NOTICE:  issuing SELECT shard_key, other_key FROM single_shard_proc_opt.test_dist_109000 test_dist WHERE true
DETAIL:  on server cosmosdev@localhost:xxxxx connectionId: xxxxxxx
NOTICE:  issuing SELECT shard_key, other_key FROM single_shard_proc_opt.test_dist_109001 test_dist WHERE true
DETAIL:  on server cosmosdev@localhost:xxxxx connectionId: xxxxxxx
NOTICE:  issuing SELECT shard_key, other_key FROM single_shard_proc_opt.test_dist_109002 test_dist WHERE true
DETAIL:  on server cosmosdev@localhost:xxxxx connectionId: xxxxxxx
NOTICE:  issuing SELECT shard_key, other_key FROM single_shard_proc_opt.test_dist_109003 test_dist WHERE true
DETAIL:  on server cosmosdev@localhost:xxxxx connectionId: xxxxxxx
 shard_key | other_key
---------------------------------------------------------------------
         2 |        20
(1 row)

TRUNCATE test_dist;
NOTICE:  issuing BEGIN TRANSACTION ISOLATION LEVEL READ COMMITTED;SELECT assign_distributed_transaction_id(xx, xx, 'xxxxxxx');
DETAIL:  on server cosmosdev@localhost:xxxxx connectionId: xxxxxxx
NOTICE:  issuing TRUNCATE TABLE single_shard_proc_opt.test_dist_xxxxx CASCADE
DETAIL:  on server cosmosdev@localhost:xxxxx connectionId: xxxxxxx
NOTICE:  issuing TRUNCATE TABLE single_shard_proc_opt.test_dist_xxxxx CASCADE
DETAIL:  on server cosmosdev@localhost:xxxxx connectionId: xxxxxxx
NOTICE:  issuing TRUNCATE TABLE single_shard_proc_opt.test_dist_xxxxx CASCADE
DETAIL:  on server cosmosdev@localhost:xxxxx connectionId: xxxxxxx
NOTICE:  issuing TRUNCATE TABLE single_shard_proc_opt.test_dist_xxxxx CASCADE
DETAIL:  on server cosmosdev@localhost:xxxxx connectionId: xxxxxxx
NOTICE:  issuing PREPARE TRANSACTION 'citus_xx_xx_xx_xx'
DETAIL:  on server cosmosdev@localhost:xxxxx connectionId: xxxxxxx
NOTICE:  issuing COMMIT PREPARED 'citus_xx_xx_xx_xx'
DETAIL:  on server cosmosdev@localhost:xxxxx connectionId: xxxxxxx
---------------------------------------------------------------------
-- TEST 3: Two single-shard inserts in procedure
-- Should ERROR on second statement with optimization ON
---------------------------------------------------------------------
CREATE OR REPLACE PROCEDURE two_single_inserts(val1 int, val2 int)
LANGUAGE plpgsql AS $$
BEGIN
    INSERT INTO test_dist VALUES (val1, val1 * 10);
    INSERT INTO test_dist VALUES (val2, val2 * 10);
END;
$$;
SET citus.enable_single_shard_procedure_optimization TO on;
CALL two_single_inserts(10, 20);
NOTICE:  issuing INSERT INTO single_shard_proc_opt.test_dist_109000 (shard_key, other_key) VALUES (10, 100)
DETAIL:  on server cosmosdev@localhost:xxxxx connectionId: xxxxxxx
ERROR:  multi-statement procedures are not supported with citus.enable_single_shard_procedure_optimization
DETAIL:  The first statement has already been committed on the worker and cannot be rolled back.
HINT:  Use this optimization only for single-statement procedures, or disable the GUC.
CONTEXT:  SQL statement "INSERT INTO test_dist VALUES (val2, val2 * 10)"
PL/pgSQL function two_single_inserts(integer,integer) line XX at SQL statement
SELECT * FROM test_dist ORDER BY shard_key;
NOTICE:  issuing SELECT shard_key, other_key FROM single_shard_proc_opt.test_dist_109000 test_dist WHERE true
DETAIL:  on server cosmosdev@localhost:xxxxx connectionId: xxxxxxx
NOTICE:  issuing SELECT shard_key, other_key FROM single_shard_proc_opt.test_dist_109001 test_dist WHERE true
DETAIL:  on server cosmosdev@localhost:xxxxx connectionId: xxxxxxx
NOTICE:  issuing SELECT shard_key, other_key FROM single_shard_proc_opt.test_dist_109002 test_dist WHERE true
DETAIL:  on server cosmosdev@localhost:xxxxx connectionId: xxxxxxx
NOTICE:  issuing SELECT shard_key, other_key FROM single_shard_proc_opt.test_dist_109003 test_dist WHERE true
DETAIL:  on server cosmosdev@localhost:xxxxx connectionId: xxxxxxx
 shard_key | other_key
---------------------------------------------------------------------
        10 |       100
(1 row)

TRUNCATE test_dist;
NOTICE:  issuing BEGIN TRANSACTION ISOLATION LEVEL READ COMMITTED;SELECT assign_distributed_transaction_id(xx, xx, 'xxxxxxx');
DETAIL:  on server cosmosdev@localhost:xxxxx connectionId: xxxxxxx
NOTICE:  issuing TRUNCATE TABLE single_shard_proc_opt.test_dist_xxxxx CASCADE
DETAIL:  on server cosmosdev@localhost:xxxxx connectionId: xxxxxxx
NOTICE:  issuing TRUNCATE TABLE single_shard_proc_opt.test_dist_xxxxx CASCADE
DETAIL:  on server cosmosdev@localhost:xxxxx connectionId: xxxxxxx
NOTICE:  issuing TRUNCATE TABLE single_shard_proc_opt.test_dist_xxxxx CASCADE
DETAIL:  on server cosmosdev@localhost:xxxxx connectionId: xxxxxxx
NOTICE:  issuing TRUNCATE TABLE single_shard_proc_opt.test_dist_xxxxx CASCADE
DETAIL:  on server cosmosdev@localhost:xxxxx connectionId: xxxxxxx
NOTICE:  issuing PREPARE TRANSACTION 'citus_xx_xx_xx_xx'
DETAIL:  on server cosmosdev@localhost:xxxxx connectionId: xxxxxxx
NOTICE:  issuing COMMIT PREPARED 'citus_xx_xx_xx_xx'
DETAIL:  on server cosmosdev@localhost:xxxxx connectionId: xxxxxxx
---------------------------------------------------------------------
-- TEST 4: Multi-row insert + single insert in procedure
-- First statement is multi-task, so coordination kicks in
-- for both statements. No error expected.
---------------------------------------------------------------------
CREATE OR REPLACE PROCEDURE multi_then_single(input int)
LANGUAGE plpgsql AS $$
BEGIN
    INSERT INTO test_dist VALUES (input + 1, (input + 1) * 10), (input + 2, (input + 2) * 10);
    INSERT INTO test_dist VALUES (input + 3, (input + 3) * 10);
END;
$$;
TRUNCATE test_dist;
NOTICE:  issuing BEGIN TRANSACTION ISOLATION LEVEL READ COMMITTED;SELECT assign_distributed_transaction_id(xx, xx, 'xxxxxxx');
DETAIL:  on server cosmosdev@localhost:xxxxx connectionId: xxxxxxx
NOTICE:  issuing TRUNCATE TABLE single_shard_proc_opt.test_dist_xxxxx CASCADE
DETAIL:  on server cosmosdev@localhost:xxxxx connectionId: xxxxxxx
NOTICE:  issuing TRUNCATE TABLE single_shard_proc_opt.test_dist_xxxxx CASCADE
DETAIL:  on server cosmosdev@localhost:xxxxx connectionId: xxxxxxx
NOTICE:  issuing TRUNCATE TABLE single_shard_proc_opt.test_dist_xxxxx CASCADE
DETAIL:  on server cosmosdev@localhost:xxxxx connectionId: xxxxxxx
NOTICE:  issuing TRUNCATE TABLE single_shard_proc_opt.test_dist_xxxxx CASCADE
DETAIL:  on server cosmosdev@localhost:xxxxx connectionId: xxxxxxx
NOTICE:  issuing PREPARE TRANSACTION 'citus_xx_xx_xx_xx'
DETAIL:  on server cosmosdev@localhost:xxxxx connectionId: xxxxxxx
NOTICE:  issuing COMMIT PREPARED 'citus_xx_xx_xx_xx'
DETAIL:  on server cosmosdev@localhost:xxxxx connectionId: xxxxxxx
SET citus.enable_single_shard_procedure_optimization TO on;
CALL multi_then_single(100);
NOTICE:  issuing BEGIN TRANSACTION ISOLATION LEVEL READ COMMITTED;SELECT assign_distributed_transaction_id(xx, xx, 'xxxxxxx');
DETAIL:  on server cosmosdev@localhost:xxxxx connectionId: xxxxxxx
NOTICE:  issuing INSERT INTO single_shard_proc_opt.test_dist_109001 AS citus_table_alias (shard_key, other_key) VALUES (101,1010)
DETAIL:  on server cosmosdev@localhost:xxxxx connectionId: xxxxxxx
NOTICE:  issuing INSERT INTO single_shard_proc_opt.test_dist_109002 AS citus_table_alias (shard_key, other_key) VALUES (102,1020)
DETAIL:  on server cosmosdev@localhost:xxxxx connectionId: xxxxxxx
NOTICE:  issuing INSERT INTO single_shard_proc_opt.test_dist_109001 (shard_key, other_key) VALUES (103, 1030)
DETAIL:  on server cosmosdev@localhost:xxxxx connectionId: xxxxxxx
NOTICE:  issuing PREPARE TRANSACTION 'citus_xx_xx_xx_xx'
DETAIL:  on server cosmosdev@localhost:xxxxx connectionId: xxxxxxx
NOTICE:  issuing COMMIT PREPARED 'citus_xx_xx_xx_xx'
DETAIL:  on server cosmosdev@localhost:xxxxx connectionId: xxxxxxx
SELECT * FROM test_dist ORDER BY shard_key;
NOTICE:  issuing SELECT shard_key, other_key FROM single_shard_proc_opt.test_dist_109000 test_dist WHERE true
DETAIL:  on server cosmosdev@localhost:xxxxx connectionId: xxxxxxx
NOTICE:  issuing SELECT shard_key, other_key FROM single_shard_proc_opt.test_dist_109001 test_dist WHERE true
DETAIL:  on server cosmosdev@localhost:xxxxx connectionId: xxxxxxx
NOTICE:  issuing SELECT shard_key, other_key FROM single_shard_proc_opt.test_dist_109002 test_dist WHERE true
DETAIL:  on server cosmosdev@localhost:xxxxx connectionId: xxxxxxx
NOTICE:  issuing SELECT shard_key, other_key FROM single_shard_proc_opt.test_dist_109003 test_dist WHERE true
DETAIL:  on server cosmosdev@localhost:xxxxx connectionId: xxxxxxx
 shard_key | other_key
---------------------------------------------------------------------
       101 |      1010
       102 |      1020
       103 |      1030
(3 rows)

TRUNCATE test_dist;
NOTICE:  issuing BEGIN TRANSACTION ISOLATION LEVEL READ COMMITTED;SELECT assign_distributed_transaction_id(xx, xx, 'xxxxxxx');
DETAIL:  on server cosmosdev@localhost:xxxxx connectionId: xxxxxxx
NOTICE:  issuing TRUNCATE TABLE single_shard_proc_opt.test_dist_xxxxx CASCADE
DETAIL:  on server cosmosdev@localhost:xxxxx connectionId: xxxxxxx
NOTICE:  issuing TRUNCATE TABLE single_shard_proc_opt.test_dist_xxxxx CASCADE
DETAIL:  on server cosmosdev@localhost:xxxxx connectionId: xxxxxxx
NOTICE:  issuing TRUNCATE TABLE single_shard_proc_opt.test_dist_xxxxx CASCADE
DETAIL:  on server cosmosdev@localhost:xxxxx connectionId: xxxxxxx
NOTICE:  issuing TRUNCATE TABLE single_shard_proc_opt.test_dist_xxxxx CASCADE
DETAIL:  on server cosmosdev@localhost:xxxxx connectionId: xxxxxxx
NOTICE:  issuing PREPARE TRANSACTION 'citus_xx_xx_xx_xx'
DETAIL:  on server cosmosdev@localhost:xxxxx connectionId: xxxxxxx
NOTICE:  issuing COMMIT PREPARED 'citus_xx_xx_xx_xx'
DETAIL:  on server cosmosdev@localhost:xxxxx connectionId: xxxxxxx
---------------------------------------------------------------------
-- TEST 5: Explicit BEGIN block should NOT use optimization
-- (IsTransactionBlock() returns true, so optimization is skipped)
---------------------------------------------------------------------
SET citus.enable_single_shard_procedure_optimization TO on;
BEGIN;
CALL single_insert(50);
NOTICE:  issuing BEGIN TRANSACTION ISOLATION LEVEL READ COMMITTED;SELECT assign_distributed_transaction_id(xx, xx, 'xxxxxxx');
DETAIL:  on server cosmosdev@localhost:xxxxx connectionId: xxxxxxx
NOTICE:  issuing INSERT INTO single_shard_proc_opt.test_dist_109000 (shard_key, other_key) VALUES (50, 500)
DETAIL:  on server cosmosdev@localhost:xxxxx connectionId: xxxxxxx
COMMIT;
NOTICE:  issuing COMMIT
DETAIL:  on server cosmosdev@localhost:xxxxx connectionId: xxxxxxx
SELECT * FROM test_dist ORDER BY shard_key;
NOTICE:  issuing SELECT shard_key, other_key FROM single_shard_proc_opt.test_dist_109000 test_dist WHERE true
DETAIL:  on server cosmosdev@localhost:xxxxx connectionId: xxxxxxx
NOTICE:  issuing SELECT shard_key, other_key FROM single_shard_proc_opt.test_dist_109001 test_dist WHERE true
DETAIL:  on server cosmosdev@localhost:xxxxx connectionId: xxxxxxx
NOTICE:  issuing SELECT shard_key, other_key FROM single_shard_proc_opt.test_dist_109002 test_dist WHERE true
DETAIL:  on server cosmosdev@localhost:xxxxx connectionId: xxxxxxx
NOTICE:  issuing SELECT shard_key, other_key FROM single_shard_proc_opt.test_dist_109003 test_dist WHERE true
DETAIL:  on server cosmosdev@localhost:xxxxx connectionId: xxxxxxx
 shard_key | other_key
---------------------------------------------------------------------
        50 |       500
(1 row)

TRUNCATE test_dist;
NOTICE:  issuing BEGIN TRANSACTION ISOLATION LEVEL READ COMMITTED;SELECT assign_distributed_transaction_id(xx, xx, 'xxxxxxx');
DETAIL:  on server cosmosdev@localhost:xxxxx connectionId: xxxxxxx
NOTICE:  issuing TRUNCATE TABLE single_shard_proc_opt.test_dist_xxxxx CASCADE
DETAIL:  on server cosmosdev@localhost:xxxxx connectionId: xxxxxxx
NOTICE:  issuing TRUNCATE TABLE single_shard_proc_opt.test_dist_xxxxx CASCADE
DETAIL:  on server cosmosdev@localhost:xxxxx connectionId: xxxxxxx
NOTICE:  issuing TRUNCATE TABLE single_shard_proc_opt.test_dist_xxxxx CASCADE
DETAIL:  on server cosmosdev@localhost:xxxxx connectionId: xxxxxxx
NOTICE:  issuing TRUNCATE TABLE single_shard_proc_opt.test_dist_xxxxx CASCADE
DETAIL:  on server cosmosdev@localhost:xxxxx connectionId: xxxxxxx
NOTICE:  issuing PREPARE TRANSACTION 'citus_xx_xx_xx_xx'
DETAIL:  on server cosmosdev@localhost:xxxxx connectionId: xxxxxxx
NOTICE:  issuing COMMIT PREPARED 'citus_xx_xx_xx_xx'
DETAIL:  on server cosmosdev@localhost:xxxxx connectionId: xxxxxxx
---------------------------------------------------------------------
-- TEST 6: Nested CALL should NOT use optimization
-- (StoredProcedureLevel > 1, so optimization is skipped)
---------------------------------------------------------------------
CREATE OR REPLACE PROCEDURE outer_proc(val int)
LANGUAGE plpgsql AS $$
BEGIN
    CALL single_insert(val);
END;
$$;
SET citus.enable_single_shard_procedure_optimization TO on;
CALL outer_proc(60);
NOTICE:  issuing BEGIN TRANSACTION ISOLATION LEVEL READ COMMITTED;SELECT assign_distributed_transaction_id(xx, xx, 'xxxxxxx');
DETAIL:  on server cosmosdev@localhost:xxxxx connectionId: xxxxxxx
NOTICE:  issuing INSERT INTO single_shard_proc_opt.test_dist_109000 (shard_key, other_key) VALUES (60, 600)
DETAIL:  on server cosmosdev@localhost:xxxxx connectionId: xxxxxxx
NOTICE:  issuing COMMIT
DETAIL:  on server cosmosdev@localhost:xxxxx connectionId: xxxxxxx
SELECT * FROM test_dist ORDER BY shard_key;
NOTICE:  issuing SELECT shard_key, other_key FROM single_shard_proc_opt.test_dist_109000 test_dist WHERE true
DETAIL:  on server cosmosdev@localhost:xxxxx connectionId: xxxxxxx
NOTICE:  issuing SELECT shard_key, other_key FROM single_shard_proc_opt.test_dist_109001 test_dist WHERE true
DETAIL:  on server cosmosdev@localhost:xxxxx connectionId: xxxxxxx
NOTICE:  issuing SELECT shard_key, other_key FROM single_shard_proc_opt.test_dist_109002 test_dist WHERE true
DETAIL:  on server cosmosdev@localhost:xxxxx connectionId: xxxxxxx
NOTICE:  issuing SELECT shard_key, other_key FROM single_shard_proc_opt.test_dist_109003 test_dist WHERE true
DETAIL:  on server cosmosdev@localhost:xxxxx connectionId: xxxxxxx
 shard_key | other_key
---------------------------------------------------------------------
        60 |       600
(1 row)

TRUNCATE test_dist;
NOTICE:  issuing BEGIN TRANSACTION ISOLATION LEVEL READ COMMITTED;SELECT assign_distributed_transaction_id(xx, xx, 'xxxxxxx');
DETAIL:  on server cosmosdev@localhost:xxxxx connectionId: xxxxxxx
NOTICE:  issuing TRUNCATE TABLE single_shard_proc_opt.test_dist_xxxxx CASCADE
DETAIL:  on server cosmosdev@localhost:xxxxx connectionId: xxxxxxx
NOTICE:  issuing TRUNCATE TABLE single_shard_proc_opt.test_dist_xxxxx CASCADE
DETAIL:  on server cosmosdev@localhost:xxxxx connectionId: xxxxxxx
NOTICE:  issuing TRUNCATE TABLE single_shard_proc_opt.test_dist_xxxxx CASCADE
DETAIL:  on server cosmosdev@localhost:xxxxx connectionId: xxxxxxx
NOTICE:  issuing TRUNCATE TABLE single_shard_proc_opt.test_dist_xxxxx CASCADE
DETAIL:  on server cosmosdev@localhost:xxxxx connectionId: xxxxxxx
NOTICE:  issuing PREPARE TRANSACTION 'citus_xx_xx_xx_xx'
DETAIL:  on server cosmosdev@localhost:xxxxx connectionId: xxxxxxx
NOTICE:  issuing COMMIT PREPARED 'citus_xx_xx_xx_xx'
DETAIL:  on server cosmosdev@localhost:xxxxx connectionId: xxxxxxx
---------------------------------------------------------------------
-- TEST 7: Multi-row insert + single insert with optimization OFF
-- Should work fine (normal coordinated transaction)
---------------------------------------------------------------------
SET citus.enable_single_shard_procedure_optimization TO off;
CALL multi_then_single(200);
NOTICE:  issuing BEGIN TRANSACTION ISOLATION LEVEL READ COMMITTED;SELECT assign_distributed_transaction_id(xx, xx, 'xxxxxxx');
DETAIL:  on server cosmosdev@localhost:xxxxx connectionId: xxxxxxx
NOTICE:  issuing INSERT INTO single_shard_proc_opt.test_dist_109000 AS citus_table_alias (shard_key, other_key) VALUES (201,2010)
DETAIL:  on server cosmosdev@localhost:xxxxx connectionId: xxxxxxx
NOTICE:  issuing INSERT INTO single_shard_proc_opt.test_dist_109001 AS citus_table_alias (shard_key, other_key) VALUES (202,2020)
DETAIL:  on server cosmosdev@localhost:xxxxx connectionId: xxxxxxx
NOTICE:  issuing INSERT INTO single_shard_proc_opt.test_dist_109003 (shard_key, other_key) VALUES (203, 2030)
DETAIL:  on server cosmosdev@localhost:xxxxx connectionId: xxxxxxx
NOTICE:  issuing PREPARE TRANSACTION 'citus_xx_xx_xx_xx'
DETAIL:  on server cosmosdev@localhost:xxxxx connectionId: xxxxxxx
NOTICE:  issuing COMMIT PREPARED 'citus_xx_xx_xx_xx'
DETAIL:  on server cosmosdev@localhost:xxxxx connectionId: xxxxxxx
SELECT * FROM test_dist ORDER BY shard_key;
NOTICE:  issuing SELECT shard_key, other_key FROM single_shard_proc_opt.test_dist_109000 test_dist WHERE true
DETAIL:  on server cosmosdev@localhost:xxxxx connectionId: xxxxxxx
NOTICE:  issuing SELECT shard_key, other_key FROM single_shard_proc_opt.test_dist_109001 test_dist WHERE true
DETAIL:  on server cosmosdev@localhost:xxxxx connectionId: xxxxxxx
NOTICE:  issuing SELECT shard_key, other_key FROM single_shard_proc_opt.test_dist_109002 test_dist WHERE true
DETAIL:  on server cosmosdev@localhost:xxxxx connectionId: xxxxxxx
NOTICE:  issuing SELECT shard_key, other_key FROM single_shard_proc_opt.test_dist_109003 test_dist WHERE true
DETAIL:  on server cosmosdev@localhost:xxxxx connectionId: xxxxxxx
 shard_key | other_key
---------------------------------------------------------------------
       201 |      2010
       202 |      2020
       203 |      2030
(3 rows)

TRUNCATE test_dist;
NOTICE:  issuing BEGIN TRANSACTION ISOLATION LEVEL READ COMMITTED;SELECT assign_distributed_transaction_id(xx, xx, 'xxxxxxx');
DETAIL:  on server cosmosdev@localhost:xxxxx connectionId: xxxxxxx
NOTICE:  issuing TRUNCATE TABLE single_shard_proc_opt.test_dist_xxxxx CASCADE
DETAIL:  on server cosmosdev@localhost:xxxxx connectionId: xxxxxxx
NOTICE:  issuing TRUNCATE TABLE single_shard_proc_opt.test_dist_xxxxx CASCADE
DETAIL:  on server cosmosdev@localhost:xxxxx connectionId: xxxxxxx
NOTICE:  issuing TRUNCATE TABLE single_shard_proc_opt.test_dist_xxxxx CASCADE
DETAIL:  on server cosmosdev@localhost:xxxxx connectionId: xxxxxxx
NOTICE:  issuing TRUNCATE TABLE single_shard_proc_opt.test_dist_xxxxx CASCADE
DETAIL:  on server cosmosdev@localhost:xxxxx connectionId: xxxxxxx
NOTICE:  issuing PREPARE TRANSACTION 'citus_xx_xx_xx_xx'
DETAIL:  on server cosmosdev@localhost:xxxxx connectionId: xxxxxxx
NOTICE:  issuing COMMIT PREPARED 'citus_xx_xx_xx_xx'
DETAIL:  on server cosmosdev@localhost:xxxxx connectionId: xxxxxxx
---------------------------------------------------------------------
-- TEST 8: Single UPDATE by shard_key with optimization ON
-- WHERE clause targets a single shard, should skip 2PC
---------------------------------------------------------------------
-- Seed some data
INSERT INTO test_dist VALUES (1, 10), (2, 20), (3, 30);
NOTICE:  issuing BEGIN TRANSACTION ISOLATION LEVEL READ COMMITTED;SELECT assign_distributed_transaction_id(xx, xx, 'xxxxxxx');
DETAIL:  on server cosmosdev@localhost:xxxxx connectionId: xxxxxxx
NOTICE:  issuing INSERT INTO single_shard_proc_opt.test_dist_109000 AS citus_table_alias (shard_key, other_key) VALUES (1,10)
DETAIL:  on server cosmosdev@localhost:xxxxx connectionId: xxxxxxx
NOTICE:  issuing INSERT INTO single_shard_proc_opt.test_dist_109001 AS citus_table_alias (shard_key, other_key) VALUES (3,30)
DETAIL:  on server cosmosdev@localhost:xxxxx connectionId: xxxxxxx
NOTICE:  issuing INSERT INTO single_shard_proc_opt.test_dist_109003 AS citus_table_alias (shard_key, other_key) VALUES (2,20)
DETAIL:  on server cosmosdev@localhost:xxxxx connectionId: xxxxxxx
NOTICE:  issuing PREPARE TRANSACTION 'citus_xx_xx_xx_xx'
DETAIL:  on server cosmosdev@localhost:xxxxx connectionId: xxxxxxx
NOTICE:  issuing COMMIT PREPARED 'citus_xx_xx_xx_xx'
DETAIL:  on server cosmosdev@localhost:xxxxx connectionId: xxxxxxx
CREATE OR REPLACE PROCEDURE update_by_shard_key(key_val int, new_other int)
LANGUAGE plpgsql AS $$
BEGIN
    UPDATE test_dist SET other_key = new_other WHERE shard_key = key_val;
END;
$$;
SET citus.enable_single_shard_procedure_optimization TO on;
CALL update_by_shard_key(2, 999);
NOTICE:  issuing UPDATE single_shard_proc_opt.test_dist_109003 test_dist SET other_key = 999 WHERE (shard_key OPERATOR(pg_catalog.=) 2)
DETAIL:  on server cosmosdev@localhost:xxxxx connectionId: xxxxxxx
SELECT * FROM test_dist ORDER BY shard_key;
NOTICE:  issuing SELECT shard_key, other_key FROM single_shard_proc_opt.test_dist_109000 test_dist WHERE true
DETAIL:  on server cosmosdev@localhost:xxxxx connectionId: xxxxxxx
NOTICE:  issuing SELECT shard_key, other_key FROM single_shard_proc_opt.test_dist_109001 test_dist WHERE true
DETAIL:  on server cosmosdev@localhost:xxxxx connectionId: xxxxxxx
NOTICE:  issuing SELECT shard_key, other_key FROM single_shard_proc_opt.test_dist_109002 test_dist WHERE true
DETAIL:  on server cosmosdev@localhost:xxxxx connectionId: xxxxxxx
NOTICE:  issuing SELECT shard_key, other_key FROM single_shard_proc_opt.test_dist_109003 test_dist WHERE true
DETAIL:  on server cosmosdev@localhost:xxxxx connectionId: xxxxxxx
 shard_key | other_key
---------------------------------------------------------------------
         1 |        10
         2 |       999
         3 |        30
(3 rows)

TRUNCATE test_dist;
NOTICE:  issuing BEGIN TRANSACTION ISOLATION LEVEL READ COMMITTED;SELECT assign_distributed_transaction_id(xx, xx, 'xxxxxxx');
DETAIL:  on server cosmosdev@localhost:xxxxx connectionId: xxxxxxx
NOTICE:  issuing TRUNCATE TABLE single_shard_proc_opt.test_dist_xxxxx CASCADE
DETAIL:  on server cosmosdev@localhost:xxxxx connectionId: xxxxxxx
NOTICE:  issuing TRUNCATE TABLE single_shard_proc_opt.test_dist_xxxxx CASCADE
DETAIL:  on server cosmosdev@localhost:xxxxx connectionId: xxxxxxx
NOTICE:  issuing TRUNCATE TABLE single_shard_proc_opt.test_dist_xxxxx CASCADE
DETAIL:  on server cosmosdev@localhost:xxxxx connectionId: xxxxxxx
NOTICE:  issuing TRUNCATE TABLE single_shard_proc_opt.test_dist_xxxxx CASCADE
DETAIL:  on server cosmosdev@localhost:xxxxx connectionId: xxxxxxx
NOTICE:  issuing PREPARE TRANSACTION 'citus_xx_xx_xx_xx'
DETAIL:  on server cosmosdev@localhost:xxxxx connectionId: xxxxxxx
NOTICE:  issuing COMMIT PREPARED 'citus_xx_xx_xx_xx'
DETAIL:  on server cosmosdev@localhost:xxxxx connectionId: xxxxxxx
---------------------------------------------------------------------
-- TEST 9: Single UPDATE by other_key with optimization ON
-- WHERE clause on non-distribution column => multi-shard query
-- Coordination kicks in normally (optimization does not apply
-- because the planner generates multiple tasks).
---------------------------------------------------------------------
INSERT INTO test_dist VALUES (1, 10), (2, 20), (3, 30);
NOTICE:  issuing BEGIN TRANSACTION ISOLATION LEVEL READ COMMITTED;SELECT assign_distributed_transaction_id(xx, xx, 'xxxxxxx');
DETAIL:  on server cosmosdev@localhost:xxxxx connectionId: xxxxxxx
NOTICE:  issuing INSERT INTO single_shard_proc_opt.test_dist_109000 AS citus_table_alias (shard_key, other_key) VALUES (1,10)
DETAIL:  on server cosmosdev@localhost:xxxxx connectionId: xxxxxxx
NOTICE:  issuing INSERT INTO single_shard_proc_opt.test_dist_109001 AS citus_table_alias (shard_key, other_key) VALUES (3,30)
DETAIL:  on server cosmosdev@localhost:xxxxx connectionId: xxxxxxx
NOTICE:  issuing INSERT INTO single_shard_proc_opt.test_dist_109003 AS citus_table_alias (shard_key, other_key) VALUES (2,20)
DETAIL:  on server cosmosdev@localhost:xxxxx connectionId: xxxxxxx
NOTICE:  issuing PREPARE TRANSACTION 'citus_xx_xx_xx_xx'
DETAIL:  on server cosmosdev@localhost:xxxxx connectionId: xxxxxxx
NOTICE:  issuing COMMIT PREPARED 'citus_xx_xx_xx_xx'
DETAIL:  on server cosmosdev@localhost:xxxxx connectionId: xxxxxxx
CREATE OR REPLACE PROCEDURE update_by_other_key(other_val int, new_other int)
LANGUAGE plpgsql AS $$
BEGIN
    UPDATE test_dist SET other_key = new_other WHERE other_key = other_val;
END;
$$;
SET citus.enable_single_shard_procedure_optimization TO on;
CALL update_by_other_key(20, 888);
NOTICE:  issuing BEGIN TRANSACTION ISOLATION LEVEL READ COMMITTED;SELECT assign_distributed_transaction_id(xx, xx, 'xxxxxxx');
DETAIL:  on server cosmosdev@localhost:xxxxx connectionId: xxxxxxx
NOTICE:  issuing UPDATE single_shard_proc_opt.test_dist_109000 test_dist SET other_key = $2 WHERE (other_key OPERATOR(pg_catalog.=) $1)
DETAIL:  on server cosmosdev@localhost:xxxxx connectionId: xxxxxxx
NOTICE:  issuing UPDATE single_shard_proc_opt.test_dist_109001 test_dist SET other_key = $2 WHERE (other_key OPERATOR(pg_catalog.=) $1)
DETAIL:  on server cosmosdev@localhost:xxxxx connectionId: xxxxxxx
NOTICE:  issuing UPDATE single_shard_proc_opt.test_dist_109002 test_dist SET other_key = $2 WHERE (other_key OPERATOR(pg_catalog.=) $1)
DETAIL:  on server cosmosdev@localhost:xxxxx connectionId: xxxxxxx
NOTICE:  issuing UPDATE single_shard_proc_opt.test_dist_109003 test_dist SET other_key = $2 WHERE (other_key OPERATOR(pg_catalog.=) $1)
DETAIL:  on server cosmosdev@localhost:xxxxx connectionId: xxxxxxx
NOTICE:  issuing PREPARE TRANSACTION 'citus_xx_xx_xx_xx'
DETAIL:  on server cosmosdev@localhost:xxxxx connectionId: xxxxxxx
NOTICE:  issuing COMMIT PREPARED 'citus_xx_xx_xx_xx'
DETAIL:  on server cosmosdev@localhost:xxxxx connectionId: xxxxxxx
SELECT * FROM test_dist ORDER BY shard_key;
NOTICE:  issuing SELECT shard_key, other_key FROM single_shard_proc_opt.test_dist_109000 test_dist WHERE true
DETAIL:  on server cosmosdev@localhost:xxxxx connectionId: xxxxxxx
NOTICE:  issuing SELECT shard_key, other_key FROM single_shard_proc_opt.test_dist_109001 test_dist WHERE true
DETAIL:  on server cosmosdev@localhost:xxxxx connectionId: xxxxxxx
NOTICE:  issuing SELECT shard_key, other_key FROM single_shard_proc_opt.test_dist_109002 test_dist WHERE true
DETAIL:  on server cosmosdev@localhost:xxxxx connectionId: xxxxxxx
NOTICE:  issuing SELECT shard_key, other_key FROM single_shard_proc_opt.test_dist_109003 test_dist WHERE true
DETAIL:  on server cosmosdev@localhost:xxxxx connectionId: xxxxxxx
 shard_key | other_key
---------------------------------------------------------------------
         1 |        10
         2 |       888
         3 |        30
(3 rows)

TRUNCATE test_dist;
NOTICE:  issuing BEGIN TRANSACTION ISOLATION LEVEL READ COMMITTED;SELECT assign_distributed_transaction_id(xx, xx, 'xxxxxxx');
DETAIL:  on server cosmosdev@localhost:xxxxx connectionId: xxxxxxx
NOTICE:  issuing TRUNCATE TABLE single_shard_proc_opt.test_dist_xxxxx CASCADE
DETAIL:  on server cosmosdev@localhost:xxxxx connectionId: xxxxxxx
NOTICE:  issuing TRUNCATE TABLE single_shard_proc_opt.test_dist_xxxxx CASCADE
DETAIL:  on server cosmosdev@localhost:xxxxx connectionId: xxxxxxx
NOTICE:  issuing TRUNCATE TABLE single_shard_proc_opt.test_dist_xxxxx CASCADE
DETAIL:  on server cosmosdev@localhost:xxxxx connectionId: xxxxxxx
NOTICE:  issuing TRUNCATE TABLE single_shard_proc_opt.test_dist_xxxxx CASCADE
DETAIL:  on server cosmosdev@localhost:xxxxx connectionId: xxxxxxx
NOTICE:  issuing PREPARE TRANSACTION 'citus_xx_xx_xx_xx'
DETAIL:  on server cosmosdev@localhost:xxxxx connectionId: xxxxxxx
NOTICE:  issuing COMMIT PREPARED 'citus_xx_xx_xx_xx'
DETAIL:  on server cosmosdev@localhost:xxxxx connectionId: xxxxxxx
---------------------------------------------------------------------
-- TEST 10: Two UPDATEs by shard_key in one procedure
-- Should ERROR on second statement with optimization ON
---------------------------------------------------------------------
INSERT INTO test_dist VALUES (1, 10), (2, 20), (3, 30);
NOTICE:  issuing BEGIN TRANSACTION ISOLATION LEVEL READ COMMITTED;SELECT assign_distributed_transaction_id(xx, xx, 'xxxxxxx');
DETAIL:  on server cosmosdev@localhost:xxxxx connectionId: xxxxxxx
NOTICE:  issuing INSERT INTO single_shard_proc_opt.test_dist_109000 AS citus_table_alias (shard_key, other_key) VALUES (1,10)
DETAIL:  on server cosmosdev@localhost:xxxxx connectionId: xxxxxxx
NOTICE:  issuing INSERT INTO single_shard_proc_opt.test_dist_109001 AS citus_table_alias (shard_key, other_key) VALUES (3,30)
DETAIL:  on server cosmosdev@localhost:xxxxx connectionId: xxxxxxx
NOTICE:  issuing INSERT INTO single_shard_proc_opt.test_dist_109003 AS citus_table_alias (shard_key, other_key) VALUES (2,20)
DETAIL:  on server cosmosdev@localhost:xxxxx connectionId: xxxxxxx
NOTICE:  issuing PREPARE TRANSACTION 'citus_xx_xx_xx_xx'
DETAIL:  on server cosmosdev@localhost:xxxxx connectionId: xxxxxxx
NOTICE:  issuing COMMIT PREPARED 'citus_xx_xx_xx_xx'
DETAIL:  on server cosmosdev@localhost:xxxxx connectionId: xxxxxxx
CREATE OR REPLACE PROCEDURE two_updates_by_shard_key(k1 int, v1 int, k2 int, v2 int)
LANGUAGE plpgsql AS $$
BEGIN
    UPDATE test_dist SET other_key = v1 WHERE shard_key = k1;
    UPDATE test_dist SET other_key = v2 WHERE shard_key = k2;
END;
$$;
SET citus.enable_single_shard_procedure_optimization TO on;
CALL two_updates_by_shard_key(1, 111, 2, 222);
NOTICE:  issuing UPDATE single_shard_proc_opt.test_dist_109000 test_dist SET other_key = 111 WHERE (shard_key OPERATOR(pg_catalog.=) 1)
DETAIL:  on server cosmosdev@localhost:xxxxx connectionId: xxxxxxx
ERROR:  multi-statement procedures are not supported with citus.enable_single_shard_procedure_optimization
DETAIL:  The first statement has already been committed on the worker and cannot be rolled back.
HINT:  Use this optimization only for single-statement procedures, or disable the GUC.
CONTEXT:  SQL statement "UPDATE test_dist SET other_key = v2 WHERE shard_key = k2"
PL/pgSQL function two_updates_by_shard_key(integer,integer,integer,integer) line XX at SQL statement
-- Second UPDATE triggers ERROR; first UPDATE is also rolled back
SELECT * FROM test_dist ORDER BY shard_key;
NOTICE:  issuing SELECT shard_key, other_key FROM single_shard_proc_opt.test_dist_109000 test_dist WHERE true
DETAIL:  on server cosmosdev@localhost:xxxxx connectionId: xxxxxxx
NOTICE:  issuing SELECT shard_key, other_key FROM single_shard_proc_opt.test_dist_109001 test_dist WHERE true
DETAIL:  on server cosmosdev@localhost:xxxxx connectionId: xxxxxxx
NOTICE:  issuing SELECT shard_key, other_key FROM single_shard_proc_opt.test_dist_109002 test_dist WHERE true
DETAIL:  on server cosmosdev@localhost:xxxxx connectionId: xxxxxxx
NOTICE:  issuing SELECT shard_key, other_key FROM single_shard_proc_opt.test_dist_109003 test_dist WHERE true
DETAIL:  on server cosmosdev@localhost:xxxxx connectionId: xxxxxxx
 shard_key | other_key
---------------------------------------------------------------------
         1 |       111
         2 |        20
         3 |        30
(3 rows)

TRUNCATE test_dist;
NOTICE:  issuing BEGIN TRANSACTION ISOLATION LEVEL READ COMMITTED;SELECT assign_distributed_transaction_id(xx, xx, 'xxxxxxx');
DETAIL:  on server cosmosdev@localhost:xxxxx connectionId: xxxxxxx
NOTICE:  issuing TRUNCATE TABLE single_shard_proc_opt.test_dist_xxxxx CASCADE
DETAIL:  on server cosmosdev@localhost:xxxxx connectionId: xxxxxxx
NOTICE:  issuing TRUNCATE TABLE single_shard_proc_opt.test_dist_xxxxx CASCADE
DETAIL:  on server cosmosdev@localhost:xxxxx connectionId: xxxxxxx
NOTICE:  issuing TRUNCATE TABLE single_shard_proc_opt.test_dist_xxxxx CASCADE
DETAIL:  on server cosmosdev@localhost:xxxxx connectionId: xxxxxxx
NOTICE:  issuing TRUNCATE TABLE single_shard_proc_opt.test_dist_xxxxx CASCADE
DETAIL:  on server cosmosdev@localhost:xxxxx connectionId: xxxxxxx
NOTICE:  issuing PREPARE TRANSACTION 'citus_xx_xx_xx_xx'
DETAIL:  on server cosmosdev@localhost:xxxxx connectionId: xxxxxxx
NOTICE:  issuing COMMIT PREPARED 'citus_xx_xx_xx_xx'
DETAIL:  on server cosmosdev@localhost:xxxxx connectionId: xxxxxxx
---------------------------------------------------------------------
-- TEST 11: Single UPDATE by shard_key with optimization OFF
-- Normal coordinated transaction path
---------------------------------------------------------------------
INSERT INTO test_dist VALUES (1, 10), (2, 20), (3, 30);
NOTICE:  issuing BEGIN TRANSACTION ISOLATION LEVEL READ COMMITTED;SELECT assign_distributed_transaction_id(xx, xx, 'xxxxxxx');
DETAIL:  on server cosmosdev@localhost:xxxxx connectionId: xxxxxxx
NOTICE:  issuing INSERT INTO single_shard_proc_opt.test_dist_109000 AS citus_table_alias (shard_key, other_key) VALUES (1,10)
DETAIL:  on server cosmosdev@localhost:xxxxx connectionId: xxxxxxx
NOTICE:  issuing INSERT INTO single_shard_proc_opt.test_dist_109001 AS citus_table_alias (shard_key, other_key) VALUES (3,30)
DETAIL:  on server cosmosdev@localhost:xxxxx connectionId: xxxxxxx
NOTICE:  issuing INSERT INTO single_shard_proc_opt.test_dist_109003 AS citus_table_alias (shard_key, other_key) VALUES (2,20)
DETAIL:  on server cosmosdev@localhost:xxxxx connectionId: xxxxxxx
NOTICE:  issuing PREPARE TRANSACTION 'citus_xx_xx_xx_xx'
DETAIL:  on server cosmosdev@localhost:xxxxx connectionId: xxxxxxx
NOTICE:  issuing COMMIT PREPARED 'citus_xx_xx_xx_xx'
DETAIL:  on server cosmosdev@localhost:xxxxx connectionId: xxxxxxx
SET citus.enable_single_shard_procedure_optimization TO off;
CALL update_by_shard_key(3, 777);
NOTICE:  issuing BEGIN TRANSACTION ISOLATION LEVEL READ COMMITTED;SELECT assign_distributed_transaction_id(xx, xx, 'xxxxxxx');
DETAIL:  on server cosmosdev@localhost:xxxxx connectionId: xxxxxxx
NOTICE:  issuing UPDATE single_shard_proc_opt.test_dist_109001 test_dist SET other_key = 777 WHERE (shard_key OPERATOR(pg_catalog.=) 3)
DETAIL:  on server cosmosdev@localhost:xxxxx connectionId: xxxxxxx
NOTICE:  issuing COMMIT
DETAIL:  on server cosmosdev@localhost:xxxxx connectionId: xxxxxxx
SELECT * FROM test_dist ORDER BY shard_key;
NOTICE:  issuing SELECT shard_key, other_key FROM single_shard_proc_opt.test_dist_109000 test_dist WHERE true
DETAIL:  on server cosmosdev@localhost:xxxxx connectionId: xxxxxxx
NOTICE:  issuing SELECT shard_key, other_key FROM single_shard_proc_opt.test_dist_109001 test_dist WHERE true
DETAIL:  on server cosmosdev@localhost:xxxxx connectionId: xxxxxxx
NOTICE:  issuing SELECT shard_key, other_key FROM single_shard_proc_opt.test_dist_109002 test_dist WHERE true
DETAIL:  on server cosmosdev@localhost:xxxxx connectionId: xxxxxxx
NOTICE:  issuing SELECT shard_key, other_key FROM single_shard_proc_opt.test_dist_109003 test_dist WHERE true
DETAIL:  on server cosmosdev@localhost:xxxxx connectionId: xxxxxxx
 shard_key | other_key
---------------------------------------------------------------------
         1 |        10
         2 |        20
         3 |       777
(3 rows)

TRUNCATE test_dist;
NOTICE:  issuing BEGIN TRANSACTION ISOLATION LEVEL READ COMMITTED;SELECT assign_distributed_transaction_id(xx, xx, 'xxxxxxx');
DETAIL:  on server cosmosdev@localhost:xxxxx connectionId: xxxxxxx
NOTICE:  issuing TRUNCATE TABLE single_shard_proc_opt.test_dist_xxxxx CASCADE
DETAIL:  on server cosmosdev@localhost:xxxxx connectionId: xxxxxxx
NOTICE:  issuing TRUNCATE TABLE single_shard_proc_opt.test_dist_xxxxx CASCADE
DETAIL:  on server cosmosdev@localhost:xxxxx connectionId: xxxxxxx
NOTICE:  issuing TRUNCATE TABLE single_shard_proc_opt.test_dist_xxxxx CASCADE
DETAIL:  on server cosmosdev@localhost:xxxxx connectionId: xxxxxxx
NOTICE:  issuing TRUNCATE TABLE single_shard_proc_opt.test_dist_xxxxx CASCADE
DETAIL:  on server cosmosdev@localhost:xxxxx connectionId: xxxxxxx
NOTICE:  issuing PREPARE TRANSACTION 'citus_xx_xx_xx_xx'
DETAIL:  on server cosmosdev@localhost:xxxxx connectionId: xxxxxxx
NOTICE:  issuing COMMIT PREPARED 'citus_xx_xx_xx_xx'
DETAIL:  on server cosmosdev@localhost:xxxxx connectionId: xxxxxxx
---------------------------------------------------------------------
-- TEST 12: INSERT + UPDATE in same procedure with optimization ON
-- Should ERROR on the second statement (UPDATE)
---------------------------------------------------------------------
CREATE OR REPLACE PROCEDURE insert_then_update(val int, upd_key int, new_other int)
LANGUAGE plpgsql AS $$
BEGIN
    INSERT INTO test_dist VALUES (val, val * 10);
    UPDATE test_dist SET other_key = new_other WHERE shard_key = upd_key;
END;
$$;
SET citus.enable_single_shard_procedure_optimization TO on;
CALL insert_then_update(5, 5, 555);
NOTICE:  issuing INSERT INTO single_shard_proc_opt.test_dist_109000 (shard_key, other_key) VALUES (5, 50)
DETAIL:  on server cosmosdev@localhost:xxxxx connectionId: xxxxxxx
ERROR:  multi-statement procedures are not supported with citus.enable_single_shard_procedure_optimization
DETAIL:  The first statement has already been committed on the worker and cannot be rolled back.
HINT:  Use this optimization only for single-statement procedures, or disable the GUC.
CONTEXT:  SQL statement "UPDATE test_dist SET other_key = new_other WHERE shard_key = upd_key"
PL/pgSQL function insert_then_update(integer,integer,integer) line XX at SQL statement
SELECT * FROM test_dist ORDER BY shard_key;
NOTICE:  issuing SELECT shard_key, other_key FROM single_shard_proc_opt.test_dist_109000 test_dist WHERE true
DETAIL:  on server cosmosdev@localhost:xxxxx connectionId: xxxxxxx
NOTICE:  issuing SELECT shard_key, other_key FROM single_shard_proc_opt.test_dist_109001 test_dist WHERE true
DETAIL:  on server cosmosdev@localhost:xxxxx connectionId: xxxxxxx
NOTICE:  issuing SELECT shard_key, other_key FROM single_shard_proc_opt.test_dist_109002 test_dist WHERE true
DETAIL:  on server cosmosdev@localhost:xxxxx connectionId: xxxxxxx
NOTICE:  issuing SELECT shard_key, other_key FROM single_shard_proc_opt.test_dist_109003 test_dist WHERE true
DETAIL:  on server cosmosdev@localhost:xxxxx connectionId: xxxxxxx
 shard_key | other_key
---------------------------------------------------------------------
         5 |        50
(1 row)

TRUNCATE test_dist;
NOTICE:  issuing BEGIN TRANSACTION ISOLATION LEVEL READ COMMITTED;SELECT assign_distributed_transaction_id(xx, xx, 'xxxxxxx');
DETAIL:  on server cosmosdev@localhost:xxxxx connectionId: xxxxxxx
NOTICE:  issuing TRUNCATE TABLE single_shard_proc_opt.test_dist_xxxxx CASCADE
DETAIL:  on server cosmosdev@localhost:xxxxx connectionId: xxxxxxx
NOTICE:  issuing TRUNCATE TABLE single_shard_proc_opt.test_dist_xxxxx CASCADE
DETAIL:  on server cosmosdev@localhost:xxxxx connectionId: xxxxxxx
NOTICE:  issuing TRUNCATE TABLE single_shard_proc_opt.test_dist_xxxxx CASCADE
DETAIL:  on server cosmosdev@localhost:xxxxx connectionId: xxxxxxx
NOTICE:  issuing TRUNCATE TABLE single_shard_proc_opt.test_dist_xxxxx CASCADE
DETAIL:  on server cosmosdev@localhost:xxxxx connectionId: xxxxxxx
NOTICE:  issuing PREPARE TRANSACTION 'citus_xx_xx_xx_xx'
DETAIL:  on server cosmosdev@localhost:xxxxx connectionId: xxxxxxx
NOTICE:  issuing COMMIT PREPARED 'citus_xx_xx_xx_xx'
DETAIL:  on server cosmosdev@localhost:xxxxx connectionId: xxxxxxx
---------------------------------------------------------------------
-- TEST 13: UPDATE modifying the shard_key itself with optimization ON
-- Citus does not allow modifying the distribution column, so this
-- should ERROR regardless of the optimization setting.
---------------------------------------------------------------------
INSERT INTO test_dist VALUES (1, 10), (2, 20), (3, 30);
NOTICE:  issuing BEGIN TRANSACTION ISOLATION LEVEL READ COMMITTED;SELECT assign_distributed_transaction_id(xx, xx, 'xxxxxxx');
DETAIL:  on server cosmosdev@localhost:xxxxx connectionId: xxxxxxx
NOTICE:  issuing INSERT INTO single_shard_proc_opt.test_dist_109000 AS citus_table_alias (shard_key, other_key) VALUES (1,10)
DETAIL:  on server cosmosdev@localhost:xxxxx connectionId: xxxxxxx
NOTICE:  issuing INSERT INTO single_shard_proc_opt.test_dist_109001 AS citus_table_alias (shard_key, other_key) VALUES (3,30)
DETAIL:  on server cosmosdev@localhost:xxxxx connectionId: xxxxxxx
NOTICE:  issuing INSERT INTO single_shard_proc_opt.test_dist_109003 AS citus_table_alias (shard_key, other_key) VALUES (2,20)
DETAIL:  on server cosmosdev@localhost:xxxxx connectionId: xxxxxxx
NOTICE:  issuing PREPARE TRANSACTION 'citus_xx_xx_xx_xx'
DETAIL:  on server cosmosdev@localhost:xxxxx connectionId: xxxxxxx
NOTICE:  issuing COMMIT PREPARED 'citus_xx_xx_xx_xx'
DETAIL:  on server cosmosdev@localhost:xxxxx connectionId: xxxxxxx
CREATE OR REPLACE PROCEDURE update_shard_key_value(old_key int, new_key int)
LANGUAGE plpgsql AS $$
BEGIN
    UPDATE test_dist SET shard_key = new_key WHERE shard_key = old_key;
END;
$$;
SET citus.enable_single_shard_procedure_optimization TO on;
CALL update_shard_key_value(2, 200);
ERROR:  modifying the partition value of rows is not allowed
CONTEXT:  SQL statement "UPDATE test_dist SET shard_key = new_key WHERE shard_key = old_key"
PL/pgSQL function update_shard_key_value(integer,integer) line XX at SQL statement
SELECT * FROM test_dist ORDER BY shard_key;
NOTICE:  issuing SELECT shard_key, other_key FROM single_shard_proc_opt.test_dist_109000 test_dist WHERE true
DETAIL:  on server cosmosdev@localhost:xxxxx connectionId: xxxxxxx
NOTICE:  issuing SELECT shard_key, other_key FROM single_shard_proc_opt.test_dist_109001 test_dist WHERE true
DETAIL:  on server cosmosdev@localhost:xxxxx connectionId: xxxxxxx
NOTICE:  issuing SELECT shard_key, other_key FROM single_shard_proc_opt.test_dist_109002 test_dist WHERE true
DETAIL:  on server cosmosdev@localhost:xxxxx connectionId: xxxxxxx
NOTICE:  issuing SELECT shard_key, other_key FROM single_shard_proc_opt.test_dist_109003 test_dist WHERE true
DETAIL:  on server cosmosdev@localhost:xxxxx connectionId: xxxxxxx
 shard_key | other_key
---------------------------------------------------------------------
         1 |        10
         2 |        20
         3 |        30
(3 rows)

TRUNCATE test_dist;
NOTICE:  issuing BEGIN TRANSACTION ISOLATION LEVEL READ COMMITTED;SELECT assign_distributed_transaction_id(xx, xx, 'xxxxxxx');
DETAIL:  on server cosmosdev@localhost:xxxxx connectionId: xxxxxxx
NOTICE:  issuing TRUNCATE TABLE single_shard_proc_opt.test_dist_xxxxx CASCADE
DETAIL:  on server cosmosdev@localhost:xxxxx connectionId: xxxxxxx
NOTICE:  issuing TRUNCATE TABLE single_shard_proc_opt.test_dist_xxxxx CASCADE
DETAIL:  on server cosmosdev@localhost:xxxxx connectionId: xxxxxxx
NOTICE:  issuing TRUNCATE TABLE single_shard_proc_opt.test_dist_xxxxx CASCADE
DETAIL:  on server cosmosdev@localhost:xxxxx connectionId: xxxxxxx
NOTICE:  issuing TRUNCATE TABLE single_shard_proc_opt.test_dist_xxxxx CASCADE
DETAIL:  on server cosmosdev@localhost:xxxxx connectionId: xxxxxxx
NOTICE:  issuing PREPARE TRANSACTION 'citus_xx_xx_xx_xx'
DETAIL:  on server cosmosdev@localhost:xxxxx connectionId: xxxxxxx
NOTICE:  issuing COMMIT PREPARED 'citus_xx_xx_xx_xx'
DETAIL:  on server cosmosdev@localhost:xxxxx connectionId: xxxxxxx
-- Cleanup
SET citus.log_remote_commands TO off;
DROP TABLE test_dist;
DROP PROCEDURE single_insert;
DROP PROCEDURE two_single_inserts;
DROP PROCEDURE multi_then_single;
DROP PROCEDURE outer_proc;
DROP PROCEDURE update_by_shard_key;
DROP PROCEDURE update_by_other_key;
DROP PROCEDURE two_updates_by_shard_key;
DROP PROCEDURE insert_then_update;
DROP PROCEDURE update_shard_key_value;
DROP SCHEMA single_shard_proc_opt;
RESET citus.enable_single_shard_procedure_optimization;
RESET citus.enable_local_execution;
RESET citus.log_remote_commands;
RESET citus.shard_count;
RESET citus.shard_replication_factor;
