--
-- SINGLE_TASK_EXECUTION
--
-- Validates the single-task (one-task) adaptive executor:
--   1. Produces identical results to the full adaptive executor
--   2. Shows "Citus Single Task" in EXPLAIN plans
--   3. Handles single-row and multi-row results
--   4. Covers simple and complex fast-path queries
--
CREATE SCHEMA single_task_execution;
SET search_path TO single_task_execution;
SET citus.next_shard_id TO 99900000;
SET citus.shard_count TO 4;
SET citus.shard_replication_factor TO 1;
-- Create test tables
CREATE TABLE kv (key int PRIMARY KEY, value text, num int);
SELECT create_distributed_table('kv', 'key');
 create_distributed_table
---------------------------------------------------------------------

(1 row)

CREATE TABLE kv_multi (key int, seq int, payload text, PRIMARY KEY (key, seq));
SELECT create_distributed_table('kv_multi', 'key');
 create_distributed_table
---------------------------------------------------------------------

(1 row)

-- Load test data: single-row per key in kv, multiple rows per key in kv_multi
INSERT INTO kv SELECT g, 'val_' || g, g * 10 FROM generate_series(1, 100) g;
INSERT INTO kv_multi SELECT g / 10, g, repeat('x', g % 50 + 1) FROM generate_series(1, 200) g;
-- ============================================================
-- PART 1: EXPLAIN validation - confirm plan uses Single Task executor
-- ============================================================
-- Simple point SELECT
EXPLAIN (COSTS OFF) SELECT * FROM kv WHERE key = 1;
                           QUERY PLAN
---------------------------------------------------------------------
 Custom Scan (Citus Single Task)
   Task Count: 1
   Tasks Shown: All
   ->  Task
         Node: host=localhost port=xxxxx dbname=regression
         ->  Index Scan using kv_pkey_99900000 on kv_99900000 kv
               Index Cond: (key = 1)
(7 rows)

-- Point UPDATE
EXPLAIN (COSTS OFF) UPDATE kv SET value = 'updated' WHERE key = 1;
                              QUERY PLAN
---------------------------------------------------------------------
 Custom Scan (Citus Single Task)
   Task Count: 1
   Tasks Shown: All
   ->  Task
         Node: host=localhost port=xxxxx dbname=regression
         ->  Update on kv_99900000 kv
               ->  Index Scan using kv_pkey_99900000 on kv_99900000 kv
                     Index Cond: (key = 1)
(8 rows)

-- Point DELETE
EXPLAIN (COSTS OFF) DELETE FROM kv WHERE key = 1;
                              QUERY PLAN
---------------------------------------------------------------------
 Custom Scan (Citus Single Task)
   Task Count: 1
   Tasks Shown: All
   ->  Task
         Node: host=localhost port=xxxxx dbname=regression
         ->  Delete on kv_99900000 kv
               ->  Index Scan using kv_pkey_99900000 on kv_99900000 kv
                     Index Cond: (key = 1)
(8 rows)

-- INSERT with ON CONFLICT
EXPLAIN (COSTS OFF) INSERT INTO kv (key, value, num) VALUES (1, 'x', 0)
  ON CONFLICT (key) DO UPDATE SET num = kv.num + 1;
                        QUERY PLAN
---------------------------------------------------------------------
 Custom Scan (Citus Single Task)
   Task Count: 1
   Tasks Shown: All
   ->  Task
         Node: host=localhost port=xxxxx dbname=regression
         ->  Insert on kv_99900000 citus_table_alias
               Conflict Resolution: UPDATE
               Conflict Arbiter Indexes: kv_pkey_99900000
               ->  Result
(9 rows)

-- SELECT with expression in target list
EXPLAIN (COSTS OFF) SELECT key, upper(value), num * 2 AS doubled FROM kv WHERE key = 42;
                           QUERY PLAN
---------------------------------------------------------------------
 Custom Scan (Citus Single Task)
   Task Count: 1
   Tasks Shown: All
   ->  Task
         Node: host=localhost port=xxxxx dbname=regression
         ->  Index Scan using kv_pkey_99900003 on kv_99900003 kv
               Index Cond: (key = 42)
(7 rows)

-- SELECT with LIMIT (still single-shard, should use single-task)
EXPLAIN (COSTS OFF) SELECT * FROM kv WHERE key = 5 LIMIT 1;
                              QUERY PLAN
---------------------------------------------------------------------
 Custom Scan (Citus Single Task)
   Task Count: 1
   Tasks Shown: All
   ->  Task
         Node: host=localhost port=xxxxx dbname=regression
         ->  Limit
               ->  Index Scan using kv_pkey_99900000 on kv_99900000 kv
                     Index Cond: (key = 5)
(8 rows)

-- Multi-row per shard key: point lookup with multiple results
EXPLAIN (COSTS OFF) SELECT * FROM kv_multi WHERE key = 5 ORDER BY seq;
                             QUERY PLAN
---------------------------------------------------------------------
 Custom Scan (Citus Single Task)
   Task Count: 1
   Tasks Shown: All
   ->  Task
         Node: host=localhost port=xxxxx dbname=regression
         ->  Sort
               Sort Key: seq
               ->  Bitmap Heap Scan on kv_multi_99900004 kv_multi
                     Recheck Cond: (key = 5)
                     ->  Bitmap Index Scan on kv_multi_pkey_99900004
                           Index Cond: (key = 5)
(11 rows)

-- ============================================================
-- PART 2: Results equivalence - ON vs OFF must produce same results
-- ============================================================
-- Run queries with single-task ON and capture results
SET citus.enable_single_task_execution TO on;
-- Single-row point lookups
SELECT * FROM kv WHERE key = 1;
 key | value | num
---------------------------------------------------------------------
   1 | val_1 |  10
(1 row)

SELECT * FROM kv WHERE key = 50;
 key | value  | num
---------------------------------------------------------------------
  50 | val_50 | 500
(1 row)

SELECT * FROM kv WHERE key = 99;
 key | value  | num
---------------------------------------------------------------------
  99 | val_99 | 990
(1 row)

-- Point lookup with expressions
SELECT key, upper(value) AS uval, num + 100 AS shifted FROM kv WHERE key = 42;
 key |  uval  | shifted
---------------------------------------------------------------------
  42 | VAL_42 |     520
(1 row)

-- Multi-row: all rows for a shard key value
SELECT * FROM kv_multi WHERE key = 5 ORDER BY seq;
 key | seq |  payload
---------------------------------------------------------------------
   5 |  50 | x
   5 |  51 | xx
   5 |  52 | xxx
   5 |  53 | xxxx
   5 |  54 | xxxxx
   5 |  55 | xxxxxx
   5 |  56 | xxxxxxx
   5 |  57 | xxxxxxxx
   5 |  58 | xxxxxxxxx
   5 |  59 | xxxxxxxxxx
(10 rows)

-- Multi-row with aggregate
SELECT key, count(*), max(length(payload)) FROM kv_multi WHERE key = 10 GROUP BY key;
 key | count | max
---------------------------------------------------------------------
  10 |    10 |  10
(1 row)

-- UPDATE RETURNING
UPDATE kv SET num = num + 1 WHERE key = 7 RETURNING key, num;
 key | num
---------------------------------------------------------------------
   7 |  71
(1 row)

-- INSERT ON CONFLICT RETURNING
INSERT INTO kv (key, value, num) VALUES (7, 'conflict', 999)
  ON CONFLICT (key) DO UPDATE SET num = kv.num + 1
  RETURNING key, value, num;
 key | value | num
---------------------------------------------------------------------
   7 | val_7 |  72
(1 row)

-- DELETE RETURNING
DELETE FROM kv WHERE key = 100 RETURNING *;
 key |  value  | num
---------------------------------------------------------------------
 100 | val_100 | 1000
(1 row)

-- Now run exact same queries with single-task OFF
SET citus.enable_single_task_execution TO off;
-- Single-row point lookups (same key values)
SELECT * FROM kv WHERE key = 1;
 key | value | num
---------------------------------------------------------------------
   1 | val_1 |  10
(1 row)

SELECT * FROM kv WHERE key = 50;
 key | value  | num
---------------------------------------------------------------------
  50 | val_50 | 500
(1 row)

SELECT * FROM kv WHERE key = 99;
 key | value  | num
---------------------------------------------------------------------
  99 | val_99 | 990
(1 row)

-- Point lookup with expressions
SELECT key, upper(value) AS uval, num + 100 AS shifted FROM kv WHERE key = 42;
 key |  uval  | shifted
---------------------------------------------------------------------
  42 | VAL_42 |     520
(1 row)

-- Multi-row: all rows for a shard key value
SELECT * FROM kv_multi WHERE key = 5 ORDER BY seq;
 key | seq |  payload
---------------------------------------------------------------------
   5 |  50 | x
   5 |  51 | xx
   5 |  52 | xxx
   5 |  53 | xxxx
   5 |  54 | xxxxx
   5 |  55 | xxxxxx
   5 |  56 | xxxxxxx
   5 |  57 | xxxxxxxx
   5 |  58 | xxxxxxxxx
   5 |  59 | xxxxxxxxxx
(10 rows)

-- Multi-row with aggregate
SELECT key, count(*), max(length(payload)) FROM kv_multi WHERE key = 10 GROUP BY key;
 key | count | max
---------------------------------------------------------------------
  10 |    10 |  10
(1 row)

-- ============================================================
-- PART 3: Complex fast-path queries that still qualify
-- ============================================================
SET citus.enable_single_task_execution TO on;
-- Subquery in target list
SELECT key, (SELECT count(*) FROM kv_multi m WHERE m.key = kv.key) AS child_count
FROM kv WHERE key = 5;
 key | child_count
---------------------------------------------------------------------
   5 |          10
(1 row)

-- CASE expression
SELECT key,
       CASE WHEN num > 500 THEN 'high' WHEN num > 200 THEN 'mid' ELSE 'low' END AS tier
FROM kv WHERE key = 50;
 key | tier
---------------------------------------------------------------------
  50 | mid
(1 row)

-- Coalesce and NULL handling
SELECT key, coalesce(value, 'missing') AS val, coalesce(NULL::int, num, 0) AS n
FROM kv WHERE key = 1;
 key |  val  | n
---------------------------------------------------------------------
   1 | val_1 | 10
(1 row)

-- Multiple conditions on same shard key (key = X AND ...)
SELECT * FROM kv WHERE key = 42 AND num > 100 AND value LIKE 'val%';
 key | value  | num
---------------------------------------------------------------------
  42 | val_42 | 420
(1 row)

-- ORDER BY with LIMIT on multi-row table
SELECT * FROM kv_multi WHERE key = 5 ORDER BY seq DESC LIMIT 3;
 key | seq |  payload
---------------------------------------------------------------------
   5 |  59 | xxxxxxxxxx
   5 |  58 | xxxxxxxxx
   5 |  57 | xxxxxxxx
(3 rows)

-- FOR UPDATE (supported for replication_factor = 1)
SELECT * FROM kv WHERE key = 10 FOR UPDATE;
 key | value  | num
---------------------------------------------------------------------
  10 | val_10 | 100
(1 row)

-- CTE that reads from same shard
WITH recent AS (
    SELECT * FROM kv_multi WHERE key = 8 ORDER BY seq DESC LIMIT 5
)
SELECT key, seq, length(payload) AS plen FROM recent ORDER BY seq;
 key | seq | plen
---------------------------------------------------------------------
   8 |  85 |   36
   8 |  86 |   37
   8 |  87 |   38
   8 |  88 |   39
   8 |  89 |   40
(5 rows)

-- ============================================================
-- PART 4: Queries that should NOT use single-task executor
-- ============================================================
-- Multi-shard query (no equality on distribution column)
EXPLAIN (COSTS OFF) SELECT count(*) FROM kv;
                           QUERY PLAN
---------------------------------------------------------------------
 Aggregate
   ->  Custom Scan (Citus Adaptive)
         Task Count: 4
         Tasks Shown: One of 4
         ->  Task
               Node: host=localhost port=xxxxx dbname=regression
               ->  Aggregate
                     ->  Seq Scan on kv_99900000 kv
(8 rows)

-- Range condition on distribution column
EXPLAIN (COSTS OFF) SELECT * FROM kv WHERE key > 50;
                        QUERY PLAN
---------------------------------------------------------------------
 Custom Scan (Citus Adaptive)
   Task Count: 4
   Tasks Shown: One of 4
   ->  Task
         Node: host=localhost port=xxxxx dbname=regression
         ->  Bitmap Heap Scan on kv_99900000 kv
               Recheck Cond: (key > 50)
               ->  Bitmap Index Scan on kv_pkey_99900000
                     Index Cond: (key > 50)
(9 rows)

-- ============================================================
-- PART 5: GUC toggle - disabled means plans revert to full adaptive
-- ============================================================
SET citus.enable_single_task_execution TO off;
-- Same query that was Single Task before should now show "Citus Adaptive"
EXPLAIN (COSTS OFF) SELECT * FROM kv WHERE key = 1;
                           QUERY PLAN
---------------------------------------------------------------------
 Custom Scan (Citus Adaptive)
   Task Count: 1
   Tasks Shown: All
   ->  Task
         Node: host=localhost port=xxxxx dbname=regression
         ->  Index Scan using kv_pkey_99900000 on kv_99900000 kv
               Index Cond: (key = 1)
(7 rows)

EXPLAIN (COSTS OFF) UPDATE kv SET value = 'x' WHERE key = 1;
                              QUERY PLAN
---------------------------------------------------------------------
 Custom Scan (Citus Adaptive)
   Task Count: 1
   Tasks Shown: All
   ->  Task
         Node: host=localhost port=xxxxx dbname=regression
         ->  Update on kv_99900000 kv
               ->  Index Scan using kv_pkey_99900000 on kv_99900000 kv
                     Index Cond: (key = 1)
(8 rows)

-- ============================================================
-- Cleanup
-- ============================================================
SET citus.enable_single_task_execution TO on;
DROP SCHEMA single_task_execution CASCADE;
NOTICE:  drop cascades to 2 other objects
DETAIL:  drop cascades to table kv
drop cascades to table kv_multi
